[
  {
    "user_input":"阿米娅是什么角色？",
    "retrieved_contexts":[
      "# 阿米娅\n\n# 其他名称\n\n魔王;小小的魔王;异族的稚儿;异族的魔王;小兔子;温柔的孩子;娇小的卡特斯;新的魔王;我王;卡特斯女孩;文明的存续的继承者;巴别塔的领导者;阿米娅小姐;兔子小姐\n\n## 简要介绍\n\n阿米娅是罗德岛制药公司的公开领袖，一位充满理想与坚韧的卡特斯少女。她在一场车祸中失去双亲并感染矿石病，后被失忆前的博士救下，并与特蕾西娅、凯尔希共同组建巴别塔。特蕾西娅遇刺后，阿米娅继承了萨卡兹“魔王”的王冠与力量，肩负起终结感染者苦难、切断仇恨循环的使命。她拥有感知他人情感的独特源石技艺。尽管外表柔弱，阿米娅在博士和凯尔希的陪伴下，带领罗德岛穿越泰拉的动荡，直面萨卡兹的千年宿命与维多利亚的战火，展现出超越年龄的智慧、勇气与对和平的坚定追求，是罗德岛理念的核心象征。\n\n## 相关角色\n\n- 博士阿米娅最信任的伙伴，罗德岛的最高指挥官。博士是阿米娅的救命恩人、精神支柱和最重要的同伴。阿米娅将自己早年的野外生存技能归功于博士，并对他抱有无条件的信任与依赖，多次舍身保护他，甚至在极端危机中将罗德岛指挥权托付。博士的回归是阿米娅做出的“豪赌”，两人共同承担罗德岛的使命，并约定无论未来如何都将并肩作战，阿米娅更誓言若博士误入歧途，她将是唯一能阻止他的人。\n- 凯尔希罗德岛的资深医生与重要成员，阿米娅的导师和引路人。她在特蕾西娅遇刺后，成为阿米娅成长路上的关键指引者，密切关注阿米娅对“魔王”力量的适应与使用，并为其提供战略支持与医疗保障。阿米娅信任凯尔希的判断，但也体恤她的辛劳，有时选择独自承担压力。凯尔希视阿米娅为罗德岛的未来，并与她共同描绘感染者的希望。\n- 特蕾西娅前任“魔王”，巴别塔的领袖，阿米娅力量与意志的来源。她如慈母般关爱幼年阿米娅，并在遇刺前将“黑王冠”和“文明的存续”力量传承给阿米娅，希望她改写宿命。特蕾西娅的幻影与意志多次在阿米娅的梦境和精神深潜中显现，指引她理解萨卡兹的苦难，并最终在“慈悲灯塔”活动中完成力量的正式传承，让阿米娅明确了作为“魔王”的使命。\n- 煌罗德岛精英干员，阿米娅的亲密战友和朋友。阿米娅信任煌的战斗力，也关心她的情感状态，在她迷茫时给予支持和鼓励，并会以请吃咖喱等方式安抚。煌亲昵地称呼阿米娅为“小兔子”，对阿米娅忠诚且听从指挥。\n- 陈龙门近卫局警司，阿米娅的朋友与合作者。两人在切尔诺伯格与龙门危机中并肩作战，阿米娅理解陈的坚韧与内心的挣扎，并在危急时刻与其情感共鸣，掌握了陈的剑术。阿米娅对陈的态度从最初的“严格”到后来的信任与相互理解。\n- 塔露拉整合运动领袖，陈晖洁的姐姐。阿米娅在切尔诺诺格核心城与被科西切操控的塔露拉进行了决定性对决，通过感知与呼唤唤醒了塔露拉本身的意志，帮助她摆脱了科西切的诅咒。两人之间的纠葛远未结束，阿米娅预感她们终将重逢。\n- 梅菲斯特整合运动干部，手段残忍。阿米娅对其非人道行为深感厌恶和愤怒，直斥其恶毒，并拒绝赋予他任何“光荣”的死亡。阿米娅多次与他交锋，并誓言清理其“怨恨的毒”。\n- 霜星整合运动雪怪小队队长。阿米娅通过感知情感，理解了霜星内心深处的痛苦与愤怒，并试图用罗德岛的理念感化她。霜星在濒死之际将希望托付给阿米娅，阿米娅则将一种治疗霜冻的药物命名为“霜星”以作纪念。\n- 爱国者整合运动温迪戈战士。阿米娅在“苦难摇篮”中与爱国者对峙，感知到他两百多年的痛苦与悔恨，并试图为他带来“更好的结局”。爱国者在生命的最后识破了阿米娅“魔王”的身份，并将停止核心城的秘钥托付给她，感叹“我王......你往何处去？”。\n- W前巴别塔佣兵，后加入整合运动。她对阿米娅与博士抱有复杂情感，既是搅局者也是合作者。W曾嘲讽罗德岛干员的牺牲“毫无价值”，被阿米娅愤怒驳斥。在关键时刻，她协助罗德岛停止切尔诺伯格，并最终在特蕾西娅的引导下放下过去，成为“维什戴尔”。\n- **Logos**：罗德岛精英干员，女妖王庭之主。他忠实地追随特蕾西娅的理想，并坚定地保护阿米娅。在对抗血魔大君和萨卡兹众魂时，Logos与阿米娅并肩作战，其“丧钟”力量与阿米娅的“魔王”力量产生共鸣，是阿米娅信赖的战友。\n- 暴行罗德岛精英干员，阿米娅的亲密朋友与如同姐姐般的存在。她幼年时曾照顾阿米娅，对她充满牵挂。得知阿米娅成为罗德岛领袖后，暴行被其感召，决定加入罗德岛，誓言倾尽所有力量保护阿米娅。阿米娅也依赖她，并与她分享生活乐趣。\n- 华法琳罗德岛资深医生。她曾是阿米娅在罗德岛的“第一个病人”，密切关注阿米娅的身体和精神健康，并提醒她控制“魔王”力量的使用。她对阿米娅的成长抱有深切的期望，希望她能活着回来。\n- 迷迭香罗德岛精英干员，与阿米娅关系深厚。阿米娅能通过精神链接安抚迷迭香的负面情绪，并对她抱有极高的尊重与关心。迷迭香将阿米娅视为亲近的家人。\n- 米莎一个乌萨斯感染者少女，被整合运动利用。阿米娅在",
      "# 阿米娅\n## 干员名: 阿米娅\n## 干员外文名: Amiya アーミヤ\n## 星级: 5\n## 职业: 术师\n## 分支: 中坚术师\n## 特性: 攻击造成法术伤害\n## 所属势力: 罗德岛\n## 隐藏势力: 无\n## 获得方式: 主线剧情 （首次通关主题曲2-10、3-8、4-9、6-17、7-18获取）\n## 上线时间: 2019年4月30日 10:00\n## 画师: 唯@W\n## 配音\n  中文: 陶典\n  日文: 黑泽朋世\n  韩文: 李智贤\n  英文: Emma Ballantine\n## 生命上限_攻击_防御_法术抗性\n  精英0_1级: 699 276 48 10\n  精英0_满级: 958 390 81 10\n  精英1_满级: 1198 514 110 15\n  精英2_满级: 1480 612 121 20\n  信赖加成上限: 200 70 0 0\n## 再部署: 70s\n## 部署费用: 18→20\n## 阻挡数: 1\n## 攻击速度: 1.6s\n## 攻击范围\n  精英0范围: ['XXX', 'TXX', 'XXX']\n  精英1_精英2范围: ['XXX.', 'TXXX', 'XXX.']\n## 技能\n  - 名称: 战术咏唱·γ型, 类型: 自动回复 手动触发, Level 7_初始_消耗_持续: 攻击速度+60 | 10 32 30, Rank Ⅲ_初始_消耗_持续: 攻击速度+90 | 15 30 30\n  - 名称: 精神爆发, 类型: 自动回复 自动触发, Level 7_初始_消耗_持续: 每次攻击变为攻击力45%的7连发，随机攻击范围内的目标 技能自动开启，持续时间结束后阿米娅晕眩10秒 | 0 100 25, Rank Ⅲ_初始_消耗_持续: 每次攻击变为攻击力60%的8连发，随机攻击范围内的目标 技能自动开启，持续时间结束后阿米娅晕眩10秒 | 0 100 25\n  - 名称: 奇美拉, 类型: 自动回复 手动触发, Level 7_初始_消耗_持续: 攻击力+160%，生命上限+75%，攻击范围扩大，伤害类型变为真实 技能结束后阿米娅强制退出战场 | 0 120 30, Rank Ⅲ_初始_消耗_持续: 攻击力+230%，生命上限+100%，攻击范围扩大，伤害类型变为真实 技能结束后阿米娅强制退出战场 | 0 120 30, 备注: ※强制退出战场视为撤回干员，返还部分部署费用\n## 天赋\n  - 名称: ？？？, ——: ？？？？？\n  - 名称: 情绪吸收, 精英2: 成功造成伤害后额外回复2（潜能6：+1）点技力，消灭敌人后额外获得8（潜能6：+2）点技力, 精英2 Y模组2级: 成功造成伤害后额外回复3（潜能6：+1）点技力，消灭敌人后额外获得8（潜能6：+2）点技力, 精英2 Y模组3级: 成功造成伤害后额外回复3（潜能6：+1）点技力，消灭敌人后额外获得10（潜能6：+2）点技力\n## 潜能提升\n  备注: 该干员无法使用通用信物来提升潜能。\n  潜能提升2: 生命上限+200\n  潜能提升3: 部署费用-1\n  潜能提升4: 攻击力+30\n  潜能提升5: 部署费用-1\n  潜能提升6: 天赋效果增强\n## 后勤技能\n  - 条件: 精英0, 技能: 合作协议, 房间: 控制中枢, 描述: 进驻控制中枢时，所有贸易站订单效率+7%（同种效果取最高）\n  - 条件: 精英2, 技能: 小提琴独奏, 房间: 宿舍, 描述: 进驻宿舍时，该宿舍内所有干员的心情每小时恢复+0.15（同种效果取最高）\n## 模组\n  DWDB-221E: {'阶段1': {'属性': '生命+100 攻击+30', '描述': '特性追加：普通攻击命中精英或领袖敌人时获得1点技力'}, '阶段2': {'属性': '生命+130 攻击+40', '描述': '天赋【情绪吸收】更新 成功造成伤害后额外回复3点技力，消灭敌人后额外获得8点技力'}, '阶段3': {'属性': '生命+150 攻击+50', '描述': '天赋【情绪吸收】更新 成功造成伤害后额外回复3点技力，消灭敌人后额外获得10点技力'}, '解锁任务': '由非助战阿米娅累计歼灭10个精英或领袖敌人 3星通关主题曲3-8；必须编入非助战中坚术师状态的阿米娅并上场，且使用中坚术师状态的阿米娅歼灭碎骨'}",
      "# 自有一“派”\n\n# 剧情总结\n\n本次活动“自有一‘派’”的剧情围绕着雷姆必拓矿业公司驻罗德岛办事处的干员暴行，以及她与阿米娅、博士等人的互动展开。故事始于阿米娅因博士、凯尔希和特蕾西娅外出而感到无聊，前来寻找暴行。暴行提议教阿米娅制作她最喜欢的雷姆必拓特色美食——胡萝卜派。在温馨愉快的氛围中，两人开始准备食材。阿米娅虽然是第一次尝试烹饪，显得手忙脚乱，状况百出，比如打蛋打得一团糟，洗胡萝卜时用指甲刮皮，和面和烤制等高难度步骤也需要暴行代劳，甚至不小心把面粉撒得到处都是。尽管过程有些混乱，暴行始终耐心而宠溺地指导阿米娅，并认为此刻的阿米娅非常可爱。两人合作完成了三个胡萝卜派，及时赶在阿米娅、博士以及受邀的其他干员（莱恩哈特、断崖、四月）前来品尝前烤好。\n\n在餐厅的品尝环节，莱恩哈特、断崖和四月已经先到一步，正在愉快地享用暴行制作的派。莱恩哈特展示了他独特的、加入大量番茄酱的维多利亚式吃法，引发了四月和断崖的吐槽以及暴行的制止，场面显得十分热闹。阿米娅和博士随后加入，看到大家一起分享美食的场景。\n\n阿米娅品尝了暴行制作的胡萝卜派，立刻被那熟悉的家乡味道勾起了回忆，感到非常美味和安心。暴行也为博士准备了一份根据其口味特别制作的派，这让博士意识到暴行似乎了解过去的自己。暴行坦承自己确实了解过去的博士，但因与凯尔希有保密协议而不能透露太多，这引发了对博士失忆背景的侧面描写。阿米娅回忆起小时候暴行姐姐对她的照顾，并表达了希望未来能继续与暴行一起做美食、一直在一起的愿望。然而，她也提到了凯尔希医生曾说过，雷姆必拓矿业公司与巴别塔（罗德岛前身）的合作项目即将结束，暴行可能要回雷姆必拓。\n\n这个话题触及了分别的可能性，暴行确认了她确实可能要回雷姆必拓工作一段时间，承担大人的责任。但她向阿米娅承诺，无论分隔多远，她们都是好朋友，只要阿米娅需要帮助，她一定会来保护她。她鼓励阿米娅努力学习成长，未来或许也能开一家公司，甚至雇佣自己。暴行肯定了阿米娅在博士、凯尔希、特蕾西娅等“老师们”的教导下变得非常出色。阿米娅则表示虽然知道分别会害怕，但今天的烹饪体验让她很开心，留下了美好的回忆，未来也不会那么害怕了。她称赞暴行是她非常厉害的老师，不仅会做美食，工作出色，还会像真正的姐姐一样照顾她。暴行也被阿米娅的成长和话语感动落泪，表示能看到阿米娅开心自己也非常高兴，也对即将分开感到难过。但她相信，只要双方都有着一样的信念并努力前进，就一定能再次重逢，并嘱咐阿米娅“平安长大”。\n\n对话转向胡萝卜派的原料问题。阿米娅提到购买雷姆必拓特产的胡萝卜罐头今年特别困难，价格升高、购买途径减少。暴行对此十分愤慨，解释说这是因为有维多利亚的商人在炒作雷姆必拓胡萝卜具有保持年轻健康的奇效（尽管暴行和阿米娅都觉得荒谬），导致胡萝卜罐头供不应求，价格暴涨，甚至连雷姆必拓本地人都买不到。这次的胡萝卜还是她特地拜托农户邻居用私人的存粮制作成罐头邮寄过来的。\n\n暴行担心这种炒作不仅扰乱了正常的市场秩序和农户的种植计划，更有可能引发像“围栏事件”那样的危机。她向博士和阿米娅简要介绍了“围栏事件”：维多利亚商人企图利用小型移动城市控制雷姆必拓地区的矿料资源，并牟取利益，最终由当地民众反抗，挣脱了商人的控制，成立了更为自主的尤立卡自治州。暴行在那次事件中也做出了许多努力。尽管“围栏事件”证明了雷姆必拓人能够守护自己的土地，但外部势力的觊觎并未停止，这次的胡萝卜炒作就是新的例证。\n\n暴行表示自己已经写信提醒老家的人警惕商人的陷阱，不能为了眼前的不合理暴利而打乱生活。她认为美食应该带来快乐，而不是被当作冒牌的“良药”被炒作利用。她强调不能让其他地区势力得寸进尺，无论是矿石料还是胡萝卜，都不会让他们轻易夺走不属于他们的东西。\n\n在阿米娅借故离开后，暴行与博士进行了更深入的交流。暴行重申自己了解过去的博士，但被保密协议约束无法详谈，不过她认为无论博士过去怎样，现在和阿米娅的关系以及她和阿米娅、博士的关系都没有改变，依然是朋友。她肯定了博士是一位“非常厉害的人”，能够给予他人“知识”，引导他人前进。她随后分享了自己离开巴别塔\/罗德岛后回到雷姆必拓的经历。这几年雷姆必拓的矿难频发，感染者数量增长，待遇得不到保障，以及其他地区对雷姆必拓的觊觎等不合理现象越来越多，让她认识到仅仅在矿业公司工作不足以解决问题。她明白安稳的生活正在受到威胁，决定离开雷姆必拓，去了解大地的变化，以便更好地守护家乡的和平。当得知罗德岛的领袖是阿米娅时，她毫不犹豫地选择加入罗德岛。\n\n来到罗德岛后，暴行看到了整个大地上需要改变的地方，并认为罗德岛，特别是阿米娅和博士，正在为此努力，这里有希望。因此，她愿意在这里贡献自己的力量。她坦言离开雷姆必拓对土生土长的她而言需要很大的勇气，支撑她的是自己的决心、阿米娅的决心，以及“博士的决心”。",
      "# 沉痛转机\n\n# 剧情总结\n\n本次活动剧情《沉痛转机》聚焦于罗德岛干员暴行（Barrage）加入罗德岛之前的经历。故事伊始，暴行刚刚结束了在巴别塔（Babel）为期两年的合作任务，返回家乡雷姆必拓（Remu Biton）的矿区。她与一位名叫老约翰的老矿工交谈，表达了对结束巴别塔合作的迷茫，以及对任务期间认识的一位萨卡兹（Sarkaz）女孩（后文暗示为阿米娅）的牵挂。暴行曾与巴别塔合作负责将雷姆必拓开采出的“舰体和核心”运输并交付，但合作突然终止，她对此感到困惑，同时也对离开家乡、见到外部世界的经历感到触动。尽管心中牵挂着那位女孩，暴行还是回到了雷姆必拓，继续她作为安保人员的职责，保护矿工们的安全。老约翰鼓励她无论身处何地都要肩负起自己的使命和责任。\n\n两年后，暴行继续在雷姆必拓矿区工作。一场突如其来的灾难降临：27、28、29号矿井发生严重的活性源石粉尘爆炸。暴行立即投入到危险的救援工作中，她冒着生命危险进入坍塌、充满粉尘的矿井，成功救出了包括老约翰在内的多名伤员。\n\n在矿区外设置的临时救助站，暴行遇到了参与联合应急医疗小组的志愿者。她惊讶地发现，其中一些医疗人员来自一个她从未听说过的组织——罗德岛制药公司（Rhodes Island Pharmaceuticals）。罗德岛医疗干员使用了效果显著的应急药物，有效抑制了矿工们的源石感染扩散，这让暴行感到非常意外，因为雷姆必拓现有的医疗资源对此效果有限。\n\n在与一位罗德岛医疗干员交流时，暴行无意中听到了一个熟悉的名字——凯尔希（Kal'tsit）。这让她产生了联想。她进一步询问罗德岛的领袖是谁，当听到“阿米娅”（Amiya）这个名字时，暴行感到极度震惊和激动。她意识到，这个名字与她两年前在巴别塔任务期间认识并一直牵挂着的那位萨卡兹女孩是同一个人。尽管阿米娅年龄尚小，但罗德岛医疗干员对她的智慧和领导能力赞不绝口，并证实阿米娅确实提过一位在雷姆必拓的亲密好友。\n\n得知阿米娅的身份和下落后，暴行立刻做出了决定。十五天后，她来到救助站的感染者病房探望老约翰。老约翰已经确定感染矿石病，他为了家人的生计，决定病愈后离开雷姆必拓，前往哥伦比亚参与“大拓荒”。暴行向老约翰坦承了自己即将离开雷姆必拓的决定，她告诉他自己找到了必须保护的朋友（阿米娅），并且要去她身边。老约翰理解并支持暴行的选择，认为每个人都有自己的使命，暴行也应该去拯救更多的人、保护她在乎的人。\n\n在向老约翰和家人告别后，暴行正式接受了罗德岛的入职邀请。她与罗德岛医疗干员会合，接过招聘合同，并表示迫不及待地想见到阿米娅，与她分享过去两年的经历，也想听听阿米娅的故事。故事在暴行满怀期待踏上前往罗德岛旅程的时刻结束，标志着她人生新篇章的开始，以及与阿米娅的即将重逢。整个故事通过矿区生活的艰辛、突如其来的灾难、以及关键人物的出现，展现了暴行性格的转变和最终的抉择，为她作为罗德岛干员的身份提供了深刻的背景。\n\n## 剧情高光\n\n-   老约翰对暴行的叮嘱：\n    > “每个人，每个时代，都有着不得不肩负的使命和责任。”\n    > “我知道，你从小就不是个普通兔子。每个人都有自己的使命和责任。”\n    > “你的锤子救了我们的命，接下来的日子，你也会拯救更多的人。”\n    > “如果有必须要保护的人，那就离开吧。我也一样。”\n-   暴行得知阿米娅身份时的反应：\n    > 罗德岛医疗干员: 我们的首领，罗德岛组织现任领袖，她的名字是——“阿米娅”。\n    > 暴行: ......阿......米娅......\n-   暴行决定前往罗德岛与阿米娅重逢时的内心独白：\n    > 我找到了。\n    > 阿米娅，你变成什么样了呢？\n    > 已经成长为领袖了，真了不起。\n    > 等着我吧，阿米娅。不论发生了什么，现在肩负着什么样的使命。\n    > 我有好多想告诉你、想和你分享的故事。你会想听吗？\n    > 这两年里，你遇到的快乐的事情、难过的事情，我遇到的快乐的事情、难过的事情——\n    > 在见面以后，来尽情诉说吧。\n\n## 相关信息\n\n-   雷姆必拓的矿区开采的“货物”是“舰体和核心”，这些被送往巴别塔。\n-   巴别塔与雷姆必拓的合作在活动两年前突然结束，原因未知。\n-   故事发生的地点“钢铁萝卜城”是一个有趣的名称。\n-   雷姆必拓矿工的老约翰在感染矿石病后，打算前往哥伦比亚参加“大拓荒”，这暗示了哥伦比亚当时正在进行的大规模开发活动。\n-   罗德岛在处理矿石病感染方面展现出了远超当地水平的医疗能力，其应急药剂能有效抑制感染扩散。\n\n## 关键人物\n\n暴行; 老约翰; 阿米娅; 凯尔希; 罗德岛医疗干员\n\n## 角色剧情概括\n\n-   **-   暴行**: 本故事的主角。她从巴别塔合作任务归来，回到家乡雷",
      "# 暴行\n\n# 其他名称\n\n夏洛特\n\n## 简要介绍\n\n暴行，本名夏洛特，是来自雷姆必拓的卡特斯族女性干员。她曾是当地矿业公司的安保人员，拥有出色的物理力量和独特的源石技艺，擅长使用战术爆破攻坚锤破坏硬目标和保护队友。在巴别塔时期，她曾作为旅伴陪伴博士和阿米娅度过一段艰难的旅程，与阿米娅建立了深厚的友谊。回到雷姆必拓后，她因家乡的矿难再次接触到罗德岛，并在得知阿米娅是罗德岛的领袖后，怀着保护朋友和守护家乡的决心加入了罗德岛。她在罗德岛担任近卫干员，同时也是厨房里备受好评的厨师，以其善良、可靠和热情的性格赢得了大家的喜爱。\n\n## 相关角色\n\n-   阿米娅暴行在巴别塔时期结识的同族孩子，两人关系亲密，情同姐妹。暴行对阿米娅的成长和安全非常关心，是她加入罗德岛并为之奋斗的最重要原因。暴行喜欢为阿米娅制作家乡料理，并分享彼此的故事。\n-   博士暴行在巴别塔时期共同旅行的伙伴，她信任博士，并基于博士对阿米娅的承诺而选择跟随和支持他。暴行了解博士的过去，并与其签订了保密协议。她愿意与博士和阿米娅一同面对未来的挑战。\n-   凯尔希暴行似乎在巴别塔时期认识凯尔希或听说过她。她与凯尔希签订了关于博士过去信息的保密协议。\n-   **老约翰**：暴行在雷姆必拓时的老朋友和同事，是矿区的普通工人。暴行向他倾诉对阿米娅的牵挂，并在矿难中救了他。老约翰理解并支持暴行加入罗德岛的决定。\n-   温米暴行在“去咧嘴谷”活动中遇到的感染者小姑娘。暴行之前曾给她罗德岛的名片。在旅途中，暴行对温米照顾有加，并在旅程结束后将她带回了罗德岛接受治疗。\n-   莱伊在“去咧嘴谷”活动中与暴行一行人同行的劫车人。暴行对莱伊展现出理解和同情，并鼓励她面对困境。暴行对莱伊加入罗德岛感到高兴。\n\n## 详细介绍\n\n干员暴行，本名夏洛特，是一名热情善良的卡特斯族女性，她的故事始于雷姆必拓的矿区。作为一名矿业公司的安保人员，她在危险的矿区环境中磨砺出了强健的体魄和实用的战斗技巧，尤其擅长运用一种特殊的战术爆破攻坚锤。这种武器通过内部源石排列产生类似微差爆破的效果，能高效破坏硬目标。\n\n    暴行的经历与博士和阿米娅的早期旅程紧密相连。在巴别塔时期，当博士从一起事故中救下年幼的阿米娅后，暴行作为旅伴加入了他们。在数月的共同生活中，暴行承担起了照顾阿米娅的责任，为她寻找药物，关心她的健康与情绪。她深知矿石病的残酷和不可逆转，一度基于雷姆必拓相对稳定的环境，提出让阿米娅留在那里，至少能有一个“家”。然而，她最终尊重了博士治愈阿米娅的决心以及阿米娅选择跟随博士的意愿。这段共同旅行让暴行与阿米娅建立了如同姐妹般的情感，也让她对当时的博士产生了信任，尽管在离开时，出于对卡兹戴尔危险环境可能影响他们的担忧，她选择了告别，但收到了阿米娅写给她的信。\n\n    离开巴别塔后，暴行回到了雷姆必拓的矿区，继续她的安保工作，守护家乡的和平和工人们的安全。尽管如此，她内心深处始终牵挂着远方的阿米娅，担忧她在萨卡兹主导的环境中能否健康成长。她曾向老友老约翰倾诉这种想要保护阿米娅的心情，但认为自己没有理由留下。\n\n    两年后，一场突如其来的活性源石粉尘爆炸袭击了矿区，暴行立即投身于危险的救援工作，奋不顾身地救出了多名被困矿工，其中包括老约翰。在救助站，她遇到了来自“罗德岛制药公司”的医疗小组，对他们手中能有效抑制矿石病症状的应急药剂感到惊讶。更令她震惊的是，当她迫切询问罗德岛的领袖是谁时，得到了“阿米娅”这个名字。这个消息让她无比激动，确认了阿米娅就是自己一直牵挂的朋友，并且已经成长为一方组织的领袖。\n\n    得知阿米娅的现状，暴行毫不犹豫地做出了决定——加入罗德岛。她向老约翰告别，解释了自己要去保护必须保护的人的使命。带着这份决心，她踏上了前往罗德岛的旅程，期待与阿米娅重逢并分享彼此的故事。\n\n    加入罗德岛后，暴行成为一名近卫干员，充分发挥她在战斗中的破坏和保护能力，协助攻坚任务，降低小队伤亡率。她的源石技艺表现为锤击区域的延迟爆破，常伴有放电现象。尽管她本人并未完全理解原理，但能娴熟运用。在罗德岛，她依然保持着善良开朗的性格，友善可靠，赢得了干员们的喜爱。她偶尔会在厨房里制作雷姆必拓风味的菜肴，如蔬菜浓汤、蘑菇派、蔬菜烤饼和胡萝卜派，为罗德岛带来了家庭般的温暖，她的烹饪手艺备受好评。\n\n    暴行对雷姆必拓有着深厚的感情和责任感。她在“自有一“派””活动中，通过与博士和阿米娅一起制作胡萝卜派，表达了对家乡特产被外部商人恶意炒作、可能重蹈“围栏事件”覆辙的愤慨，并强调了要阻止这种行为的决心。她解释了自己离开雷姆必拓加入罗德岛并非放弃家乡，而是为了了解外部世界，以便更好地守护雷姆必拓的和平。她认为，察觉到危机就应该立即行动，即使力量微薄，做点什么总比袖手旁观要强。\n\n    在“去咧嘴"
    ],
    "response":"根据文档1，阿米娅是罗德岛制药公司的公开领袖，一位充满理想与坚韧的卡特斯少女。",
    "reference":"阿米娅是罗德岛制药公司的公开领袖，一位充满理想与坚韧的卡特斯少女。她在一场车祸中失去双亲并感染矿石病，后被失忆前的博士救下，并与特蕾西娅、凯尔希共同组建巴别塔。",
    "context_precision":0.7,
    "context_recall":1.0,
    "faithfulness":1.0,
    "answer_relevancy":0.5487212453
  },
  {
    "user_input":"凯尔希在罗德岛是什么身份？",
    "retrieved_contexts":[
      "# 凯尔希\n\n# 其他名称\n\nAMa-10;凯尔希勋爵;凯尔希医生;Mantra\n\n## 简要介绍\n\n凯尔希是罗德岛医疗部门负责人，也是罗德岛的核心决策者与战略指挥。她拥有漫长而神秘的过去，被认为是前文明机械造物AMa-10，在泰拉大地上“执火奔行了万年”。她曾是巴别塔的重要成员，唤醒了失忆的博士，并抚养阿米娅，带领罗德岛致力于矿石病治疗和应对各种文明危机。凯尔希学识渊博，冷静务实，内心却承载着无尽的疲惫和对生命的深切关怀，是连接泰拉古老秘密与罗德岛未来的关键人物。\n\n## 相关角色\n\n-   博士凯尔希在巴别塔时期唤醒了失忆的博士，深知博士与前文明和特蕾西娅之死有着复杂关联。她虽对过去的博士怀有恨意，但选择相信并保护现在的博士，视其为罗德岛和泰拉未来的关键变数，与其共同应对挑战，是罗德岛并肩作战最久的同伴。\n-   阿米娅特蕾西娅的继承者，凯尔希将其视作孩子抚养并保护，引导她成长为罗德岛的领袖。凯尔希对阿米娅的力量、情感和健康状况投入了极大的关注和担忧，认为她是未来希望的象征。\n-   特蕾西娅凯尔希的挚友和巴别塔的领导者，信任凯尔希并将其视为自己事业的继承者之一。特蕾西娅在弥留之际将阿米娅和博士托付给凯尔希，是凯尔希行动理念和罗德岛使命的深刻来源。\n-   Mon3tr凯尔希的伴生兽和共生体，拥有强大的战斗力和防御能力，与凯尔希心灵相通，常保护凯尔希、博士和阿米娅。在“离解复合”中，凯尔希为摆脱造主控制，切断了与Mon3tr的双生循环，赋予其自由。\n-   可露希尔罗德岛总工程师，凯尔希的同事和朋友。可露希尔曾是巴别塔成员，与凯尔希共事多年，时常对凯尔希严肃的性格进行调侃，但对其能力深感信任。\n-   华法琳罗德岛医疗干员，凯尔希的同事。凯尔希曾通过“半强制”的方式将其招募至罗德岛，两人常在医疗事务上合作。华法琳认为凯尔希“什么都知道”，且对其医疗技术表示敬佩。\n-   斯卡蒂深海猎人，凯尔希曾将幽灵鲨带回罗德岛，并与斯卡蒂达成协议，协助深海猎人应对海嗣威胁，对其命运抱有深刻理解和期许。\n-   歌蕾蒂娅深海猎人总战争设计师，与凯尔希多次就深海威胁和阿戈尔文明进行谈判和合作，凯尔希对其专业能力表示认可，并寻求共同应对浩劫。\n-   W前巴别塔成员，萨卡兹佣兵。W对凯尔希情感复杂，既对其力量和“怪物”本质感到敬畏和厌恶，又认为凯尔希是唯一能保护特蕾西娅的人。两人在共同目标下常有合作，但关系始终紧张。\n-   赦罪师首领维多利亚萨卡兹王庭成员之一，知晓凯尔希作为“凯尔希勋爵”的古老身份，曾与其交战并对其施加伤害。\n-   特雷西斯维多利亚萨卡兹摄政王，将凯尔希视为“一度毁灭卡兹戴尔的罪魁祸首”，是其长期的敌人之一。\n-   **玛利图斯（海嗣）**：前文明研究者，后被同化为海嗣。他认出凯尔希是“AMa-10”，是“执火奔行了上万年”的先史文明遗产继承者，试图招揽她加入海嗣的“存续”计划。\n-   普瑞赛斯前文明“源石”缔造者之一，也是AMa-10的“造主”。凯尔希与她观念对立，致力于阻止普瑞赛斯强行同化泰拉的计划。\n-   **艾利奥特（异客）**：二十二年前在萨尔贡被凯尔希救下的研究所幸存者，后成为黑市情报贩子。他因凯尔希的指引而找到了自己的道路，并最终回到罗德岛寻求方向。\n-   莉莉娅切尔诺伯格“石棺事件”的幸存者，凯尔希十七年前在乌萨斯行医时曾帮助她复仇，并承诺照顾她的女儿路易莎。\n-   海蒂维多利亚信使，凯尔希十三年前在维多利亚的“学生”，凯尔希教导她知识和战斗技巧，并嘱托她维多利亚的事宜。\n-   **爱国者（博卓卡斯替）**：古老的萨卡兹温迪戈。凯尔希与他有数百年交情，彼此尊重。在切尔诺伯格最终决战中，爱国者死于阿米娅之手，凯尔希对此感到震惊和复杂。\n-   魏彦吾龙门行政长官。凯尔希与他在龙门保卫战前后进行过多次谈判和战略合作，对其政治手腕和战略布局有深刻洞察。\n-   Outcast罗德岛精英干员，凯尔希的同事与朋友。两人之间有特殊的信任和默契，凯尔希对她的牺牲感到惋惜。\n-   Raidian罗德岛精英干员，前巴别塔通讯兵。曾是凯尔希的下属，对凯尔希充满信任，并能在关键行动中与凯尔希协同作战。",
      "# 长路至此\n\n# 剧情总结\n\n本次活动剧情聚焦于罗德岛的医疗总监凯尔希被迫度过“放松”的一天。故事开始于罗德岛医疗部，凯尔希刚刚完成一台耗时近80小时、异常复杂的手术，对象是一名体细胞与源石融合率极高的矿石病患者克洛伊。手术虽然成功，但病症的特殊性引发了关于矿石病的新思考。尽管疲惫不堪，凯尔希仍打算立即前往实验室进行进一步研究，但这遭到了同事华法琳的强烈反对。华法琳认为凯尔希自维多利亚回来后工作状态过度透支，强制她必须休息至少八小时，甚至锁了实验室的门，这才让凯尔希暂时停下了工作。\n\n被迫离开医疗部的凯尔希首先来到了食堂，意外撞见正在为后勤物资发愁的阿米娅和后勤干员。罗德岛回到雷姆必拓后，收治的矿场工人赠送了大量萝卜以示感谢，这些萝卜堆积如山，食堂正努力将其消耗掉。然而，阿米娅与后勤干员私下的对话揭示了更严重的问题：这批萝卜几乎是罗德岛当下全部的过冬存粮，他们的基础物资在维多利亚消耗殆尽，回到雷姆必拓后补给线尚未稳定。阿米娅为了不让辛苦的凯尔希医生操心，对她隐瞒了实际的物资危机，并计划组织外勤小队冒险穿过山谷去北边城市采购。凯尔希虽然不知道危机全貌，但看到了萝卜的堆积，提供了腾出仓库的解决方案，并对阿米娅表示关心，提醒她注意身体并学会依赖他人。\n\n接下来，凯尔希被可露希尔带到疗养庭院。可露希尔受华法琳之托，试图帮助凯尔希放松。她展示了大量天马行空的照明方案，并让凯尔希欣赏庭院里的植物。凯尔希表现出惊人的植物学知识，迅速识别并说出了星缬草的药用价值和历史。可露希尔与凯尔希闲聊，回顾了两人长达十二年的交情（自1086年，可露希尔加入巴别塔并参与罗德岛舰体开采时算起）。可露希尔好奇地询问凯尔希对十二年时光的感知，以及是否会像看待温室植物一样看待他人。凯尔希回应说时间感知是相对的，这十二年和期间发生的事对她意义非凡、无可替代，并明确表示她绝不会将自己视为园丁，也不会轻视他人，这与寿命长短无关。她用帆船在时间之河上漂流的比喻，描述面对未来的无力和疲惫。可露希尔则指出过度努力会导致“紧绷的弦也会断掉”，并认为凯尔希需要放松，而可露希尔自己能以独特的方式分担罗德岛面临的压力。最后，可露希尔承认她在凯尔希的茶中加入了有安神作用的花茶，强制让凯尔希在庭院里小憩。\n\n故事的最后一幕是凯尔希给博士做身体检查。凯尔希解释了自己关注博士健康状况的原因，以及为何此刻进行检查。她证实自己采纳了华法琳的建议休息，但仍在利用时间。她为华法琳辩护，认为她的行为是出于医者责任。凯尔希对博士的健康表示担忧，特别是注意到一些指标浮动，并提醒博士规律作息。博士提到正在进行源石相关研究或试图恢复记忆，凯尔希表示支持，强调这应该是出于博士自身的意愿，并对博士能恢复知识充满期待，认为博士的努力本身意义重大，罗德岛未来会更需要他。博士感谢凯尔希的关心，凯尔希则表示这是她的职责，她不会背弃誓言，有更多理由守护现有的一切，并保证博士的安全。博士询问凯尔希为何选择成为一名医生。凯尔希坦言最初是为了履行她“唯一的使命”尝试过的无数手段之一，后来才意识到这也是一种认识大地的方式。她发现这片大地更需要治愈而非暴力，而治愈是建立在信任之上、远比暴力困难复杂的手段，是她通过漫长（作为医生约两百年）的实践才逐渐理解的。她表示漫长的时间因所得所失显得格外漫长，看到了前所未有的可能性，拥有了从未拥有过的事物，并认为这些都与罗德岛、同伴和机会有关。她重申“凯尔希”的存在是为了那个重要的、不能放弃的使命，并感谢给予她使命的那个人。对话在一种相对轻松的氛围中结束，凯尔希似乎露出了难得的微笑。\n\n整篇剧情通过凯尔希在被迫放松一天中与不同角色的互动，展现了她工作上的极端投入、作为领导者的责任感、对罗德岛成员的关心（尤其是对阿米娅和博士）、对自己漫长历史和身份的罕见流露、以及对罗德岛现状和未来的深邃思考，同时也侧面反映了罗德岛在经历重大事件后所面临的挑战（物资、重建）以及内部成员之间深厚的羁绊和互助。\n\n## 剧情高光\n\n“凯尔希，从维多利亚回来以后，你的工作状态有点太夸张了——哪怕是比起过去的你。”——华法琳对凯尔希的直言不讳。\n“凯尔希医生最近很辛苦......这些事还是不要她操心了......我们的基本物资储备在维多利亚消耗殆尽，回到雷姆必拓后，我们到现在都还没有建立稳定的补给线。”——阿米娅与后勤干员的私下对话，揭示了罗德岛面临的困境。\n“人怎么能一直保持紧张呢？努力过头的话，紧绷的弦也会断掉的。”——可露希尔对凯尔希过度劳累的担忧。\n“我学会不再以纯粹的目的性去审视这片大地上的一切，也因此看到这片大地需要治愈远甚于暴力。而相对于暴力，治愈是远为困难复杂的手段，只因它建立在信任之上。”——凯尔希解释选择成为医生的意义。\n“名为‘凯尔希’的个体因此而存在。所以无论如何，对我而言放弃从来不是一个选项。”—",
      "# 凯尔希\n\n# 剧情高光\n\n- **舍身保护博士与阿米娅**：在城防军指挥塔上层，凯尔希突然出现，挡在特雷西斯的剑前，承受了致命一击，为阿米娅和博士争取了撤退的时间。\n  <blockquote>旁白:一个熟悉的身影挡在你和阿米娅面前。\n  Mon3tr:（极度痛苦的嘶吼）\n  旁白:鲜红而温热的液体溅到你的脸颊上，还有你抱着阿米娅的手上。\n  凯尔希！\n  你脱口而出。\n  她正濒临死亡。或许下一刻她就会死去。\n  你以前从未如此清晰地感受过这种可能性。\n  凯尔希:Dr.博士......\n  凯尔希:带着阿米娅......撤退。\n  Mon3tr:（竭尽全力的嘶吼）\n  闪灵:凯尔希！\n  ——出自《淬火尘霾》<\/blockquote>\n- **揭示博士过去与特蕾西娅之死的真相**：在切尔诺伯格核心城，凯尔希向失忆的博士坦白了他过去的身份和所作所为，包括他曾杀害特蕾西娅。\n  <blockquote>凯尔希:“博士，Dr.博士，一个曾经拥有你这副躯壳的人，手上沾满了特蕾西娅的血。”\n  凯尔希:“‘你’，杀了特蕾西娅。”\n  凯尔希:“哪怕我绝对不能对你施加一点伤害，也请你记住。”\n  凯尔希:“......即使特蕾西娅与阿米娅都相信你，我也不。”\n  ——出自《怒号光明》<\/blockquote>\n- **冲破造主限制，获得新生**：在罗德岛本舰危机中，凯尔希选择牺牲自己一半生命，切断与Mon3tr的双生循环，摆脱造主（普瑞赛斯）的控制，获得与泰拉万物相连的新感知。\n  <blockquote>预言家：（未知语言）“......当你不再是AMa-10。”\n  凯尔希：（未知语言）“......难道没有任何突破口吗？”\n  预言家：（未知语言）“或许仍有一个。当你不再是AMa-10。”\n  ...\n  凯尔希：（未知语言）“还有什么值得犹豫的呢？”\n  ...\n  旁白:凯尔希冲破了造主为她设下的所有限制。以剥离生命的一半为代价，她获得新生。\n  ——出自《离解复合》<\/blockquote>\n- **直面普瑞赛斯，为泰拉而战**：在与普瑞赛斯的最终对决中，凯尔希坚决反驳其同化泰拉的理念，重申守护泰拉生命的决心，并揭露普瑞赛斯强加意志的过去。\n  <blockquote>凯尔希:“她不是泰拉的造物主。这片大地上的一切生命，没有义务顺应你的意愿。”\n  凯尔希:“......这是我对你的报复，也是最后的反抗。”\n  ——出自《离解复合》<\/blockquote>\n- **与特蕾西娅的最后对话**：在特蕾西娅即将消散之际，凯尔希与她进行了一场感人至深的告别，特蕾西娅感谢凯尔希的陪伴与支持，并再次将博士和阿米娅托付给她。\n  <blockquote>特蕾西娅: 亲爱的凯尔希，既然我们都清楚各自的结局，又何必再悲伤呢？能再靠近点吗？\n  凯尔希: 你总是如此。\n  特蕾西娅: 我是一个很幸运的人，凯尔希。我的每一次远去，都有我最好的朋友陪伴我......谢谢你。\n  凯尔希: ......\n  ——出自《慈悲灯塔》<\/blockquote>\n- **作为“AMa-10”被玛利图斯辨认并驳斥其“存续”理念**：在阿戈尔，她被前人类\/海嗣玛利图斯称为“AMa-10”并被指认为先史文明遗产继承者，但她坚决驳斥玛利图斯扭曲的“存续”理念。\n  <blockquote>玛利图斯: 凯尔希，资料里的AMa-10，你让我感到意外。你我本应殊途同归。不，你应当比我更加理性，更加决绝。我只是意外发现了先史文明的火种，接下了它。而你却是为此而生。在我之前，你已经执火奔行了上万年。\n  凯尔希: 海嗣是必须消除的灾难。\n  凯尔希: 没有文明，谈何存续？\n  ——出自《生路》<\/blockquote>\n\n## 战斗表现\n\n凯尔希在剧情中展现了超凡的战力，是罗德岛不可或缺的强大支柱。\n- **召唤物Mon3tr**：她的核心战力来源，是与她心灵相通的强大共生体。Mon3tr拥有惊人的物理防御和攻击力，能轻易压制整合运动指挥官弑君者（《局部坏死》），在遭遇赦罪师首领袭击时也能保护凯尔希（《恶兆湍流》），并能被凯尔希赋予特定指令（如保护博士和阿米娅，执行任务）。在“离解复合”中，即使凯尔希被源石吞噬，Mon3tr也能化为人形继承其记忆并继续作战。\n- **卓越的医学能力**：凯尔希是一名顶尖医生，能够进行长达七十二小时（《战地秘闻》）乃至七十九小时四十五分钟的复杂手术（《长路至此》）。她擅长诊断、治疗和抑制矿石病，甚至能通过毒药\/药物使目标“永眠”而不留痕迹（《遗尘漫步》），并对多种生物的生理机制有深刻理解。\n- **源石技艺和感知能力**：尽管她声称“从不依赖源石技艺”（《局部坏死》），但她表现出特殊的感知能力，如能感知到“邪魔污染”（《反常光谱》）、“",
      "# 第五类接触\n\n# 剧情总结\n\n本次活动剧情“第五类接触”围绕着一个神秘的、被称为“水月”的个体展开，通过两条时间线和视角的交织，探讨了生命形式、个体认同、善恶定义以及合作的可能性。\n\n第一条时间线发生在罗德岛舰上，主要通过凯尔希与阿戈尔深海猎人歌蕾蒂娅，以及凯尔希与博士之间的对话呈现。剧情伊始，歌蕾蒂娅未经许可便闯入罗德岛，径直来到水月所住的房间，表现出极度的警惕与敌意。她质问凯尔希为何要收容像水月这样被“转化”的生物，称其为“令人作呕的技术”和“渣滓”，甚至试图直接破坏水月的房间。凯尔希则冷静地解释，水月是被暂时转移的“合作对象”，罗德岛无意利用危险去对抗危险，而是看重水月作为一种独特生命形式所具有的情报价值。她指出深海猎人在面对宿敌时需要克制情绪，暗示这种被转化的生物未来可能成为陆上世界的课题。歌蕾蒂娅虽然对罗德岛收容水月的行为表示强烈不满和不信任，但凯尔希以深海猎人对陆上调查需要陆上支持，以及未来陆上世界迟早要面对水下敌人的事实为诱饵，提出在情报合作基础上，若歌蕾蒂娅追查到相关踪迹，罗德岛将尽最大可能支援。凯尔希将收容水月称为是为了“未来的另一种可能性”，而非袒护邪恶个体，最终与歌蕾蒂娅达成了某种程度的、带有条件的合作共识。\n\n与歌蕾蒂娅的对话结束后，凯尔希转向与博士沟通水月的情况。她解释说，水月已经被转化成一种新的生命形式，一种会为了探寻道路而改变和重塑自身的生物。这类生物为了存续，在有限的环境下会主动蛰伏并降低消耗，但长远来看，人类可能不得不与其争夺生存资源，成为猎手或猎物。凯尔希没有向博士完全解释水月的过去，认为过度的信息只会增加焦虑，影响判断。她向博士说明了医疗部和她本人对水月的处置方案，并提出让水月免除部分条约限制的方案存在潜在危险性，邀请博士在后续会议上听取意见。然而，凯尔希话锋一转，指出水月与同类生物不同，他游离于族群认同之外，有自己的思考和迷茫。凯尔希提出一个核心问题：是否应该因为罗德岛“能做到”，就去试图改变一个人的生命形式，将其导向罗德岛认为“正确”的方向？她认为这种做法与那些为了追求更美好生命形式而改变水月的力量（暗示是来自水下或与水月同类的力量）是否有本质区别？凯尔希询问博士是否有“自己的生命形式更优秀”的想法。博士可以选择承担责任，或者表示会给予水月选择的自由，不干涉他的思考方式。凯尔希对此表示既愿意听到又担忧，因为博士是罗德岛干员们信任并托付生命的对象，他的选择影响巨大，未来可能会面临自相矛盾的重压，但她最终选择不加阻拦，信任博士能够承担责任，并告诫博士的干员们，一旦认可博士，就应全力以赴，因为罗德岛是家园。\n\n第二条时间线是一段发生在数月前玻利瓦尔多索雷斯城的闪回剧情，以旁白和对话形式呈现，主要展现了水月的视角和能力的冰山一角。画面转到多索雷斯城，当地军方人员埃内斯托正在调查一起发生在仓库附近的爆炸事件。他们发现这是一场精心策划的骗局，两名“真正玻利瓦尔人”背景的雇佣兵利用炸药交易为诱饵，炸伤了前来接头的辛嘉斯军人（伪装成酒店安保），并趁机劫走了入住附近酒店的莱塔尼亚少年合唱团。埃内斯托意识到他们和辛嘉斯都被耍了，优先处理伪造现场以瞒过城主坎黛拉，同时试图封锁城市寻找被劫持的孩子。\n\n与此同时，水月作为观察者出现。他通过一些超常的感知能力发现了事件的真相和藏匿孩子们的地点。他自称与合唱团的孩子们搭乘同一艘船而来，买了他们的音乐会门票，因此不能坐视不管。水月轻松地找到了实施绑架的两名雇佣兵。这两名雇佣兵正在抱怨任务的艰辛和对“真正玻利瓦尔人”领袖潘乔的不满，他们认为多索雷斯的人只为了钱而来，文化渗透毫无意义，并打算完成这一票后各自跑路。水月现身并与他们对话，他轻松地让其中一名雇佣兵无法使用武器，并让另一名雇佣兵感到空间扭曲，无法站立。水月听着雇佣兵为自己的行为辩护，将孩子们当作工具以求自保和牟利，甚至将孩子们被莱塔尼亚方面利用来促成生意的遭遇与自己的掠夺行为相提并论。水月否定了他们的狡辩，认为他们是不可救药的坏人。就在水月似乎要对他们采取行动时，一名被劫持的合唱团成员突然出现，制止了水月，并震惊地声称雇佣兵是“我的同类！”这名合唱团成员随后揭露了令人意想不到的事实：整个爆炸和绑架计划并非完全由雇佣兵主导，而是他自己秘密策划的。他利用心理暗示的源石技艺诱使雇佣兵上钩，并泄露情报促使辛嘉斯军人前来，以此制造混乱并实现自己的逃跑计划。他向雇佣兵道歉，认为他们都只是想逃离这座令人厌倦的城市和自己的故乡。水月对此感到十分意外和困惑，他原本打算救下孩子们并送他们回去听音乐会，结果发现情况远比他想象的复杂。面对合唱团成员的告白和雇佣兵的自暴自弃，水月最终决定不再深入干涉。他让雇佣兵继续保持瘫痪状态，确保孩子们能够先行逃离，并承诺会盯着雇佣兵，确保他们不会追击。水月在此事件中亲历了复杂的人性、不同个体和群",
      "# 难得认真\n\n# 剧情总结\n\n故事发生在一个罗德岛前往伦蒂尼姆执行重要任务之前的时间点，罗德岛的医疗主管华法琳为罗德岛的领袖阿米娅进行了一次例行体检。这一次，一向有些随性的华法琳却表现得异常认真和严肃。\n\n体检过程中，华法琳先是小小地捉弄了一下阿米娅，说她身体出了问题，结果只是阿米娅又长高了一点。但玩笑过后，华法琳话锋一转，严肃地提到了即将到来的伦蒂尼姆之行，并预言那里注定会发生斗争、死亡和仇恨。阿米娅对此感到不安，询问华法琳是否因此生气。华法琳否认了生气的说法，解释说自己早已经不会对“注定发生”的事情产生情绪波动，而是更倾向于进行研究。\n\n华法琳借此机会向阿米娅讲述了自己的过往。她提到自己是血魔一族，这一种族有着好战、嗜血的“社会性”或“惯性”，即使活了上百年也会因为这种惯性而麻木地继续战斗。她坦言自己至今仍未克服这种本能，但通过两百年的训练，她学会了克制。她成为医生并非因为厌恶战争，而是因为对战斗感到“腻烦”，选择了逃离血魔社会的惯性，并在寻找克服自身本能的过程中自然而然地成为了医学研究者。\n\n阿米娅问及华法琳与凯尔希的相识。华法琳回忆起几十年前，她在医学杂志上发表论文，被凯尔希（当时未用笔名）撰文指出理论疏漏。华法琳虽不服气，但按凯尔希的思路实验后发现确实有效，因此对凯尔希的水平表示认可。她曾多次尝试在杂志上回应，但凯尔希此后再未发表文章。随后剧情进入一段更深的闪回：萨卡兹王庭的战士前来召集华法琳，被她用虚张声势的能力（声称能让血液凝固）吓退。她因此决定搬家到维多利亚。此时，一个萨卡兹青年向华法琳求医（为母亲求药），凯尔希带着年幼的阿米娅出现，自称是求医者。华法琳最初拒绝为与战争有关的人治病，尤其是凯尔希作为魔王特蕾西娅的人。凯尔希则告知华法琳，特蕾西娅已死，阿米娅是新的魔王。华法琳对特蕾西娅选择如此年幼的阿米娅作为继承人感到残忍，甚至考虑过让阿米娅无痛苦地死去，以避免未来的苦难。凯尔希则表示自己作为医生，只是不希望生命消逝，但也承认自己同时是谋划者和战争帮凶。她反问华法琳，一个只愿拯救个体、远离战争的人，是否会拯救所有想要远离战争的人。华法琳看穿凯尔希是在刻意透露罗德岛当时的困境和阿米娅的情况，以此引诱她加入，但华法琳再次拒绝。凯尔希随即抛出了关键的诱饵：特蕾西娅的理想不只针对萨卡兹，包含治疗矿石病，并且罗德岛已经有了相关研究的雏形（凯尔希本人所做）。最后，凯尔希向华法琳保证，即使罗德岛未来会因特雷西斯有所行动，华法琳也“将拥有置身事外的权力”。\n\n回到现在，阿米娅询问华法琳为何最终加入了罗德岛。华法琳坦言，她当时并未完全被凯尔希说服。第二天，凯尔希散布了华法琳已加入罗德岛的消息，让她无法拒绝。当华法琳想要离开时，凯尔希甚至动用了Mon3tr将她“请”上了罗德岛。华法琳最初不相信凯尔希关于矿石病的研究，直到看到研究成果后才勉强相信，最终半推半就地留了下来。\n\n听到这里，阿米娅误以为华法琳今天的认真是在为离开罗德岛做铺垫，因为罗德岛即将踏入战争泥潭，这与华法琳远离战争的目标不符。华法琳明确否认了要离开的想法。她解释说，她之所以认真，是因为伦蒂尼姆之行对阿米娅来说是“一次决断，是新的启程”，而她作为阿米娅过去的主治医生，想为她准备一份“礼物”。她分享了自己对战争的看法：战争的发起者往往十分聪明，知道夺取是最有效的方法，这种循环似乎永无止境。她重申自己并非厌恶战争，只是觉得它是一种“无休止的内耗”，应该有更好的未来方法。她承认自己的选择可以被视为懦弱或视而不见，但这是她的方式。她选择不成为精英干员，就是因为知道罗德岛的道路迟早会被战火点燃，这是她唯一的底线，不会为任何人打破。因此，她从未对罗德岛在战争方面的行动抱有期望，也谈不上生气或失望。\n\n然而，华法琳强调，她亲手建立了罗德岛的血库、壮大了医疗团队，并看着罗德岛成为一家医药公司。她留下的核心原因在于，只要她相信阿米娅和凯尔希没有放弃攻克矿石病的志向，她就会一直留在罗德岛，照顾所有的病人。这，就是她送给阿米娅的礼物。阿米娅深受感动。华法琳随后用开玩笑的方式缓和气氛，比如想抽博士的血、用血魔形象吓唬小孩打针。最后，华法琳温柔地提醒阿米娅，她是她在罗德岛的第一个病人，并叮嘱她一定要活着回来。\n\n整个故事通过华法琳与阿米娅的对话和华法琳的回忆，展现了华法琳作为血魔的独特背景、她远离战争成为医生的动机、她与凯尔希复杂的关系，以及她最终选择留在罗德岛的核心原因——并非为了战斗或参与政治，而是为了医学研究和病患，尤其是攻克矿石病这一宏大目标。同时也侧面描绘了早期罗德岛的艰难处境和阿米娅、凯尔希肩负的重担。\n\n## 剧情高光\n\n*   华法琳严肃地表示担忧：“斗争，死亡，仇恨，这些也注定会在伦蒂尼姆发生。”\n*   华法琳解释自己的动机：“实际上，就算再喜欢一件事情，做个一百年怎么也会"
    ],
    "response":"根据文档信息，凯尔希是罗德岛医疗部门负责人，也是罗德岛的核心决策者与战略指挥。",
    "reference":"凯尔希是罗德岛的资深医生与重要成员，阿米娅的导师和引路人。",
    "context_precision":0.95,
    "context_recall":1.0,
    "faithfulness":1.0,
    "answer_relevancy":0.8287633955
  },
  {
    "user_input":"明日方舟中有哪些类型的敌人？",
    "retrieved_contexts":[
      "# 教士\n\n# 其他名称\n\n外来的教士;习武教士;普通教士;伊比利亚主教阁下;温和的教士;和蔼的教士\n\n## 简要介绍\n\n在泰拉世界的伊比利亚地区，“教士”并非一个单一的身份，而是涵盖了多种组织和信仰背景下的宗教或准宗教人士。他们可能是伊比利亚审判庭的成员，负责维护律法、追查异端；也可能隶属于与“大海”相关的神秘族群或教会，追寻某种形式的“蜕变”或为“大海”传道；还有一些是普通的宗教导师或布道者，致力于精神指引和信仰传承。这些不同类型的教士在剧情中扮演着各自的角色，代表着伊比利亚复杂而多样的力量体系和信仰冲突。\n\n## 相关角色\n\n-   **怪异的画家**：与“外来的教士”是同胞，因背离族群而被追杀。\n-   赫曼与“温和的教士”奥卢斯是同胞，奥卢斯在赫曼异变后保护和引导她。\n-   棘刺与“和蔼的教士”是师生关系，受其教导；后被雅隆镇的“习武教士”审判。\n-   **证裁官西尔弗**：雅隆镇审判庭的领导者，指挥“习武教士”。\n-   **执裁官安纳斯塔西奥**：雅隆镇审判庭的领导者，指挥“习武教士”进行围剿行动。\n-   齐尔查克在盐风城遇到“教士”，并将其算计导致被宝箱怪吞食。\n-   阿玛雅在格兰法洛遇到“普通教士”，通过对话引导他们离开。\n-   斯特凡诺·托雷格罗萨在空想花庭与“温和的教士”奥卢斯有深入对话。\n-   蕾缪安在空想花庭与“温和的教士”奥卢斯发生冲突。\n\n## 详细介绍\n\n“教士”在伊比利亚的故事线中是一个反复出现的称谓，但它所指代的并非同一个组织或个体，而是反映了伊比利亚地区信仰和势力错综复杂的现状。大致可以将剧情中出现的“教士”分为以下几类：\n\n**审判庭的教士：**\n这类教士是伊比利亚审判庭的成员，肩负着维护律法、追查异端和可疑分子的职责。在“出苍白海”活动中，雅隆镇审判庭的“习武教士”群体是主要的武力执行者，他们在证裁官西尔弗和执裁官安纳斯塔西奥的指挥下，严格执行律法，逮捕并准备处决被认为有罪的镇民（如棘刺和帕斯卡拉）。他们对来自盐漠的海盗船队充满敌意，并参与了对海盗的伏击、围剿和追击。习武教士展现了较高的纪律性和战斗素养，即使在损失惨重的情况下依然试图完成任务，但在生死关头也能表现出务实的求生本能。\n在“直到灯火明亮”活动中出现的“普通教士”则是审判庭的另一类成员，他们可能更侧重于调查和追查工作。这两位教士来到格兰法洛小镇，是为了追捕一名可能与阿戈尔人有联系的信使。他们对可疑事物高度警惕，并采取地毯式搜查的方式。虽然他们具备一定的行动能力（能打伤信使），但也被阿玛雅暗示其权限有限，无法处理超出“普通教士”范围的事务。这显示审判庭内部可能存在明确的层级和分工。总的来说，审判庭的教士代表着伊比利亚官方律法的执行力量，他们冷酷而坚决，是维持审判庭统治的重要支柱。\n\n**与“大海”相关的教士：**\n这类教士似乎与某种古老、神秘的力量——通常指向深海或相关的族群\/教会——紧密相连。他们在信仰和目的上与审判庭截然不同，甚至互为敌人。\n在“幽蓝怀想”活动中出现的“外来的教士”是一个典型的例子。他属于一个特殊的“族群”，这个族群似乎与深海教会或类似的超凡存在有关，成员之间互称“同胞”，追求某种形式的“蜕变”或融入。这位教士来到小镇，是为了“清理”一位背离族群的同胞——怪异的画家。他认为人类的情感和欲望（如艺术、好奇心）是“自私和可悲”的，是阻碍族群生存延续和个体“蜕变”的赘余。尽管他对画家展现出的强大力量感到震惊，但仍试图留下标记以便其他同胞追迹。最终，他坦然面对自己因无法摆脱人类欲望而止步不前的末路，被画家吞没，认为自己的遗体将成为后来者的养分。\n在“泰拉饭”活动中盐风城“庇护教会”的“教士”也与“大海”有着不寻常的联系。他向外来的莱欧斯小队传布“大海的教诲”，试图将他们招募为教会的“手足”，并与“审判庭”为敌。他对洞窟中海嗣生物的态度，尤其是目睹莱欧斯小队烹食它们时表现出的极度震惊和愤怒（“这是何等的亵渎！”），强烈暗示了他所信仰的“大海”与海嗣有关。尽管他声称自己没有战斗能力，且被齐尔查克轻易算计，但他代表的教会显然是伊比利亚另一股与深海相关的势力。\n“空想花庭”中的“温和的教士”奥卢斯是这类教士中具有鲜明个体特征的角色。他来自伊比利亚，被修道院主教称为“异教的教士”，其信仰与拉特兰不同。奥卢斯与受深海影响而异变的赫曼互称“同胞”，并在赫曼异变后选择保护和引导她。他使用一把造型古怪的长剑，具备一定的战斗力（能阻拦蕾缪安）。他能够屏蔽自身的感知，让拥有共感能力的萨科塔感到“一片空白”。奥卢斯对人类的情感、理解和信仰有着深刻的思考，并最终带着赫曼离开了修道院，似乎将开启一段新的旅程，代表着某种与深海力量共存或引导的可能。\n\n**导师与布道者：**\n除了审判庭和与深海相关的势力外，伊比利亚地区还存在着侧重于",
      "# 明日方舟剧情wiki 角色总表\n\n# 干员 (共计:379)\n\n| <br \/>    | <br \/>     | <br \/>         | <br \/>    | <br \/>   |\n| --------- | ---------- | -------------- | --------- | -------- |\n| 12F       | CONFESS-47 | Castle-3       | Friston-3 | Lancet-2 |\n| Mechanist | Misery     | Miss.Christine | Mon3tr    | PhonoR-0 |\n| Pith      | Raidian    | Sharp          | Stormeye  | THRM-EX  |\n| Touch     | U-Official | W              | 阿         | 阿兰娜      |\n| 阿罗玛       | 阿米娅        | 阿斯卡纶           | 阿消        | 艾拉       |\n| 埃拉托       | 艾丽妮        | 爱丽丝            | 艾丝黛尔      | 艾雅法拉     |\n| 安比尔       | 安德切尔       | 安洁莉娜           | 安赛尔       | 暗索       |\n| 安哲拉       | 奥达         | 奥斯塔            | 八幡海铃      | 摆渡人      |\n| 柏喙        | 白金         | 白面鸮            | 拜松        | 白铁       |\n| 白雪        | 斑点         | 薄绿             | 暴行        | 暴雨       |\n| 贝洛内       | 贝娜         | 鞭刃             | 冰酿        | 波卜       |\n| 波登可       | 布丁         | 布洛卡            | 裁度        | 苍苔       |\n| 缠丸        | 车尔尼        | 陈              | 骋风        | 澄闪       |\n| 赤冬        | 斥罪         | 仇白             | 初雪        | 刺玫       |\n| 伺夜        | 嵯峨         | 达格达            | 戴菲恩       | 但书       |\n| 导火索       | 德克萨斯       | 蒂比             | 地灵        | 电弧       |\n| 调香师       | 冬时         | 豆苗             | 杜宾        | 杜林       |\n| 渡桥        | 断崖         | 断罪者            | 铎铃        | 多萝西      |\n| 芳汀        | 菲莱         | 菲亚梅塔           | 芬         | 丰川祥子     |\n| 风笛        | 风丸         | 风絮             | 芙兰卡       | 芙蓉       |\n| 复奏        | 格拉尼        | 格劳克斯           | 歌蕾蒂娅      | 格雷伊      |\n| 古米        | 瑰盐         | 傀影             | 哈蒂娅       | 哈洛德      |\n| 海蒂        | 海沫         | 海霓             | 寒檀        | 号角       |\n| 赫德雷       | 褐果         | 赫拉格            | 赫默        | 和弦       |\n| 黑         | 黑键         | 黑角             | 衡沙        | 红        |\n| 吽         | 红豆         | 红隼             | 鸿雪        | 红云       |\n| 华法琳       | 槐琥         | 煌              | 灰毫        | 灰喉       |\n| 灰烬        | 霍尔海雅     ",
      "# 明日方舟剧情wiki 角色总表\n\n# 干员 (共计:379)\n\n| 郑清钺        | 茱安娜       |\n| 主教        | 助理机器人0429    | 逐魇骑士       | 祖拜尔        | 最后的骑士     |\n| 作家        | 左宣辽          | “疤眼”       | “桥夹”克里夫    | “小公爵”     |\n\n## 曾出现在版本一中的角色\n\n### 干员 (共计:36)\n\n| <br \/>      | <br \/>      | <br \/>      | <br \/>      | <br \/>      |\n| ----------- | ----------- | ----------- | ----------- | ----------- |\n| 百炼嘉维尔(v1)   | 承曦格雷伊(v1)   | 纯烬艾雅法拉(v1)  | 淬羽赫默(v1)    | 涤火杰西卡(v1)   |\n| 归溟幽灵鲨(v1)   | 寒芒克洛丝(v1)   | 荒芜拉普兰德(v1)  | 火龙S黑角(v1)   | 假日威龙陈(v1)   |\n| 缄默德克萨斯(v1)  | 莱欧斯(v1)     | 历阵锐枪芬(v1)   | 琳琅诗怀雅(v1)   | 麒麟R夜刀(v1)   |\n| 圣约送葬人(v1)   | 维娜·维多利亚(v1) | 维什戴尔(v1)    | 新约能天使(v1)   | 焰影苇草(v1)    |\n| 炎狱炎熔(v1)    | 耀骑士临光(v1)   | 引星棘刺(v1)    | 预备干员-辅助(v1) | 预备干员-后勤(v1) |\n| 预备干员-近卫(v1) | 预备干员-近战(v1) | 预备干员-狙击(v1) | 预备干员-术师(v1) | 预备干员-特种(v1) |\n| 预备干员-先锋(v1) | 预备干员-医疗(v1) | 预备干员-重装(v1) | 烛煌(v1)      | 濯尘芙蓉(v1)    |\n| 浊心斯卡蒂(v1)   | <br \/>      | <br \/>      | <br \/>      | <br \/>      |\n\n### 其他剧情角色 (共计:81)\n\n| <br \/>              | <br \/>                   | <br \/>                          | <br \/>            | <br \/>           |\n| ------------------- | ------------------------ | ------------------------------- | ----------------- | ---------------- |\n| AUS (群体)(v1)        | Logos(v1)                | Logs(v1)                        | Ms. Christine(v1) | 阿尔贝托(v1)         |\n| 阿尔图罗(v1)            | 阿克托斯(v1)                 | 阿勒黛(v1)                         | 艾尔启(v1)           | 艾莉诺 (Elinor)(v1) |\n| 埃琳娜·乌比卡(v1)         | 艾泽尔(v1)                  | 安麦尔(v1)                         | 奥伦·亚吉奥拉斯(v1)      | 疤眼(v1)           |\n| 保存者(v1)             | 博卓卡斯替(v1)                | 查尔斯·林奇 (Charles Lynch\/蒸汽骑士)(v1) | 大副ガルシア(v1)        | 大审判官(v1)         |\n| 黛安 (Diane Webb)(v1) | 凋零(v1)                   | 杜卡雷(v1)                         | 杜克凯斯特(v1)         | 杜克威灵顿(v1)        |\n| 杜克温德米尔(v1)          | 恩希欧迪斯·希瓦艾什(v1)           | 恩雅·希瓦艾什（圣女）(v1)                 | 发言人莫布(v1)         | 放逐王(v1)          |\n| 斐尔迪南·克鲁尼(v1)        | 弗里斯顿(v1)       ",
      "# 泰拉饭\n\n# 剧情高光\n\n- 法琳: 哥......快逃！\n- 莱欧斯: 这里有没有可能就像是......活画里那样？我们被带到了一个像画中世界一样的新地方？\n- 莱欧斯: 这里果然是没来过的区域！好多新奇的东西！\n- 大鲍勃: 啊，你们叫我大鲍勃就好。看你们像一群流浪汉的样子，荒野上不好混，都在这歇息歇息吧。\n- 莱欧斯: 你的意思是，它们可以用来......吃吗？！\n- 玛露西尔: 要吃这些虫子？！不行！不行不行！不吃不吃！\n- 森西: 不论是多么小的一步，都需要仔细对待，这就是料理的魅力。玛露西尔，你的着急给了老夫很大的帮助。\n- 大鲍勃: 对了，我知道一个地方，那里有不少......呃，奇奇怪怪的人。他们一定可以帮你们想办法找到你们的老家。他们连红眼女都能招架得住，解决你们的问题应该不是什么麻烦。\n- 大祭司: 只要不出什么意外，我的最新力作“无敌的酷东西”就可以开出去了！\n- 莱欧斯: 玛露西尔，为什么你明明是莱欧斯，我却觉得你长得有点像炎龙呢？\n- 阿达克利斯A: 那就没错了，她这是中毒了！但同样走运又不走运的是，知道解毒方法的人也只有大祭司！\n- 森西: 那么为了节省时间，来帮老夫准备其他的食材吧！\n- 玛露西尔: 别掩饰了，你从一开始就抱着这个念头吧，莱欧斯。\n- 大祭司: 没错，在下就是大祭司！你们的诉求我在泡澡时已经全部搞清楚了！\n- 玛露西尔: 我不要——我再也不要吃魔物了——！！！\n- 齐尔查克: 独眼巨人？......那是什么魔物吗？\n- 橡杯: 呃......不是，他们是一支特殊的萨卡兹。\n- 艾尔启: 但是，为什么我在你的身上看到了许多死亡？\n- 艾尔启: 他们被邪魔污染了。\n- 莱欧斯: 就算最后他没来，我们先填饱肚子也能更有效率地去找他。\n- 森西: 与其在这里漫无目的地寻找齐尔查克，不如就地生火。\n- 齐尔查克: 你们......把被邪魔污染的角兽吃了？！\n- 莱欧斯: 我们■■，我们来自那■。\n- 齐尔查克: 根本就是他们自作自受啊！！！！\n- 莱欧斯: 可是连齐尔查克都学会上手反击了，这些镇民却一直学不会。每次看他们对付墨魉都好像根本不知道怎么攻击一样。\n- 莱欧斯: 我甚至觉得它们还能听得懂人说话......\n- 莱欧斯: 甚至能听明白它们在说些什么——\n- 莱欧斯: 他大概会很惊讶吧，毕竟——\n- 莱欧斯: 呜嘎嘎！（啊，你们来得正好！）\n- 莱欧斯: 哦，不好意思，用它们的语言久了，差点不会说人话了。\n- 莱欧斯: 我追着那只长了痣的墨魉去了镇子外面，却发现它们居然能停下攻击然后开开心心地偷吃水果。\n- 莱欧斯: 黎: 哎呀呀，看来是真生气了呢......怪不得，这么多墨魉都被吸引过来了，还醉得歪七扭八，这副样子也是第一次见呢。\n- 夕: ......这幅画是不能要了。\n- 森西: 嗯......这个黏液的这种气味......好好闻的味道，和之前的黏液闻起来很不一样，更像是......酸酸甜甜的味道！！\n- 森西: 森西: 被用D32钢手电筒释放的魔法影响，黏液的颜色变成了金色，味道也很不错......老夫觉得它们或许可以当成赤金源石虫的代替品！\n- 齐尔查克: ......有了。（指发现宝箱怪）\n- 齐尔查克: 嘿，这教士想骗我们来这里送死，我稍微用这家伙惩罚了一下他。\n- 森西: 老夫刚刚在溶洞的角落发现了半箱......“应急理智顶液”。上面写着“含有少量芥末提取物”，可能是某种调味料吧。\n- 莱欧斯: 好吃！！（指生腌）\n- 安妮塔: 怎么了？男性居民: 那几个外人在海边。安妮塔: 咦？他们在海边？男性居民: 在做饭。安妮塔: 做饭？男性居民: 用海里的怪物。安妮塔: 什么？！得快去阻止他们！男性居民: 晚了。\n- 玛露西尔: 这不是我吗？！（指使魔）\n- 玛露西尔: 我到底是为什么要做到这一步啊啊啊！\n- 莱欧斯: 成功了！玛露西尔带着无人机都往那边去了！\n- 森西: 等一下，老夫记得......那边是不是玉米地来着？\n- 玛露西尔: ......啊？（被爆米花砸中）\n- 刻俄柏: 爆米花！我可是超级强的，就算有一百个......呃，九十九个爆米花，我都可以吃得下！\n- 刻俄柏: 吧唧吧唧吧唧......还有......吧唧吧唧......金头发姐姐！\n- 玛露西尔: 不......要......吃我的......头发......呀！！！\n- 莱欧斯小队: 罗德岛？！瑞恩是罗德岛来的吗？\n- 莱欧斯小队: 我们来到这里吃到的第一顿饭就是他做的。（指大鲍勃）\n- 泥岩: 我明白了......原来他说的“那些朋友”就是你们。\n- 莱欧斯小队: 怎么一开门全都变了？！\n- 大祭司: 你们还愣着干什么？！（指大丑）\n- 驾驶舱内的莱欧斯小队: 啊啊啊啊啊啊啊啊啊——\n- 大祭",
      "# 落叶逐火\n\n# 剧情高光\n\n*   **噩梦般的追逐与执念的开端:**\n    ？？？：“很好，我要你愤怒，你必须愤怒。你会害怕，会慌乱，会痛苦万分，但愤怒会冲刷掉这一切。在愤怒面前不会有任何阻碍，森林会因为你的怒火而不堪一击。”\n    年老的猎人：“没错，我会愤怒，我会拔去森林的尖牙，砍下它的利爪。它如何对待你，我就会如何奉还。”\n*   **初遇异世界生物与未知威胁:**\n    黑角：“夜刀，有喵......呸呸。”\n    夜刀：“不对，还得考虑是否是活着的生物留下的痕迹。如此庞大体型的羽兽，我很难想象它该长成什么样子。而且，在爪痕上检测到了活性源石微粒，源石究竟从何而来......”\n    白色的奇怪生物：“你才没有智力喵！不礼貌的长角女人！”\n    白色的奇怪生物：“马上就要来了！”\n*   **职责与个人安危的取舍:**\n    夜刀：“任务优先，必须保证村庄居民的安全。”\n    黑角：“你的伤势需要休息。”\n    夜刀：“任务优先，必须保证村庄居民的安全。”\n*   **村庄隐秘的揭示:**\n    感染者幼童：“爸爸他......从洞里回来后不久......就被村长带走了。”\n    感染者幼童：“爸爸说，洞里面有很大的怪物，很不安全......可村长说爸爸在骗人，大家都不相信他......村长就把爸爸带走了。”\n*   **柏生义冈的悲痛与真相:**\n    柏生义冈：“明，他是我的儿子......他已经死了。”\n    柏生义冈：“七年前的今天，也是这样的晚上，山里到处都是那些畜生的嚎叫。”\n    泷居应：“他（柏生明）说，我一定会战胜它们的。”\n    泷居应：“师父，最后一句话，请帮我转达给我的父亲，那个顽固的老头子。他说的是......‘对不起，父亲。’”\n    柏生义冈：“可是我啊......”（泪水落下）“我很想他。”\n*   **夜刀的自白与守护的决心:**\n    夜刀：“过去就是过去......你所有的悔恨，所有的罪孽，就用全部的未来去弥补吧。”\n    夜刀：“生命诞生于这片大地之上，并非为了轻易死去，活着才拥有全部的可能。所以我必须竭尽全力。”\n    夜刀：“我当没有听见你说的话。（伸出手）......这不是一条容易的道路。我只能祝你好运了。”\n    柏生义冈：“哦......随便你。（泪水落下）我很想他。”（这段其实结合了剧情和高光）\n    夜刀：“别*东国粗口*废话！”（对柏生义冈）“你是露华村的猎人，唯一的猎人，唯独你不可沉默。你最不应该做的就是在这里自怨自艾，更没有资格放弃你的生命。”\n*   **关键时刻的艰难选择:**\n    夜刀：“真是个难题......”\n    黑角：“夜刀，再听俺说一句话。记得俺们做过的决定吗？那个时候俺们就已经做出选择了。”\n    夜刀：“决定不会改变，我马上就出发去找柏生先生，那边的情况你们尽力控制。柏生先生的性命我会救下，火龙也休想对任何人造成伤害。我会救下所有人。”\n*   **父子传承与希望的传递:**\n    和也：“怪、怪物......不许靠近爷爷！我！我是和也！我也是村里的猎人！”\n    夜刀：“多谢您争取的时间，柏生先生。现在请好好在一边歇着吧。接下来......交给我们。”\n    和也：“你们看！这是什么？......以后，我才会是村里最厉害的猎人，你就一边歇着去吧！”（拿着狩猎矛）\n*   **天灾下的生命与共存:**\n    夜刀：“天灾......越来越近了。......在真正的灾难面前，我们都太渺小了。”\n    夜刀：“天空之下从来都不只属于我们，这片大地上的所有生命，都只是尽力生存而已......为了一线生机而彼此争斗，哪怕......壮烈而死。”\n\n## 相关信息\n\n*   本次活动是明日方舟与Capcom游戏《怪物猎人》系列的联动活动。\n*   活动中出现的艾露猫（学者猫、工匠猫、随从艾露猫）是《怪物猎人》系列中的重要角色\/伙伴，它们的名字、习性（会说话、随从属性）、职业（学者猫、工匠猫）以及一些口癖（喵）都与原作一致。\n*   活动中的主要怪物“火龙”是《怪物猎人》系列中的标志性怪物之一，其行为模式、攻击方式（甩尾、喷火、爪子有毒）、弱点（头部、翅膀、尾巴）以及素材（红玉、肝）都与原作设定相符。\n*   剧情中多次提及的《怪物猎人》系列元素包括：汉方药、解毒草、蓝蘑菇、异臭球、烟雪鼬（怪物）、雪鬼兽（怪物）、迅龙（怪物）、硬甲龙（怪物）、冠突龙（怪物）、书士队、王立古生物书士队、新大陆古龙调查团、集会所、猎人营地。\n*   夜刀和黑角在活动中获得的特殊装备“麒麟衍生武具”以及使用的武器双剑和太刀，及其招式“鬼人化”、“气刃斩”、“居合拔刀气刃斩”、“气刃兜割”、“空中回旋乱舞”，均"
    ],
    "response":"根据检索到的文档，其中只介绍了“教士”这一种角色类型，并将其分为三类：**审判庭的教士**、**与“大海”相关的教士**、**导师与布道者**。文档中没有提供其他类型的敌人信息。",
    "reference":"明日方舟中有多种类型的敌人，包括普通、领袖等不同地位级别，攻击类型包括近战物理、远程法术等，行动方式包括地面和空中。",
    "context_precision":0.0,
    "context_recall":0.0,
    "faithfulness":0.5,
    "answer_relevancy":0.3190932285
  },
  {
    "user_input":"阿米娅有哪些别名？",
    "retrieved_contexts":[
      "# 阿米娅\n\n# 其他名称\n\n魔王;小小的魔王;异族的稚儿;异族的魔王;小兔子;温柔的孩子;娇小的卡特斯;新的魔王;我王;卡特斯女孩;文明的存续的继承者;巴别塔的领导者;阿米娅小姐;兔子小姐\n\n## 简要介绍\n\n阿米娅是罗德岛制药公司的公开领袖，一位充满理想与坚韧的卡特斯少女。她在一场车祸中失去双亲并感染矿石病，后被失忆前的博士救下，并与特蕾西娅、凯尔希共同组建巴别塔。特蕾西娅遇刺后，阿米娅继承了萨卡兹“魔王”的王冠与力量，肩负起终结感染者苦难、切断仇恨循环的使命。她拥有感知他人情感的独特源石技艺。尽管外表柔弱，阿米娅在博士和凯尔希的陪伴下，带领罗德岛穿越泰拉的动荡，直面萨卡兹的千年宿命与维多利亚的战火，展现出超越年龄的智慧、勇气与对和平的坚定追求，是罗德岛理念的核心象征。\n\n## 相关角色\n\n- 博士阿米娅最信任的伙伴，罗德岛的最高指挥官。博士是阿米娅的救命恩人、精神支柱和最重要的同伴。阿米娅将自己早年的野外生存技能归功于博士，并对他抱有无条件的信任与依赖，多次舍身保护他，甚至在极端危机中将罗德岛指挥权托付。博士的回归是阿米娅做出的“豪赌”，两人共同承担罗德岛的使命，并约定无论未来如何都将并肩作战，阿米娅更誓言若博士误入歧途，她将是唯一能阻止他的人。\n- 凯尔希罗德岛的资深医生与重要成员，阿米娅的导师和引路人。她在特蕾西娅遇刺后，成为阿米娅成长路上的关键指引者，密切关注阿米娅对“魔王”力量的适应与使用，并为其提供战略支持与医疗保障。阿米娅信任凯尔希的判断，但也体恤她的辛劳，有时选择独自承担压力。凯尔希视阿米娅为罗德岛的未来，并与她共同描绘感染者的希望。\n- 特蕾西娅前任“魔王”，巴别塔的领袖，阿米娅力量与意志的来源。她如慈母般关爱幼年阿米娅，并在遇刺前将“黑王冠”和“文明的存续”力量传承给阿米娅，希望她改写宿命。特蕾西娅的幻影与意志多次在阿米娅的梦境和精神深潜中显现，指引她理解萨卡兹的苦难，并最终在“慈悲灯塔”活动中完成力量的正式传承，让阿米娅明确了作为“魔王”的使命。\n- 煌罗德岛精英干员，阿米娅的亲密战友和朋友。阿米娅信任煌的战斗力，也关心她的情感状态，在她迷茫时给予支持和鼓励，并会以请吃咖喱等方式安抚。煌亲昵地称呼阿米娅为“小兔子”，对阿米娅忠诚且听从指挥。\n- 陈龙门近卫局警司，阿米娅的朋友与合作者。两人在切尔诺伯格与龙门危机中并肩作战，阿米娅理解陈的坚韧与内心的挣扎，并在危急时刻与其情感共鸣，掌握了陈的剑术。阿米娅对陈的态度从最初的“严格”到后来的信任与相互理解。\n- 塔露拉整合运动领袖，陈晖洁的姐姐。阿米娅在切尔诺诺格核心城与被科西切操控的塔露拉进行了决定性对决，通过感知与呼唤唤醒了塔露拉本身的意志，帮助她摆脱了科西切的诅咒。两人之间的纠葛远未结束，阿米娅预感她们终将重逢。\n- 梅菲斯特整合运动干部，手段残忍。阿米娅对其非人道行为深感厌恶和愤怒，直斥其恶毒，并拒绝赋予他任何“光荣”的死亡。阿米娅多次与他交锋，并誓言清理其“怨恨的毒”。\n- 霜星整合运动雪怪小队队长。阿米娅通过感知情感，理解了霜星内心深处的痛苦与愤怒，并试图用罗德岛的理念感化她。霜星在濒死之际将希望托付给阿米娅，阿米娅则将一种治疗霜冻的药物命名为“霜星”以作纪念。\n- 爱国者整合运动温迪戈战士。阿米娅在“苦难摇篮”中与爱国者对峙，感知到他两百多年的痛苦与悔恨，并试图为他带来“更好的结局”。爱国者在生命的最后识破了阿米娅“魔王”的身份，并将停止核心城的秘钥托付给她，感叹“我王......你往何处去？”。\n- W前巴别塔佣兵，后加入整合运动。她对阿米娅与博士抱有复杂情感，既是搅局者也是合作者。W曾嘲讽罗德岛干员的牺牲“毫无价值”，被阿米娅愤怒驳斥。在关键时刻，她协助罗德岛停止切尔诺伯格，并最终在特蕾西娅的引导下放下过去，成为“维什戴尔”。\n- **Logos**：罗德岛精英干员，女妖王庭之主。他忠实地追随特蕾西娅的理想，并坚定地保护阿米娅。在对抗血魔大君和萨卡兹众魂时，Logos与阿米娅并肩作战，其“丧钟”力量与阿米娅的“魔王”力量产生共鸣，是阿米娅信赖的战友。\n- 暴行罗德岛精英干员，阿米娅的亲密朋友与如同姐姐般的存在。她幼年时曾照顾阿米娅，对她充满牵挂。得知阿米娅成为罗德岛领袖后，暴行被其感召，决定加入罗德岛，誓言倾尽所有力量保护阿米娅。阿米娅也依赖她，并与她分享生活乐趣。\n- 华法琳罗德岛资深医生。她曾是阿米娅在罗德岛的“第一个病人”，密切关注阿米娅的身体和精神健康，并提醒她控制“魔王”力量的使用。她对阿米娅的成长抱有深切的期望，希望她能活着回来。\n- 迷迭香罗德岛精英干员，与阿米娅关系深厚。阿米娅能通过精神链接安抚迷迭香的负面情绪，并对她抱有极高的尊重与关心。迷迭香将阿米娅视为亲近的家人。\n- 米莎一个乌萨斯感染者少女，被整合运动利用。阿米娅在",
      "# 阿米娅\n\n# 详细介绍\n\n阿米娅是泰拉大地上，罗德岛制药公司的公开领袖，一位年轻的卡特斯少女，却肩负着改变世界命运的重担。她身患矿石病，并继承了萨卡兹“魔王”的王冠与力量，致力于为感染者和所有受压迫者寻找一条通往希望的道路。\n\n**失落的童年与重获新生**\n阿米娅的童年始于雷姆必拓。在一次突如其来的车祸中，她失去了双亲，自己也染上了矿石病。在绝望与荒芜中，年幼的她被当时失忆前的博士偶然救起。博士不仅将她带离险境，更向她承诺会治愈她的疾病，为她带来一个充满希望的未来。这段经历是阿米娅生命的“最初坐标”，奠定了她对博士无与伦比的信任与依赖，她曾对博士说：“博士在哪，我就在哪。”（出自活动剧情“巴别塔”\/“悠长的旅途”）。\n随后，博士带着阿米娅抵达了巴别塔。在那里，她遇到了巴别塔的领袖、萨卡兹“魔王”特蕾西娅，以及资深医生凯尔希。特蕾西娅对阿米娅展现出如同母亲般的关爱与温柔，陪伴她，为她讲故事，并让巴别塔成为了阿米娅的新家。凯尔希则开始为阿米娅的矿石病制定治疗方案。在这段时期，阿米娅敏感地察觉到博士因过度劳累而变得不开心，担忧是自己的病情让他感到低落。\n\n**“魔王”的传承与觉醒**\n巴别塔与军事委员会的内战期间，特蕾西娅为了保护阿米娅，在遇刺的最后时刻，将象征着“黑王冠”和“文明的存续”的力量传承给了阿米娅，希望她能改写萨卡兹的悲惨结局，带领巴别塔走向未来。特蕾西娅的意识也短暂寄宿在阿米娅体内，向凯尔希传达了最后的嘱托。这一刻，年幼的阿米娅被赋予了沉重的“魔王”宿命。\n继承力量初期，阿米娅的精神状态曾一度棘手，会出现呓语、非自发读取他人情绪以及对力量控制不稳的情况，手上的戒指也成为抑制这份强大力量的“枷锁”。凯尔希和华法琳等罗德岛的医生们为此付出了巨大努力。\n\n**唤醒博士与切尔诺伯格的战火**\n在特蕾西娅遇刺后，博士进入了长达三年的休眠。阿米娅与凯尔希接管巴别塔，将其改组为罗德岛制药公司。三年后，阿米娅亲自带领小队深入乌萨斯城市切尔诺伯格，唤醒了失忆的博士。面对博士记忆的缺失，阿米娅坚定地自我介绍，强调博士是她“最重要的同伴”，并毫不犹豫地将罗德岛的指挥权托付给他，展现了她对博士无条件的信任。\n切尔诺伯格被整合运动攻占，罗德岛在撤离过程中，阿米娅目睹了整合运动的暴行，也亲历了平民对感染者的恐惧。她向博士解释矿石病的残酷，以及罗德岛为感染者争取生机的使命。她坚定地表示罗德岛的宗旨是“希望各位，都能绽放笑容”，并希望罗德岛能成为感染者的“温暖的家”。\n在龙门贫民区，阿米娅为保护博士，首次爆发力量击倒了整合运动的“碎骨”。然而，这让她陷入深深的自责与痛苦，质疑自己作为感染者领袖，却不得不夺走其他感染者生命的矛盾。她向博士倾诉内心的挣扎，但最终重申了保护博士的决心。米莎的死，以及她最终选择站到整合运动一边，让阿米娅对仇恨的循环有了更深刻的理解与悲哀。在与碎骨的第二次对决后，阿米娅收下了他的面具，象征着背负这份痛苦继续前行。\n在与整合运动领袖塔露拉的最终对决中，阿米娅通过与陈晖洁的情感共鸣，解开一枚戒指的束缚，觉醒了“近卫”形态的力量——“云裂之剑-影霄”。她直面“不死的黑蛇”科西切对塔露拉的操控，揭露其谎言，最终成功唤醒了塔露拉本身的意志，帮助她摆脱了诅咒。战后，阿米娅因巨大压力和情绪释放而昏倒，凯尔希抽取博士的血液制造药物并为他注射，醒来后她流下了久违的眼泪，并命名了一种治疗霜冻的药物为“霜星”，以纪念那些牺牲的战士。她向博士重申，无论未来多艰难，罗德岛都会前行，如果博士有一天误入歧途，她将是唯一能阻止他的人。\n\n**维多利亚的战火与“魔王”之路的抉择**\n随着罗德岛前往维多利亚伦蒂尼姆，阿米娅的“魔王”身份和力量得到了更深层的展现与考验。她能感知到伦蒂尼姆中心盘桓的“更古老的......更强大的力量”，以及萨卡兹万年来的悲愤与仇恨。在与血魔大君的交锋中，她被萨卡兹众魂的集体记忆冲击，亲身感受了萨卡兹历史上的苦难与对凯尔希的复仇渴望，痛苦不堪，但她拒绝被仇恨吞噬，坚称“戒指不行，我可以。我不是器具。”（出自慈悲灯塔 \/ 应对饱和打击）\n在“惊霆无声”活动中，阿米娅梦见了萨卡兹掌控下维多利亚的悲惨未来，这让她对“魔王”的使命感到迷茫。她被“灰礼帽”确认为“魔王”，并被死魂灵质疑其作为“异族魔王”的资格。但阿米娅选择直面所有苦难，坚定地拒绝了死魂灵所代表的永恒仇恨之路，她的这种“能拒绝”仇恨的特质，被博士肯定为她作为“魔王”的独特与必要之处。\n在“破碎日冕”中，阿米娅在列车上意外亲眼见到了活着的、白发萨卡兹形态的特蕾西娅。这一幕给她带来了前所未有的震惊与悲哀，让她坚定了追寻真相的决心：“既然我来到了这里，那我就需要弄清楚真相。”（出自破碎日冕\/理想的倒影）\n最终，在“慈悲灯塔”活动中，阿米娅与博士、凯尔希、W等深入“阿喃那”内部形成的",
      "# 陨星\n\n# 其他名称\n\n陨星;钝镝;重矢\n\n## 简要介绍\n\n陨星，萨卡兹族感染者，来自饱受战火摧残的卡兹戴尔。她曾是“守林人”组织成员，后成为一名辗转各地的自由佣兵，代号多变，以参与萨卡兹相关战役为主。现作为罗德岛的狙击干员，使用重型弩炮提供卓越的范围杀伤。她外表冷峻，言语直接，内心却保有温情，尤其关注同族萨卡兹的命运。在罗德岛，她逐渐找到了安定，并对未来抱有复杂但包含希望的情感。\n\n## 相关角色\n\n-   守林人前“守林人”组织成员，曾与陨星并肩作战。陨星对其有复杂情感，认为故乡毁灭后守林人的时间停止了，且不愿提及叛军引向她故乡的事与自己无关，认为萨卡兹人的话不会被相信。\n-   阿米娅罗德岛的领导者。陨星对其非常信任和关心，将她视为需要保护的孩子，同时也从阿米娅那里学到了重要的道理。阿米娅的理念让陨星动摇了离开罗德岛的念头，并在她身上看到了萨卡兹未来的希望。\n-   **萨卡兹教师**：陨星年轻时遇到的萨卡兹老人，教导她认字和理解词语。他代表了萨卡兹民族的文化和对美好生活的向往，并将未完成的词典托付给陨星。\n-   杰西卡罗德岛干员，曾与陨星在切城废墟一同执行侦察任务。陨星认可她的成长，同时像对待孩子一样关心她的心理创伤。\n-   霜叶罗德岛干员，曾与陨星在切城废墟一同执行侦察任务。陨星对其十分关心，不惜受伤也要将其从险境中救出，并认为她有时过于逞强像个孩子。\n-   史尔特尔罗德岛干员，曾与陨星一同执行勘探任务。陨星发现她难以相处，但理解她寻找“归所”的困境，并尝试开导她。\n-   幽灵鲨罗德岛干员，曾与陨星一同执行过一次高难度任务。陨星对她的精神状态和战场表现感到不安和困惑。\n-   临光罗德岛干员，曾与陨星计划共同执行巡逻任务。两人有较为轻松的交流。\n-   杜宾罗德岛干员，与陨星、临光有日常交流，关心新干员培养。\n-   博士罗德岛的领导者，陨星的雇主。陨星对博士表示感谢和信赖，承诺会尽力保护博士，并第一次在一个组织久留并感到安定。\n\n## 详细介绍\n\n陨星，一名萨卡兹族感染者，其漫长且充满战火的生涯始于卡兹戴尔。她曾是“守林人”组织的一员，一个似乎因故乡毁灭而停止了前进的组织，而那段历史，陨星选择绝口不提，只留下一句“没人会相信一个萨卡兹人的话”，暗示着复杂与误解。脱离守林人后，她成为了自由佣兵，在泰拉大陆的各个角落辗转作战，代号多达十七个，包括早期的“钝镝”、“重矢”以及最终确定的“陨星”。这些代号背后，是无数次任务、无数场战役，其中大部分都与萨卡兹有关，她几乎没有停歇地为萨卡兹人的命运而战。\n\n她的佣兵生涯塑造了她冷峻、务实的性格。在年轻作为“钝镝”时，她已经学会在腥风血雨中清晰地计算自己的所得，毫不客气地维护自身利益。然而，战争也在她内心留下了深刻的创伤。在一次任务中，她遇到了一个萨卡兹教师，他试图教导她认字，并解释一个对她而言无法理解的词——“一个令人心生欢喜，悠闲宁静的夜晚”。在战火中成长的她，无法将夜晚与美好联系起来，她的每一次尝试联想都被痛苦的回忆打断：团长的严厉训练、同伴间的警惕、随时可能落下的炮火。即使是看到萤火虫的微光，她也曾误以为是战场死者的“鬼魂”。尽管如此，在教师的引导下，她内心深处仍有微弱的触动，像一只小虫振动翅膀，微弱但充满生机。最终，教师在营地遇袭后选择放弃，将一本未完成的萨卡兹语词典托付给她，希望她能在那一天理解并补全那个词条。这个词和这本词典成为了她心中未完成的功课，也是她对萨卡兹民族未来的某种寄托。\n\n多年来，她一直在为萨卡兹的地位和未来而努力，尽管常常感到无力和挣扎。萨卡兹人在主流社会中受到排挤是普遍事实，这也使得她习惯于戴上冰冷的面具，独善其身。然而，当她来到罗德岛，这个汇聚了各种种族和身份的地方，她的看法开始改变。她惊讶地看到许多萨卡兹人在此和睦相处，这在她过去的生活中是难以想象的。阿米娅对她说“我也想帮助萨卡兹人”这句话，深深地触动了她，让她动摇了继续漂泊、终将离开罗德岛为萨卡兹独立目标而战的想法。她开始愿意相信，这片大地上，还有人对未来抱有期待，罗德岛或许能为萨卡兹提供一个更好的容身之处。\n\n在罗德岛，陨星展现了她作为资深干员的专业能力和对同伴的深切关怀，尤其体现在对年轻干员的照顾上。在切尔诺伯格分城废墟的救援行动中，她作为侦察小队的领导者，带领杰西卡和霜叶执行任务，展现了冷静的判断力和战斗技巧，利用爆炸物制造掩护。面对整合运动和雪怪小队的威胁，她表现出对不利局势的厌恶，不愿像被逼入绝境的猎物一样躲藏。在阿米娅的救援队伍到来后，她对阿米娅的到来既感到高兴又担忧其陷入危险。当杰西卡因目睹梅菲斯特的残忍行径而受到心理创伤时，陨星努力安抚她。在霜叶为掩护大家而突进并被霜星重创时，陨星不顾自身受伤，毅然冲上前将霜叶救回，并流露出对霜叶和阿米娅这些“孩子”逞强行为的担",
      "# 沉痛转机\n\n# 剧情总结\n\n本次活动剧情《沉痛转机》聚焦于罗德岛干员暴行（Barrage）加入罗德岛之前的经历。故事伊始，暴行刚刚结束了在巴别塔（Babel）为期两年的合作任务，返回家乡雷姆必拓（Remu Biton）的矿区。她与一位名叫老约翰的老矿工交谈，表达了对结束巴别塔合作的迷茫，以及对任务期间认识的一位萨卡兹（Sarkaz）女孩（后文暗示为阿米娅）的牵挂。暴行曾与巴别塔合作负责将雷姆必拓开采出的“舰体和核心”运输并交付，但合作突然终止，她对此感到困惑，同时也对离开家乡、见到外部世界的经历感到触动。尽管心中牵挂着那位女孩，暴行还是回到了雷姆必拓，继续她作为安保人员的职责，保护矿工们的安全。老约翰鼓励她无论身处何地都要肩负起自己的使命和责任。\n\n两年后，暴行继续在雷姆必拓矿区工作。一场突如其来的灾难降临：27、28、29号矿井发生严重的活性源石粉尘爆炸。暴行立即投入到危险的救援工作中，她冒着生命危险进入坍塌、充满粉尘的矿井，成功救出了包括老约翰在内的多名伤员。\n\n在矿区外设置的临时救助站，暴行遇到了参与联合应急医疗小组的志愿者。她惊讶地发现，其中一些医疗人员来自一个她从未听说过的组织——罗德岛制药公司（Rhodes Island Pharmaceuticals）。罗德岛医疗干员使用了效果显著的应急药物，有效抑制了矿工们的源石感染扩散，这让暴行感到非常意外，因为雷姆必拓现有的医疗资源对此效果有限。\n\n在与一位罗德岛医疗干员交流时，暴行无意中听到了一个熟悉的名字——凯尔希（Kal'tsit）。这让她产生了联想。她进一步询问罗德岛的领袖是谁，当听到“阿米娅”（Amiya）这个名字时，暴行感到极度震惊和激动。她意识到，这个名字与她两年前在巴别塔任务期间认识并一直牵挂着的那位萨卡兹女孩是同一个人。尽管阿米娅年龄尚小，但罗德岛医疗干员对她的智慧和领导能力赞不绝口，并证实阿米娅确实提过一位在雷姆必拓的亲密好友。\n\n得知阿米娅的身份和下落后，暴行立刻做出了决定。十五天后，她来到救助站的感染者病房探望老约翰。老约翰已经确定感染矿石病，他为了家人的生计，决定病愈后离开雷姆必拓，前往哥伦比亚参与“大拓荒”。暴行向老约翰坦承了自己即将离开雷姆必拓的决定，她告诉他自己找到了必须保护的朋友（阿米娅），并且要去她身边。老约翰理解并支持暴行的选择，认为每个人都有自己的使命，暴行也应该去拯救更多的人、保护她在乎的人。\n\n在向老约翰和家人告别后，暴行正式接受了罗德岛的入职邀请。她与罗德岛医疗干员会合，接过招聘合同，并表示迫不及待地想见到阿米娅，与她分享过去两年的经历，也想听听阿米娅的故事。故事在暴行满怀期待踏上前往罗德岛旅程的时刻结束，标志着她人生新篇章的开始，以及与阿米娅的即将重逢。整个故事通过矿区生活的艰辛、突如其来的灾难、以及关键人物的出现，展现了暴行性格的转变和最终的抉择，为她作为罗德岛干员的身份提供了深刻的背景。\n\n## 剧情高光\n\n-   老约翰对暴行的叮嘱：\n    > “每个人，每个时代，都有着不得不肩负的使命和责任。”\n    > “我知道，你从小就不是个普通兔子。每个人都有自己的使命和责任。”\n    > “你的锤子救了我们的命，接下来的日子，你也会拯救更多的人。”\n    > “如果有必须要保护的人，那就离开吧。我也一样。”\n-   暴行得知阿米娅身份时的反应：\n    > 罗德岛医疗干员: 我们的首领，罗德岛组织现任领袖，她的名字是——“阿米娅”。\n    > 暴行: ......阿......米娅......\n-   暴行决定前往罗德岛与阿米娅重逢时的内心独白：\n    > 我找到了。\n    > 阿米娅，你变成什么样了呢？\n    > 已经成长为领袖了，真了不起。\n    > 等着我吧，阿米娅。不论发生了什么，现在肩负着什么样的使命。\n    > 我有好多想告诉你、想和你分享的故事。你会想听吗？\n    > 这两年里，你遇到的快乐的事情、难过的事情，我遇到的快乐的事情、难过的事情——\n    > 在见面以后，来尽情诉说吧。\n\n## 相关信息\n\n-   雷姆必拓的矿区开采的“货物”是“舰体和核心”，这些被送往巴别塔。\n-   巴别塔与雷姆必拓的合作在活动两年前突然结束，原因未知。\n-   故事发生的地点“钢铁萝卜城”是一个有趣的名称。\n-   雷姆必拓矿工的老约翰在感染矿石病后，打算前往哥伦比亚参加“大拓荒”，这暗示了哥伦比亚当时正在进行的大规模开发活动。\n-   罗德岛在处理矿石病感染方面展现出了远超当地水平的医疗能力，其应急药剂能有效抑制感染扩散。\n\n## 关键人物\n\n暴行; 老约翰; 阿米娅; 凯尔希; 罗德岛医疗干员\n\n## 角色剧情概括\n\n-   **-   暴行**: 本故事的主角。她从巴别塔合作任务归来，回到家乡雷",
      "# 阿米娅\n## 干员名: 阿米娅\n## 干员外文名: Amiya アーミヤ\n## 星级: 5\n## 职业: 术师\n## 分支: 中坚术师\n## 特性: 攻击造成法术伤害\n## 所属势力: 罗德岛\n## 隐藏势力: 无\n## 获得方式: 主线剧情 （首次通关主题曲2-10、3-8、4-9、6-17、7-18获取）\n## 上线时间: 2019年4月30日 10:00\n## 画师: 唯@W\n## 配音\n  中文: 陶典\n  日文: 黑泽朋世\n  韩文: 李智贤\n  英文: Emma Ballantine\n## 生命上限_攻击_防御_法术抗性\n  精英0_1级: 699 276 48 10\n  精英0_满级: 958 390 81 10\n  精英1_满级: 1198 514 110 15\n  精英2_满级: 1480 612 121 20\n  信赖加成上限: 200 70 0 0\n## 再部署: 70s\n## 部署费用: 18→20\n## 阻挡数: 1\n## 攻击速度: 1.6s\n## 攻击范围\n  精英0范围: ['XXX', 'TXX', 'XXX']\n  精英1_精英2范围: ['XXX.', 'TXXX', 'XXX.']\n## 技能\n  - 名称: 战术咏唱·γ型, 类型: 自动回复 手动触发, Level 7_初始_消耗_持续: 攻击速度+60 | 10 32 30, Rank Ⅲ_初始_消耗_持续: 攻击速度+90 | 15 30 30\n  - 名称: 精神爆发, 类型: 自动回复 自动触发, Level 7_初始_消耗_持续: 每次攻击变为攻击力45%的7连发，随机攻击范围内的目标 技能自动开启，持续时间结束后阿米娅晕眩10秒 | 0 100 25, Rank Ⅲ_初始_消耗_持续: 每次攻击变为攻击力60%的8连发，随机攻击范围内的目标 技能自动开启，持续时间结束后阿米娅晕眩10秒 | 0 100 25\n  - 名称: 奇美拉, 类型: 自动回复 手动触发, Level 7_初始_消耗_持续: 攻击力+160%，生命上限+75%，攻击范围扩大，伤害类型变为真实 技能结束后阿米娅强制退出战场 | 0 120 30, Rank Ⅲ_初始_消耗_持续: 攻击力+230%，生命上限+100%，攻击范围扩大，伤害类型变为真实 技能结束后阿米娅强制退出战场 | 0 120 30, 备注: ※强制退出战场视为撤回干员，返还部分部署费用\n## 天赋\n  - 名称: ？？？, ——: ？？？？？\n  - 名称: 情绪吸收, 精英2: 成功造成伤害后额外回复2（潜能6：+1）点技力，消灭敌人后额外获得8（潜能6：+2）点技力, 精英2 Y模组2级: 成功造成伤害后额外回复3（潜能6：+1）点技力，消灭敌人后额外获得8（潜能6：+2）点技力, 精英2 Y模组3级: 成功造成伤害后额外回复3（潜能6：+1）点技力，消灭敌人后额外获得10（潜能6：+2）点技力\n## 潜能提升\n  备注: 该干员无法使用通用信物来提升潜能。\n  潜能提升2: 生命上限+200\n  潜能提升3: 部署费用-1\n  潜能提升4: 攻击力+30\n  潜能提升5: 部署费用-1\n  潜能提升6: 天赋效果增强\n## 后勤技能\n  - 条件: 精英0, 技能: 合作协议, 房间: 控制中枢, 描述: 进驻控制中枢时，所有贸易站订单效率+7%（同种效果取最高）\n  - 条件: 精英2, 技能: 小提琴独奏, 房间: 宿舍, 描述: 进驻宿舍时，该宿舍内所有干员的心情每小时恢复+0.15（同种效果取最高）\n## 模组\n  DWDB-221E: {'阶段1': {'属性': '生命+100 攻击+30', '描述': '特性追加：普通攻击命中精英或领袖敌人时获得1点技力'}, '阶段2': {'属性': '生命+130 攻击+40', '描述': '天赋【情绪吸收】更新 成功造成伤害后额外回复3点技力，消灭敌人后额外获得8点技力'}, '阶段3': {'属性': '生命+150 攻击+50', '描述': '天赋【情绪吸收】更新 成功造成伤害后额外回复3点技力，消灭敌人后额外获得10点技力'}, '解锁任务': '由非助战阿米娅累计歼灭10个精英或领袖敌人 3星通关主题曲3-8；必须编入非助战中坚术师状态的阿米娅并上场，且使用中坚术师状态的阿米娅歼灭碎骨'}"
    ],
    "response":"根据文档1，阿米娅的别名包括：魔王、小小的魔王、异族的稚儿、异族的魔王、小兔子、温柔的孩子、娇小的卡特斯、新的魔王、我王、卡特斯女孩、文明的存续的继承者、巴别塔的领导者、阿米娅小姐、兔子小姐。",
    "reference":"阿米娅的别名包括：魔王、小小的魔王、异族的稚儿、异族的魔王、小兔子、温柔的孩子、娇小的卡特斯、新的魔王、我王、卡特斯女孩、文明的存续的继承者、巴别塔的领导者、阿米娅小姐、兔子小姐。",
    "context_precision":1.0,
    "context_recall":1.0,
    "faithfulness":1.0,
    "answer_relevancy":0.5159848669
  },
  {
    "user_input":"阿米娅和博士是什么关系？",
    "retrieved_contexts":[
      "# 自有一“派”\n\n# 剧情总结\n\n本次活动“自有一‘派’”的剧情围绕着雷姆必拓矿业公司驻罗德岛办事处的干员暴行，以及她与阿米娅、博士等人的互动展开。故事始于阿米娅因博士、凯尔希和特蕾西娅外出而感到无聊，前来寻找暴行。暴行提议教阿米娅制作她最喜欢的雷姆必拓特色美食——胡萝卜派。在温馨愉快的氛围中，两人开始准备食材。阿米娅虽然是第一次尝试烹饪，显得手忙脚乱，状况百出，比如打蛋打得一团糟，洗胡萝卜时用指甲刮皮，和面和烤制等高难度步骤也需要暴行代劳，甚至不小心把面粉撒得到处都是。尽管过程有些混乱，暴行始终耐心而宠溺地指导阿米娅，并认为此刻的阿米娅非常可爱。两人合作完成了三个胡萝卜派，及时赶在阿米娅、博士以及受邀的其他干员（莱恩哈特、断崖、四月）前来品尝前烤好。\n\n在餐厅的品尝环节，莱恩哈特、断崖和四月已经先到一步，正在愉快地享用暴行制作的派。莱恩哈特展示了他独特的、加入大量番茄酱的维多利亚式吃法，引发了四月和断崖的吐槽以及暴行的制止，场面显得十分热闹。阿米娅和博士随后加入，看到大家一起分享美食的场景。\n\n阿米娅品尝了暴行制作的胡萝卜派，立刻被那熟悉的家乡味道勾起了回忆，感到非常美味和安心。暴行也为博士准备了一份根据其口味特别制作的派，这让博士意识到暴行似乎了解过去的自己。暴行坦承自己确实了解过去的博士，但因与凯尔希有保密协议而不能透露太多，这引发了对博士失忆背景的侧面描写。阿米娅回忆起小时候暴行姐姐对她的照顾，并表达了希望未来能继续与暴行一起做美食、一直在一起的愿望。然而，她也提到了凯尔希医生曾说过，雷姆必拓矿业公司与巴别塔（罗德岛前身）的合作项目即将结束，暴行可能要回雷姆必拓。\n\n这个话题触及了分别的可能性，暴行确认了她确实可能要回雷姆必拓工作一段时间，承担大人的责任。但她向阿米娅承诺，无论分隔多远，她们都是好朋友，只要阿米娅需要帮助，她一定会来保护她。她鼓励阿米娅努力学习成长，未来或许也能开一家公司，甚至雇佣自己。暴行肯定了阿米娅在博士、凯尔希、特蕾西娅等“老师们”的教导下变得非常出色。阿米娅则表示虽然知道分别会害怕，但今天的烹饪体验让她很开心，留下了美好的回忆，未来也不会那么害怕了。她称赞暴行是她非常厉害的老师，不仅会做美食，工作出色，还会像真正的姐姐一样照顾她。暴行也被阿米娅的成长和话语感动落泪，表示能看到阿米娅开心自己也非常高兴，也对即将分开感到难过。但她相信，只要双方都有着一样的信念并努力前进，就一定能再次重逢，并嘱咐阿米娅“平安长大”。\n\n对话转向胡萝卜派的原料问题。阿米娅提到购买雷姆必拓特产的胡萝卜罐头今年特别困难，价格升高、购买途径减少。暴行对此十分愤慨，解释说这是因为有维多利亚的商人在炒作雷姆必拓胡萝卜具有保持年轻健康的奇效（尽管暴行和阿米娅都觉得荒谬），导致胡萝卜罐头供不应求，价格暴涨，甚至连雷姆必拓本地人都买不到。这次的胡萝卜还是她特地拜托农户邻居用私人的存粮制作成罐头邮寄过来的。\n\n暴行担心这种炒作不仅扰乱了正常的市场秩序和农户的种植计划，更有可能引发像“围栏事件”那样的危机。她向博士和阿米娅简要介绍了“围栏事件”：维多利亚商人企图利用小型移动城市控制雷姆必拓地区的矿料资源，并牟取利益，最终由当地民众反抗，挣脱了商人的控制，成立了更为自主的尤立卡自治州。暴行在那次事件中也做出了许多努力。尽管“围栏事件”证明了雷姆必拓人能够守护自己的土地，但外部势力的觊觎并未停止，这次的胡萝卜炒作就是新的例证。\n\n暴行表示自己已经写信提醒老家的人警惕商人的陷阱，不能为了眼前的不合理暴利而打乱生活。她认为美食应该带来快乐，而不是被当作冒牌的“良药”被炒作利用。她强调不能让其他地区势力得寸进尺，无论是矿石料还是胡萝卜，都不会让他们轻易夺走不属于他们的东西。\n\n在阿米娅借故离开后，暴行与博士进行了更深入的交流。暴行重申自己了解过去的博士，但被保密协议约束无法详谈，不过她认为无论博士过去怎样，现在和阿米娅的关系以及她和阿米娅、博士的关系都没有改变，依然是朋友。她肯定了博士是一位“非常厉害的人”，能够给予他人“知识”，引导他人前进。她随后分享了自己离开巴别塔\/罗德岛后回到雷姆必拓的经历。这几年雷姆必拓的矿难频发，感染者数量增长，待遇得不到保障，以及其他地区对雷姆必拓的觊觎等不合理现象越来越多，让她认识到仅仅在矿业公司工作不足以解决问题。她明白安稳的生活正在受到威胁，决定离开雷姆必拓，去了解大地的变化，以便更好地守护家乡的和平。当得知罗德岛的领袖是阿米娅时，她毫不犹豫地选择加入罗德岛。\n\n来到罗德岛后，暴行看到了整个大地上需要改变的地方，并认为罗德岛，特别是阿米娅和博士，正在为此努力，这里有希望。因此，她愿意在这里贡献自己的力量。她坦言离开雷姆必拓对土生土长的她而言需要很大的勇气，支撑她的是自己的决心、阿米娅的决心，以及“博士的决心”。",
      "# 阿米娅\n\n# 详细介绍\n\n阿米娅是泰拉大地上，罗德岛制药公司的公开领袖，一位年轻的卡特斯少女，却肩负着改变世界命运的重担。她身患矿石病，并继承了萨卡兹“魔王”的王冠与力量，致力于为感染者和所有受压迫者寻找一条通往希望的道路。\n\n**失落的童年与重获新生**\n阿米娅的童年始于雷姆必拓。在一次突如其来的车祸中，她失去了双亲，自己也染上了矿石病。在绝望与荒芜中，年幼的她被当时失忆前的博士偶然救起。博士不仅将她带离险境，更向她承诺会治愈她的疾病，为她带来一个充满希望的未来。这段经历是阿米娅生命的“最初坐标”，奠定了她对博士无与伦比的信任与依赖，她曾对博士说：“博士在哪，我就在哪。”（出自活动剧情“巴别塔”\/“悠长的旅途”）。\n随后，博士带着阿米娅抵达了巴别塔。在那里，她遇到了巴别塔的领袖、萨卡兹“魔王”特蕾西娅，以及资深医生凯尔希。特蕾西娅对阿米娅展现出如同母亲般的关爱与温柔，陪伴她，为她讲故事，并让巴别塔成为了阿米娅的新家。凯尔希则开始为阿米娅的矿石病制定治疗方案。在这段时期，阿米娅敏感地察觉到博士因过度劳累而变得不开心，担忧是自己的病情让他感到低落。\n\n**“魔王”的传承与觉醒**\n巴别塔与军事委员会的内战期间，特蕾西娅为了保护阿米娅，在遇刺的最后时刻，将象征着“黑王冠”和“文明的存续”的力量传承给了阿米娅，希望她能改写萨卡兹的悲惨结局，带领巴别塔走向未来。特蕾西娅的意识也短暂寄宿在阿米娅体内，向凯尔希传达了最后的嘱托。这一刻，年幼的阿米娅被赋予了沉重的“魔王”宿命。\n继承力量初期，阿米娅的精神状态曾一度棘手，会出现呓语、非自发读取他人情绪以及对力量控制不稳的情况，手上的戒指也成为抑制这份强大力量的“枷锁”。凯尔希和华法琳等罗德岛的医生们为此付出了巨大努力。\n\n**唤醒博士与切尔诺伯格的战火**\n在特蕾西娅遇刺后，博士进入了长达三年的休眠。阿米娅与凯尔希接管巴别塔，将其改组为罗德岛制药公司。三年后，阿米娅亲自带领小队深入乌萨斯城市切尔诺伯格，唤醒了失忆的博士。面对博士记忆的缺失，阿米娅坚定地自我介绍，强调博士是她“最重要的同伴”，并毫不犹豫地将罗德岛的指挥权托付给他，展现了她对博士无条件的信任。\n切尔诺伯格被整合运动攻占，罗德岛在撤离过程中，阿米娅目睹了整合运动的暴行，也亲历了平民对感染者的恐惧。她向博士解释矿石病的残酷，以及罗德岛为感染者争取生机的使命。她坚定地表示罗德岛的宗旨是“希望各位，都能绽放笑容”，并希望罗德岛能成为感染者的“温暖的家”。\n在龙门贫民区，阿米娅为保护博士，首次爆发力量击倒了整合运动的“碎骨”。然而，这让她陷入深深的自责与痛苦，质疑自己作为感染者领袖，却不得不夺走其他感染者生命的矛盾。她向博士倾诉内心的挣扎，但最终重申了保护博士的决心。米莎的死，以及她最终选择站到整合运动一边，让阿米娅对仇恨的循环有了更深刻的理解与悲哀。在与碎骨的第二次对决后，阿米娅收下了他的面具，象征着背负这份痛苦继续前行。\n在与整合运动领袖塔露拉的最终对决中，阿米娅通过与陈晖洁的情感共鸣，解开一枚戒指的束缚，觉醒了“近卫”形态的力量——“云裂之剑-影霄”。她直面“不死的黑蛇”科西切对塔露拉的操控，揭露其谎言，最终成功唤醒了塔露拉本身的意志，帮助她摆脱了诅咒。战后，阿米娅因巨大压力和情绪释放而昏倒，凯尔希抽取博士的血液制造药物并为他注射，醒来后她流下了久违的眼泪，并命名了一种治疗霜冻的药物为“霜星”，以纪念那些牺牲的战士。她向博士重申，无论未来多艰难，罗德岛都会前行，如果博士有一天误入歧途，她将是唯一能阻止他的人。\n\n**维多利亚的战火与“魔王”之路的抉择**\n随着罗德岛前往维多利亚伦蒂尼姆，阿米娅的“魔王”身份和力量得到了更深层的展现与考验。她能感知到伦蒂尼姆中心盘桓的“更古老的......更强大的力量”，以及萨卡兹万年来的悲愤与仇恨。在与血魔大君的交锋中，她被萨卡兹众魂的集体记忆冲击，亲身感受了萨卡兹历史上的苦难与对凯尔希的复仇渴望，痛苦不堪，但她拒绝被仇恨吞噬，坚称“戒指不行，我可以。我不是器具。”（出自慈悲灯塔 \/ 应对饱和打击）\n在“惊霆无声”活动中，阿米娅梦见了萨卡兹掌控下维多利亚的悲惨未来，这让她对“魔王”的使命感到迷茫。她被“灰礼帽”确认为“魔王”，并被死魂灵质疑其作为“异族魔王”的资格。但阿米娅选择直面所有苦难，坚定地拒绝了死魂灵所代表的永恒仇恨之路，她的这种“能拒绝”仇恨的特质，被博士肯定为她作为“魔王”的独特与必要之处。\n在“破碎日冕”中，阿米娅在列车上意外亲眼见到了活着的、白发萨卡兹形态的特蕾西娅。这一幕给她带来了前所未有的震惊与悲哀，让她坚定了追寻真相的决心：“既然我来到了这里，那我就需要弄清楚真相。”（出自破碎日冕\/理想的倒影）\n最终，在“慈悲灯塔”活动中，阿米娅与博士、凯尔希、W等深入“阿喃那”内部形成的",
      "# 暴行\n\n# 其他名称\n\n夏洛特\n\n## 简要介绍\n\n暴行，本名夏洛特，是来自雷姆必拓的卡特斯族女性干员。她曾是当地矿业公司的安保人员，拥有出色的物理力量和独特的源石技艺，擅长使用战术爆破攻坚锤破坏硬目标和保护队友。在巴别塔时期，她曾作为旅伴陪伴博士和阿米娅度过一段艰难的旅程，与阿米娅建立了深厚的友谊。回到雷姆必拓后，她因家乡的矿难再次接触到罗德岛，并在得知阿米娅是罗德岛的领袖后，怀着保护朋友和守护家乡的决心加入了罗德岛。她在罗德岛担任近卫干员，同时也是厨房里备受好评的厨师，以其善良、可靠和热情的性格赢得了大家的喜爱。\n\n## 相关角色\n\n-   阿米娅暴行在巴别塔时期结识的同族孩子，两人关系亲密，情同姐妹。暴行对阿米娅的成长和安全非常关心，是她加入罗德岛并为之奋斗的最重要原因。暴行喜欢为阿米娅制作家乡料理，并分享彼此的故事。\n-   博士暴行在巴别塔时期共同旅行的伙伴，她信任博士，并基于博士对阿米娅的承诺而选择跟随和支持他。暴行了解博士的过去，并与其签订了保密协议。她愿意与博士和阿米娅一同面对未来的挑战。\n-   凯尔希暴行似乎在巴别塔时期认识凯尔希或听说过她。她与凯尔希签订了关于博士过去信息的保密协议。\n-   **老约翰**：暴行在雷姆必拓时的老朋友和同事，是矿区的普通工人。暴行向他倾诉对阿米娅的牵挂，并在矿难中救了他。老约翰理解并支持暴行加入罗德岛的决定。\n-   温米暴行在“去咧嘴谷”活动中遇到的感染者小姑娘。暴行之前曾给她罗德岛的名片。在旅途中，暴行对温米照顾有加，并在旅程结束后将她带回了罗德岛接受治疗。\n-   莱伊在“去咧嘴谷”活动中与暴行一行人同行的劫车人。暴行对莱伊展现出理解和同情，并鼓励她面对困境。暴行对莱伊加入罗德岛感到高兴。\n\n## 详细介绍\n\n干员暴行，本名夏洛特，是一名热情善良的卡特斯族女性，她的故事始于雷姆必拓的矿区。作为一名矿业公司的安保人员，她在危险的矿区环境中磨砺出了强健的体魄和实用的战斗技巧，尤其擅长运用一种特殊的战术爆破攻坚锤。这种武器通过内部源石排列产生类似微差爆破的效果，能高效破坏硬目标。\n\n    暴行的经历与博士和阿米娅的早期旅程紧密相连。在巴别塔时期，当博士从一起事故中救下年幼的阿米娅后，暴行作为旅伴加入了他们。在数月的共同生活中，暴行承担起了照顾阿米娅的责任，为她寻找药物，关心她的健康与情绪。她深知矿石病的残酷和不可逆转，一度基于雷姆必拓相对稳定的环境，提出让阿米娅留在那里，至少能有一个“家”。然而，她最终尊重了博士治愈阿米娅的决心以及阿米娅选择跟随博士的意愿。这段共同旅行让暴行与阿米娅建立了如同姐妹般的情感，也让她对当时的博士产生了信任，尽管在离开时，出于对卡兹戴尔危险环境可能影响他们的担忧，她选择了告别，但收到了阿米娅写给她的信。\n\n    离开巴别塔后，暴行回到了雷姆必拓的矿区，继续她的安保工作，守护家乡的和平和工人们的安全。尽管如此，她内心深处始终牵挂着远方的阿米娅，担忧她在萨卡兹主导的环境中能否健康成长。她曾向老友老约翰倾诉这种想要保护阿米娅的心情，但认为自己没有理由留下。\n\n    两年后，一场突如其来的活性源石粉尘爆炸袭击了矿区，暴行立即投身于危险的救援工作，奋不顾身地救出了多名被困矿工，其中包括老约翰。在救助站，她遇到了来自“罗德岛制药公司”的医疗小组，对他们手中能有效抑制矿石病症状的应急药剂感到惊讶。更令她震惊的是，当她迫切询问罗德岛的领袖是谁时，得到了“阿米娅”这个名字。这个消息让她无比激动，确认了阿米娅就是自己一直牵挂的朋友，并且已经成长为一方组织的领袖。\n\n    得知阿米娅的现状，暴行毫不犹豫地做出了决定——加入罗德岛。她向老约翰告别，解释了自己要去保护必须保护的人的使命。带着这份决心，她踏上了前往罗德岛的旅程，期待与阿米娅重逢并分享彼此的故事。\n\n    加入罗德岛后，暴行成为一名近卫干员，充分发挥她在战斗中的破坏和保护能力，协助攻坚任务，降低小队伤亡率。她的源石技艺表现为锤击区域的延迟爆破，常伴有放电现象。尽管她本人并未完全理解原理，但能娴熟运用。在罗德岛，她依然保持着善良开朗的性格，友善可靠，赢得了干员们的喜爱。她偶尔会在厨房里制作雷姆必拓风味的菜肴，如蔬菜浓汤、蘑菇派、蔬菜烤饼和胡萝卜派，为罗德岛带来了家庭般的温暖，她的烹饪手艺备受好评。\n\n    暴行对雷姆必拓有着深厚的感情和责任感。她在“自有一“派””活动中，通过与博士和阿米娅一起制作胡萝卜派，表达了对家乡特产被外部商人恶意炒作、可能重蹈“围栏事件”覆辙的愤慨，并强调了要阻止这种行为的决心。她解释了自己离开雷姆必拓加入罗德岛并非放弃家乡，而是为了了解外部世界，以便更好地守护雷姆必拓的和平。她认为，察觉到危机就应该立即行动，即使力量微薄，做点什么总比袖手旁观要强。\n\n    在“去咧嘴",
      "# 你与时间同长\n\n# 剧情总结\n\n《你与时间同长》的剧情通过一场深刻而富有象征意义的梦境，细腻地描绘了阿米娅在面对失去、悲伤和责任时的内心挣扎与成长。整个故事以阿米娅的梦境开篇，似乎是由某种罗德岛的技术设备（“与节点[DWDB-221E]建立交叉验证连接”等初始信息暗示）所诱导或记录的。这场梦境是阿米娅处理内心深处情感，尤其是关于重要人物逝去的哀悼过程的具象化。\n\n梦境的开端，阿米娅在一个初夏的原野上醒来，身边是一个“孩子”（象征着她纯真、渴望被唤醒的内心或她过去的某个形象）。这个孩子提醒阿米娅，她“弄丢了”重要的同伴，并催促她去寻找，指引她前往一座巨大的山。阿米娅的困惑和急切，揭示了她内心深处对失去的感知以及寻找答案的强烈愿望。与此同时，一个“影子”默默地跟随着阿米娅，她知晓阿米娅的痛苦，但出于某种“约定”，她不会主动现身，只能远远地观察。这“影子”的角色，从一开始就预示着一位对阿米娅而言至关重要、且与其有着深厚情感羁绊的人物。\n\n阿米娅抵达山顶，却一无所获。她发现自己口袋里有一封来自“他们”的信，但信纸被水浸泡得模糊不清。此时，一只“云兽”（其分析式的对话和对阿米娅“机能紊乱”的判断，强烈暗示其为凯尔希的梦境化身）出现。云兽以一种冷静而理性的方式指出阿米娅“渗水”的脸庞并非正常布人所为，并建议她去寻找“魔术师”来“修好”自己，以便阅读信件。阿米娅将自己的泪水误解为“损坏”而非情感流露，这反映了她作为罗德岛领袖，长期以来压抑个人情感，将悲伤视为“故障”的倾向。云兽的建议，虽然看似机械，实则是将阿米娅导向一个处理情感的关键环节。\n\n在云兽的指引下，阿米娅跃下悬崖，在空中寻找“魔术师”。她最终在星云之间找到了这位“魔术师”（其温暖、理解的态度和后续互动，明确了其为特蕾西娅的梦境化身）。阿米娅焦急地请求魔术师“修好”自己，止住脸上的“渗水”，好让她能看清信件。然而，魔术师温柔地纠正了阿米娅的认知，告诉她“你没有坏，你只是在流泪”，并强调流泪是每个人都可以拥有的正常情感，心若干枯便无法容纳重要的人。这番话语直抵阿米娅内心深处，是对她长期以来压抑情感的直接回应和宽慰。魔术师随后运用“火烧云”的力量烘干了信件。在魔术师施法过程中，阿米娅注意到魔术师脸上也有“亮晶晶”的东西，恍然大悟：魔术师也和她一样，在为“他们”流泪。这种共情瞬间击溃了阿米娅内心的防线，她深感愧疚，认为自己只顾着倾诉自己的苦恼，却忽略了魔术师同样沉重的悲伤。\n\n巨大的愧疚感将阿米娅包裹在一个“气泡”中，使她与魔术师渐行渐远。这个“气泡”象征着阿米娅在面对自我情感和他人痛苦交织时，所产生的自我封闭和隔离。当气泡飘向沙漠时，“影子”再次出现，她与魔术师在遥远的天空中交换了一个理解的眼神，显示她们之间存在某种心照不宣的联系和约定。阿米娅被气泡带到了无垠的沙漠，气泡破裂后，她读到了信件——上面没有指明去向，只有“许多嘱托，许多告别”。这意味着她所寻找的“他们”已经离去，她的任务不再是找到他们，而是接受他们的离去，并承担起他们留下的责任与期望。\n\n在炙热而漫无边际的沙漠中，阿米娅独自跋涉，精疲力尽，却固执地拒绝停下。她感到自己不能陷在悲伤中，必须“靠自己走出去”，因为“还有很多人需要我”。沙漠的景象和阿米娅的挣扎，象征着她背负着罗德岛未来的重担，以及在个人悲痛与集体责任之间无休止的煎熬。她认为自己不能脆弱，不能依赖，必须坚强。而“影子”一直在远处观察着阿米娅，看到她近乎崩溃却仍不放弃的毅力，终于决定打破“约定”。\n\n“影子”在阿米娅前方制造了一片“绿洲”。阿米娅最初将其视为幻景，试图避开，但绿洲却像有生命般“跑”到她面前，迫使她面对。这一超现实的互动，是“影子”打破沉默、主动干预的标志。阿米娅终于第一次回头，呼唤道：“是您吗？”“影子”随之显现，是阿米娅记忆中那带着恬然笑容的“特蕾西娅小姐”。\n\n这一刻，情感的闸门彻底打开。阿米娅扑进特蕾西娅的怀抱，泪流满面地倾诉多年来的痛苦、无助、未能阻止悲剧的自责，以及在重重责任下，即便自己痛苦也无法允许自己依赖他人的矛盾。她认为自己“不该依偎在影子的膝头”，因为她已长大，是大家的依靠。特蕾西娅则以无比温柔的姿态回应，轻拍着阿米娅，告诉她：“不是什么事情都能够挽回。‘肩负’……也意味着接受无可挽回之事。”她理解阿米娅的伤心和想要做些什么的心情，但更心疼阿米娅所承受的一切。特蕾西娅坚定地告诉阿米娅，她“永远不会伤害我。永远不必向我道歉”，并强调“我知道你在长大，这没关系，这很好。我一直都在的。”这番话语，是特蕾西娅对阿米娅最深沉的爱与支持，不仅解开了阿米娅的愧疚与自责，也让她意识到，成长并不意味着必须独自承受所有，而是在承担责任的同时，也能接受被爱与被支持。\n\n特蕾西娅在阿米娅额头留下一个吻后隐去，黄沙消散，只留下青碧的湖水和湿润的风。阿米娅",
      "# 黑暗时代·上\n\n# 剧情总结\n\n故事始于切尔诺伯格核心区一个废弃设施内，少女阿米娅带领罗德岛干员进行一项关键行动：唤醒并救出沉睡在石棺中的博士。博士成功被唤醒，但却完全失去了过去的记忆，对自己的身份和周围的人一无所知。阿米娅温柔地向博士解释自己是罗德岛的一员，也是博士最重要的同伴，并希望博士能重新信任她。\n\n就在这时，设施突然遭到袭击。袭击者是装扮独特的武装人员，他们并非乌萨斯士兵，而是整合运动的成员。阿米娅的队伍措手不及，通讯也意外中断，无法联系上原本负责指挥的凯尔希医生。面对突如其来的危机，阿米娅做出了一个大胆的决定：她请求失忆的博士接管指挥权，相信博士即使失去了记忆，仍然拥有卓越的战术能力。尽管医疗干员对此表示担忧，阿米娅坚持自己的信念，博士接受了指挥。在博士的指挥下，罗德岛小队成功击退了第一波整合运动的袭击。\n\n战斗结束后，杜宾教官带领另一支罗德岛小队赶到，与阿米娅汇合。杜宾证实了城市中的混乱状况，整合运动正在切尔诺伯格发动大规模袭击。她对于整合运动突然变得如此激进并在乌萨斯城市中使用暴力感到震惊，并认为这是整合运动自寻死路的行为。阿米娅向杜宾说明了博士失忆的情况，杜宾虽然对此感到惊讶和怀疑，但最终选择相信阿米娅，并接纳了博士。就在这时，罗德岛的后勤管理系统PRTS意外与阿米娅建立了神经连接（电波通讯受阻），并识别了博士的指纹，确认了博士的8级权限，将其重新纳入罗德岛系统，并提供了作战支援。杜宾确认了严峻的现状——他们必须立刻从切尔诺伯格撤离。杜宾总有一种不祥的预感，而阿米娅知道的更糟：天灾将在三小时内吞没切尔诺伯格。\n\n撤退过程中，罗德岛一行目睹了切尔诺伯格的可怕景象：整合运动四处烧杀劫掠，对乌萨斯平民进行报复性攻击，而乌萨斯军警疲于应对，城市的秩序已然崩溃。电视新闻却仍在播放粉饰太平的虚假报道。面对整合运动对平民的暴行，罗德岛干员心生愤慨，尽管知道冒险，阿米娅和杜宾仍决定出击营救被围困的平民。在击退整合运动后，罗德岛小队遭遇了被救助的平民，然而平民在看到阿米娅的感染者身份后表现出极度的恐惧。这一幕让博士产生了疑问，阿米娅和杜宾借此机会向博士解释了矿石病（感染者）的状况、他们在泰拉世界受到的歧视与压迫，以及罗德岛作为一家医药公司，同时也是感染者互助组织，致力于研究治疗方法和解决感染者与普通人之间矛盾的使命。杜宾指出，整合运动正利用这种压迫和仇恨来招募成员，他们的力量可能会源源不断。她还表示博士作为顶尖的矿石病研究学者和前线指挥官，对罗德岛至关重要。\n\n随着撤退的继续，罗德岛小队遇到了乌萨斯军警。紧张对峙之际，一支由特殊整合运动头目率领的部队出现。乌萨斯军警队长认出了这个头目的危险性（文本中这位头目是弑君者），选择将主要精力用于对抗整合运动，放过了罗德岛一行。罗德岛利用这个机会得以继续撤退。\n\n随后，博士一行成功与前来支援的Ace及其小队汇合。Ace接受了博士失忆的事实，并表示信任博士的指挥能力，认为失去的记忆可以找回，当务之急是解决眼前的危机。在与整合运动的战斗中，罗德岛发现敌人甚至驱使感染的野兽作战，其残酷手段令干员们心寒。Ace认为应让这些痛苦的野兽解脱。众人再次讨论整合运动的行动：他们在天灾来临之际发起暴乱，这似乎是自毁行为。杜宾根据过去的战争经验，推测整合运动的领袖可能是一个视追随者为棋子的“暴君”，他只是煽动仇恨和恐慌，在必要时利用他们。这与需要理性、高效的指挥官博士完全不同。\n\n在接近汇合点的公园时，罗德岛遭遇了梅菲斯特率领的整合运动的伏击。队伍因通讯中断产生的恐慌情绪开始蔓延。梅菲斯特阻止了另一位整合运动头目弑君者（后者似乎一直在追击罗德岛）的行动，并以狂妄的态度拦截罗德岛。他承认罗德岛最初并非目标，但在观察到他们的战斗方式后产生了兴趣。梅菲斯特自称为这场伏击设立了一个“祭祀式的竞赛”，要求罗德岛必须在他和他的部队手中活下来才能离开。他展示了对罗德岛撤退路线的精准封锁能力，并毫不掩饰对战斗的病态“乐趣”。更令人不安的是，梅菲斯特表现出对博士的强烈兴趣，他知道博士是从核心区的设施中被救出的，对设施的功能和博士的身份感到极其好奇，并提出用博士的生命来换取罗德岛其他人的安全。阿米娅坚决拒绝，并誓死保护博士。\n\n梅菲斯特的指挥能力超出了预期，他利用棋类走法指挥手下狂暴的感染者部队，使得罗德岛陷入劣势。危急时刻，另一位罗德岛的支援干员，耀骑士临光，及时赶到并以强大的力量冲散了整合运动的阵型，扭转了局面。临光与博士相见，也接受了博士失忆的情况，并表示相信博士。临光用言语嘲讽梅菲斯特的残忍和低劣品味，彻底激怒了他。梅菲斯特随即命令他的狙击手浮士德攻击临光。浮士德的狙击精准且威力巨大，攻击轨迹和频率异常，似乎能在多个位置同时射击。临光不得不全力防御。Ace和罗德岛的狙击干员尝试压制浮士德，但发现很难应对。在临光和A"
    ],
    "response":"根据文档信息，阿米娅和博士的关系是：博士是阿米娅的救命恩人（在阿米娅童年失去双亲后救了她），也是她最信任的“最重要的同伴”（文档5中阿米娅称博士为“最重要的同伴”，并将罗德岛指挥权托付给失忆的博士）。同时，博士在阿米娅的成长中扮演了引导者的角色，给予她“知识”和希望（文档1中暴行评价博士“能够给予他人知识，引导他人前进”）。",
    "reference":"博士是阿米娅最信任的伙伴，罗德岛的最高指挥官。博士是阿米娅的救命恩人、精神支柱和最重要的同伴。阿米娅将自己早年的野外生存技能归功于博士，并对他抱有无条件的信任与依赖。",
    "context_precision":0.95,
    "context_recall":0.6666666667,
    "faithfulness":0.75,
    "answer_relevancy":0.527889277
  },
  {
    "user_input":"霜星是什么角色？",
    "retrieved_contexts":[
      "# 霜星\n\n# 相关活动\n\n-   急性衰竭作为整合运动在切尔诺伯格废城的主要敌人登场，领导雪怪小队，展示了强大的冰霜技艺，击退了罗德岛小队，随后前往龙门。\n-   局部坏死整合运动在龙门的主要指挥官之一，与罗德岛和博士交战，被困废墟与博士进行深度对话，揭示身世与内心挣扎，最终在战斗中牺牲。\n-   怒号光明在回忆剧情中出现，展现了她作为北原游击队成员与爱国者的关系，与塔露拉的初遇、短暂交手及共同战斗，以及她对塔露拉理念的质疑与信任的复杂情感，为切城事件中的牺牲做了铺垫。\n-   苦难摇篮霜星本人未出场（已牺牲），但她的死是剧情讨论的焦点，影响了爱国者、博士、凯尔希、迷迭香、W等多个角色的命运和认知，她的遗体被博士带回罗德岛并处理。\n\n## 相关信息\n\n- 她的真名是叶莲娜。\n    - 她是爱国者的女儿，身上穿着爱国者斗篷改织而成的外套。\n    - 她的病症导致身体极度寒冷，需要吃乌萨斯特有的、混合了酒精和刺激性调料的“辣糖”来感受温暖。\n    - 她曾在龙门贫民区教导孩子们制作玩具小熊，米莎是其中之一。\n    - 她曾见过罗德岛已故干员Ace，并觉得博士的眼神与他很像。\n    - 她的力量即使在死后依然能够影响环境，导致龙门下雪。\n    - 她对梅菲斯特非常厌恶，认为他不如野兽。\n\n## 角色点评\n\n霜星，这位来自极北苦寒之地的“雪怪公主”，她的一生是被命运无情摧残的缩影。童年的悲剧铸就了她强大的力量和冷漠的外表，但在冰冷的外壳下，跳动的是一颗渴望温暖、忠于家人和战友的心。她对爱国者深沉的孺慕之情，对雪怪小队成员视如兄弟姐妹的爱护，以及对米莎等贫民区孩子流露出的温柔，都展现了她人性中温暖的光芒。她曾短暂地在塔露拉的理想中看到希望，但当这份希望被现实的残酷和背叛所击碎时，她的失望与愤怒是那么真实而令人心痛。霜星的强大毋庸置疑，她的源石技艺是毁灭性的天灾，但真正令人铭记的，是她在绝境中依然不屈的意志，以及在生命最后一刻，选择相信“敌人”，将渺茫的希望托付出去的勇气。她在博士怀中逝去时身体恢复温度的细节，是她挣脱病痛、回归纯粹的象征，也为她悲壮的一生画上了句号。她未能看到感染者的未来，但她的牺牲，她的选择，她的故事，都如北原的冰雪般刻骨铭心，永远留在了泰拉大地的历史中。",
      "# 霜星\n\n# 其他名称\n\n叶莲娜;雪怪们的公主\n\n## 简要介绍\n\n霜星，真名叶莲娜，是整合运动中强大而神秘的“雪怪小队”的领袖。她出生于乌萨斯西北严寒的矿场，作为一名重度感染者经历了家破人亡的悲剧，后被乌萨斯游击队的领袖“爱国者”博卓卡斯提收养，视其为父亲。她凭借自身强大的冰霜源石技艺成为游击队中的重要战士。在塔露拉北上寻求联合时，霜星及其雪怪小队加入了整合运动，并随之前往乌萨斯城市。在切尔诺伯格事件和龙门行动中，霜星是整合运动的重要指挥官和阻碍罗德岛的强大敌人。然而，她对塔露拉的理念和行为逐渐感到失望。最终，在龙门，霜星选择与罗德岛和博士进行一场殊死较量，在力竭倒下后，她将最后的希望托付给博士，并在其怀中逝去。她的牺牲对爱国者和罗德岛都产生了深远影响。\n\n## 相关角色\n\n-   爱国者霜星名义上的父亲，北原游击队领袖，将她从绝望中救出并抚养长大。父女情深，爱国者对她的死悲痛万分，但也理解她最后的选择。\n-   塔露拉北原时期霜星视为朋友和战友的整合运动领袖。霜星曾相信她的愿景，但切城事件后对其失望，认为她欺骗和背叛了感染者。\n-   博士霜星在龙门遭遇并被困的罗德岛领袖。霜星向其倾诉过往和心声，最后选择信任并将希望托付给博士。博士抱走了霜星的遗体。\n-   阿米娅罗德岛领袖，与霜星在废城和龙门交手。霜星在废城认可阿米娅的眼神，在龙门最后的战斗中主要对抗阿米娅，并希望她能阻止塔露拉。\n-   煌罗德岛精英干员，与霜星在龙门天台激烈交战，导致二人与博士一同坠入废墟。\n-   梅菲斯特整合运动干部。霜星对梅菲斯特滥杀无辜、利用尸体的行为表示厌恶和谴责。梅菲斯特在霜星死后曾提到她唱歌很好听。\n-   迷迭香罗德岛精英干员。触碰过霜星的遗体，感受到了她的存在，并为纪念她将一种医疗药物命名为“霜星”。\n-   霜叶罗德岛干员。在切尔诺伯格废城遭遇霜星，拼尽全力掩护队友撤退，她关于“雪怪”传说的联想与霜星有关。\n-   米莎龙门贫民区女孩，在切城事件中死亡。霜星曾在贫民区教导米莎等孩子制作乌萨斯风格的玩具小熊。\n-   W整合运动干部。提及霜星和爱国者是理想主义者，认为塔露拉将霜星送上了死路。\n-   凯尔希罗德岛高层。与博士讨论霜星的死及其影响，向迷迭香解释复仇的虚无，从爱国者处获取了核心城停机密钥，并提及北原游击队的过往。\n-   Ace罗德岛干员，已故。霜星提到博士的眼神与一位旧识很像，该旧识被凯尔希证实为Ace。\n\n## 详细介绍\n\n霜星，本名叶莲娜，是乌萨斯西北冻原的感染者，也是整合运动“雪怪小队”的冷酷领袖。她的童年充满苦难，出生在矿场，亲生父母和祖母都因感染矿石病或被处决而死。在她十一岁、即将面临同样命运时，她的源石技艺在极度的痛苦和愤怒中爆发，杀死了乌萨斯士兵。随后，她被北原游击队的领袖博卓卡斯提（“爱国者”）所救。爱国者收养了她，视她为女儿，而叶莲娜也称他为“爸”，将他视为最亲近的家人。在游击队中，她成长为一名顶尖的感染者术师和战士，并领导着同样拥有强大冰霜技艺的雪怪小队。雪怪小队专注于在严酷的冻原环境中生存、训练和为感染者争取机会，叶莲娜也因此养成了冷静务实的性格。\n\n    当孤身前来的塔露拉带着整合乌萨斯全境感染者的宏大愿景来到北原时，叶莲娜起初对她“幻想”般的理想表示质疑，认为其脱离北原的现实。她曾与塔露拉短暂交手，冰霜与火焰的碰撞让她认可了塔露拉的实力，并将其视为技巧上的追赶目标。尽管对理想主义持保留态度，叶莲娜认同塔露拉“告诉感染者他们并不孤单”的信念，并随爱国者和雪怪小队加入了整合运动，前往乌萨斯的城市，希望能为感染者兄弟们找到一个家。\n\n    然而，乌萨斯城市的现实，特别是切尔诺伯格的惨剧以及塔露拉后期的改变，让叶莲娜对整合运动和塔露拉产生了深刻的失望。她目睹了梅菲斯特的暴行，认为塔露拉放任这一切是欺骗和背叛了曾经的信念。她对塔露拉的贵族出身并不介意，更在意其行为是否符合她最初的承诺。在龙门行动期间，她内心已经计划在事件结束后回切尔诺伯格与塔露拉对质。她感到自己的时间不多了，渴望在生命终结前，为追随她的雪怪小队找到一条活路。\n\n    在龙门，作为整合运动的重要指挥官，霜星展现了强大的战斗能力。在废弃的切尔诺伯格分城，她领导雪怪小队，制造异常低温，成功牵制了罗德岛的侦察小队，并以压倒性的寒潮力量击退了阿米娅的营救队伍。她对梅菲斯特的残忍表达了厌恶，并认可了罗德岛干员霜叶为掩护队友而做出的牺牲。随后，她将目标转向龙门。\n\n    在龙门主城区，霜星与罗德岛遭遇，并向博士提出了一个赌约——若罗德岛战胜她，她便加入罗德岛。她与罗德岛精英干员煌在一处天台激战，双方势均力敌，霜星强大的冰霜技艺甚至能控制建筑结构，导致天台崩塌。意外之下，霜星与博士一同坠入了下方的废墟。\n\n    在废墟之下，霜星与博士进行了",
      "# 局部坏死\n\n# 角色剧情概括\n\n-   **博士 (Doctor)**: 作为玩家视角参与罗德岛在龙门的联合行动，主要跟随阿米娅和煌。与煌一同行动时，被煌保护并见证她的战斗风格和内心挣扎。与霜星一同被困废墟下，进行了活动中最核心的对话，了解了霜星悲惨的过去、复杂的情感以及对整合运动和塔露拉的真实看法。在霜星生命最后时刻陪伴她，见证了她的死亡和对罗德岛的最后承诺。活动结束时，抱着霜星的遗体，并与魏彦吾、陈、凯尔希等龙门高层和重要人物会面，了解了龙门内部的秘密和切尔诺伯格危机的降临。\n-   **阿米娅 (Amiya)**: 作为罗德岛的领袖，协调与龙门近卫局的联合行动。表现出对感染者的深切同情和对罗德岛理想的坚定维护。在贫民区行动中察觉异常，并决定解除与龙门的合作，因为魏彦吾的手段违背了罗德岛的原则。在与霜星的最终决战中，通过自身能力感受霜星的内心痛苦与愤怒，并以罗德岛为所有人而战的理念回应了霜星的质问，促使霜星最终接受自己的选择并安详逝去。\n-   **煌 (Skadi)**: 罗德岛精英干员，以强大而直接的作战风格闻名。在龙门行动中，作为主力开辟道路，保护博士。与灰喉的互动展现了她对感染者同胞的立场和对非感染者的偏见，但灰喉的行为改变了她的看法。与霜星在废墟中短暂交手，对其力量和痛苦印象深刻。在与黑雨披部队短暂冲突后，被对方提及父亲而感到愤怒。见证了雪怪小队的牺牲和霜星的死亡，深受触动， reafirma 她对感染者同胞的关注和对不公的对抗决心。\n-   **霜星 (FrostNova)**: 整合运动指挥官，雪怪小队领导者。在切尔诺伯格废墟与煌交战后与博士一同被困。通过与博士的对话，详细揭露了她悲惨的过往、与爱国者的父女情、以及对塔露拉和整合运动方向的失望。她是一个充满矛盾的角色，既冷酷强大，又对同胞充满爱与悲悯。在最终战中释放全部力量，被罗德岛小队击败。临终前，向博士和阿米娅表达了最后的愿望和对罗德岛的支持，最终安详离世。\n-   **浮士德 (Faust)**: 整合运动指挥官，梅菲斯特的搭档。对梅菲斯特滥用法术、伤害同胞的行为深感不安，暗中帮助其他整合运动成员逃离。在梅菲斯特失控后，选择将其制服并交给部下带离，自己则牺牲掩护部下撤退，利用源石技艺在与龙门部队和黑雨披部队的交战中殿后，生死不明（倾向于牺牲）。\n-   **梅菲斯特 (Mefisto)**: 整合运动指挥官。在龙门行动中因受挫而精神失控，滥用源石技艺将追随者转化为攻击一切的怪物。其疯狂行为加剧了整合运动的溃败，并导致许多整合运动成员死亡或变异。最终被浮士德制服，意识陷入混沌，被浮士德的部下带离。\n-   **陈 (Chen)**: 龙门近卫局特别督察组组长。与诗怀雅搭档指挥龙门围剿行动，展现出高效和对职责的坚持。对贫民区的异常和失踪的线人感到担忧，追查中发现了黑雨披部队的存在。在行动后期，策略性地将黑雨披部队引向雪怪小队，迫使其暴露。活动结束时，通过调查贫民区排水系统发现了黑雨披部队屠杀并清理现场的证据，并以此为引爆点，与魏彦吾激烈对峙，揭露了家族及龙门高层的秘密，表现出强烈的正义感和对龙门的失望。\n-   **诗怀雅 (Swire)**: 龙门近卫局总督察。与陈搭档作战，性格活泼，与陈互动时常有轻松幽默的对话。通过与林雨霞的电话沟通，确认了黑雨披部队的存在及其目的。在陈追查真相时试图阻止她，担心陈会因此陷入危险，展现出对陈的关心和对龙门复杂政治的无奈。\n-   **灰喉 (Greythroat)**: 罗德岛干员，非感染者。活动初期因对感染者的言论被煌误解，但其在保护感染者儿童、面对浮士德时的单纯、以及在最终战中对霜星体温骤降的准确判断和坚守立场，展现出她内心的善良和原则。她经历了对感染者痛苦的直观认知，最终决定留在罗德岛，改变了对感染者的看法。\n-   **九 (Nine)**: 前龙门近卫局成员，贫民区的感染者，曾是陈的线人。在贫民区隐藏时，与一名整合运动成员的对话反映了龙门感染者的困境和对未来的绝望。目睹了黑雨披部队的暴行和雪怪小队的牺牲后，她彻底对龙门失望，决定带着少量整合运动残部离开这座城市，象征着一部分龙门感染者的心碎和出走。\n-   **魏彦吾 (Wei Yenwu)**: 龙门行政长官，实际统治者。作为龙门保卫战的总设计师，其行动被阿米娅和陈认为是将各方（包括罗德岛和整合运动）作为棋子进行布局。活动结束时，阿米娅解除合约表达不满，陈则直接冲入其办公室，揭露了他与塔露拉家族的秘密及对贫民区的残酷手段。他是一个冷酷、务实、将一切掌握在手中的政治家，但其行为也埋下了新的矛盾。\n-   **林雨霞 (Lin Yúxia)**: 贫民区“鼠王”林舸瑞之女。她指挥着名为“黑色雨披”的秘密部队，以冷酷高效的手段在贫民区清剿感染者。在与诗怀雅的电话",
      "# 霜星\n## 名称: 霜星\n## 敌人索引: FN\n## 种类: —\n## 地位级别: 领袖\n## 攻击类型: 远程 法术\n## 行动方式: 地面\n## 描述: 整合运动法术部队干部，以术师身份参与整合运动，少数能在正面战场以压倒性的法术进行攻击的敌方目标。指挥的队伍中有一支名为“雪怪”的特殊术师小队参与一些特别行动。和她名字一样，给人一种冰冷的感觉。\n## 能力: ·常使用冰环法术，能对周围的我方单位造成大量法术伤害，并在数秒内降低击中目标的攻击速度·会使用法术冻结地面，使其永久无法被部署单位·首次死亡后重生，重生后攻击力提升\n## 出场关卡: 4-10 灯火将熄ISW-NO 善恶同道\n## 级别数据\n  - 级别: 0, 属性: {'最大生命值': 25000, '攻击力': 420, '防御力': 250, '法术抗性': 50, '移动速度': 0.5, '攻击间隔': 3.7, '元素抗性': 0, '元素损伤': 0}, 异常抗性: 沉默 · 晕眩 · 冻结 · 浮空, 天赋&能力: 沉睡免疫异常效果组合: 沉睡这是一个异常组合，包含了以下异常效果无法行动+无敌+不可阻挡沉睡免疫:使自身的沉睡失效，但不会清除相关BUFF，普通攻击不会攻击飞行单位首次被击倒后重生，重生持续5s，恢复100%生命值重生后攻击力+50%，失去沉睡免疫异常效果组合: 沉睡这是一个异常组合，包含了以下异常效果无法行动+无敌+不可阻挡沉睡免疫:使自身的沉睡失效，但不会清除相关BUFF, 技能: [{'名称': '冰环', '冷却时间': '8.58.5', '技力消耗': '\/', '效果': '锁定半径2.5的范围内的单个我方单位触发，对锁定目标及自身半径2.0范围内全体我方单位造成相当于攻击力150%的法术溅射伤害，并使其在8秒内攻击速度-50弹道飞行速度：0'}, {'名称': '冻结', '冷却时间': '3030', '技力消耗': '\/', '效果': '随机冻结2格地面：在半径2的范围内随机选取2个可部署地块，强制击倒其上的我方单位，并在这些地块上各部署一个0级的封印的地面'}]\n  - 级别: 1, 属性: {'最大生命值': 35000, '攻击力': 620, '防御力': 350, '法术抗性': 50, '移动速度': 0.5, '攻击间隔': 3.7, '元素抗性': 0, '元素损伤': 0}, 异常抗性: 沉默 · 晕眩 · 冻结 · 浮空, 天赋&能力: 沉睡免疫异常效果组合: 沉睡这是一个异常组合，包含了以下异常效果无法行动+无敌+不可阻挡沉睡免疫:使自身的沉睡失效，但不会清除相关BUFF，普通攻击不会攻击飞行单位首次被击倒后重生，重生持续5s，恢复100%生命值重生后攻击力+50%，失去沉睡免疫异常效果组合: 沉睡这是一个异常组合，包含了以下异常效果无法行动+无敌+不可阻挡沉睡免疫:使自身的沉睡失效，但不会清除相关BUFF, 技能: [{'名称': '冰环', '冷却时间': '8.58.5', '技力消耗': '\/', '效果': '锁定半径2.5的范围内的单个我方单位触发，对锁定目标及自身半径2.0范围内全体我方单位造成相当于攻击力150%的法术溅射伤害，并使其在8秒内攻击速度-50弹道飞行速度：0'}, {'名称': '冻结', '冷却时间': '2121', '技力消耗': '\/', '效果': '随机冻结2格地面：在半径2的范围内随机选取2个可部署地块，强制击倒其上的我方单位，并在这些地块上各部署一个0级的封印的地面'}]",
      "# 雪怪小队\n\n# 其他名称\n\n雪怪小队\n\n## 简要介绍\n\n雪怪小队是整合运动的一支重要武装力量，由核心成员霜星领导。这支小队的成员是博卓卡斯替（爱国者）在西北冻原的矿场废墟中拯救的感染者孤儿组成的，并在他的指导下长大和接受训练。他们成员之间情同手足，对霜星和爱国者忠心耿耿。在切尔诺伯格事件后期和龙门战役期间，雪怪小队表现出了强大的战斗力，同时也展现出对同伴和感染者同胞的深厚情感。最终，除了霜星之外的雪怪小队成员在龙门贫民区为了掩护同伴撤退而选择了牺牲。霜星随后也在与罗德岛会面后力竭而逝，雪怪小队的故事以悲剧落幕。\n\n## 相关角色\n\n-   霜星雪怪小队的领导者，由爱国者抚养和训练长大，是小队的精神核心和战力担当。她与博士在废墟中有过深入交流，最终在龙门与罗德岛诀别。\n-   **博卓卡斯替 (爱国者)**：雪怪小队的创立者和所有成员的养父、导师。小队成员对他怀有深厚的尊敬和爱戴。\n-   塔露拉整合运动的领袖。霜星对她后期的行为感到失望和不甘，认为她背叛了感染者的未来。\n-   煌罗德岛干员，与雪怪小队和霜星多次交锋，是最初接触到雪怪小队的罗德岛干员之一。\n-   博士罗德岛指挥者，在切尔诺伯格废墟下与霜星有过重要对话，并见证了霜星的最后时刻。\n-   阿米娅罗德岛领导者，与博士一同在龙门见证了霜星最后的选择和离世。\n-   梅菲斯特整合运动干部。精神受创后被幻影弩手带往与雪怪小队汇合，由雪怪小队成员掩护撤离。\n-   浮士德整合运动干部。为掩护梅菲斯特等人撤离而殿后，雪怪小队得知其生还希望渺茫后感到悲伤。\n-   **幻影弩手**：整合运动成员。在龙门与雪怪小队汇合，告知了梅菲斯特和浮士德的情况，并最终将霜星带离。\n-   **龙门近卫局**：龙门官方武装力量，在龙门贫民区追击撤退的整合运动，与雪怪小队成员发生激战。\n-   **黑色雨披部队**：一支身份神秘的部队，在龙门贫民区无差别攻击感染者，也参与了对雪怪小队成员的围剿。\n\n## 详细介绍\n\n雪怪小队，这支由感染者组成的整合运动武装力量，其悲壮的故事始于乌萨斯西北冻原的矿场废墟。他们的领袖霜星，原名叶莲娜，幼时在此地的矿场经历了家人的逝去以及乌萨斯士兵对感染者儿童的残酷屠杀。在这场浩劫中，她体内的源石技艺觉醒，爆发出强大的冰霜力量。幸存下来的感染者儿童，包括叶莲娜，被彼时乌萨斯游击队的领袖，温迪戈族的博卓卡斯替（爱国者）所救。爱国者收养了这些孩子，将他们训练成一支独特的战斗小队——雪怪小队。成员之间情同手足，互称“兄弟姐妹”，对霜星称“大姊”，对爱国者则尊称为“大爹”或“老爷子”，形成了紧密的家族式纽带。\n\n作为整合运动的重要力量，雪怪小队在切尔诺伯格事变中扮演了重要角色，并在事变后期和后续的龙门战役中追击撤离的罗德岛部队。他们在战场上展现出强大的个人能力和协同作战水平，尤其霜星的冰霜源石技艺，拥有极强的破坏力和范围控制能力，能够制造出连空气都会冻结的黑色冰晶，对接近她的人造成严重的冻伤，她自身的体温也因此常年处于极低温。\n\n在龙门追击战中，雪怪小队与罗德岛干员煌发生激烈交锋。战斗的余波导致地块坍塌，霜星与罗德岛的博士一同坠入地下废墟。在地下的短暂休战期间，雪怪小队的成员展现出了他们不为人知的一面：他们并非冷酷无情，也会开玩笑，谈论朴实的愿望（比如种地），对乌萨斯充满刻骨的仇恨，更重要的是，他们对霜星和爱国者有着深厚的感情和担忧。他们在废墟外不遗余力地挖掘，希望能尽快救出霜星。\n\n在地下废墟中，苏醒的霜星与博士进行了一次深刻的对话。她向博士讲述了自己的童年悲剧、被爱国者收养的经历，以及她对当前整合运动方向和塔露拉的失望。她质疑整合运动是否已沦为塔露拉实现个人目的的工具，牺牲了无数感染者的生命。她对罗德岛的立场感到迷茫，但从博士的眼神中看到了并非完全的冷酷。意识到自己生命将尽的她，与博士定下了一个生死攸关的“赌约”，既是对命运的挑战，也是对罗德岛能否真正改变大地的试探。最终，罗德岛先挖开了废墟，霜星遵守承诺，并未立刻动手，并赠药给罗德岛干员，希望双方“不再见面”。\n\n然而，龙门的战火仍在蔓延。在贫民区，一股身份神秘的黑色雨披部队开始无差别“清除”感染者。为了保护梅菲斯特等幸存的整合运动成员以及贫民区居民，同时应对追击而来的龙门近卫局和黑色雨披部队，雪怪小队（除已被带离的霜星外）的成员们做出了一个悲壮的决定：留下来殿后。他们明白这将是生命的最后一战，在喝下伏特加后，他们选择了慷慨赴死，用自己的生命为同伴和“大姊”、“大爹”争取时间。煌曾试图赶来支援，但未能及时阻止这场悲剧。雪怪小队的成员们全部战死，他们的牺牲是整合运动内部温情与忠诚的极致体现。\n\n得知雪怪小队牺牲后，被幻影弩手带离的霜星悲痛欲绝，但仍坚守着他们是为了感染者未来而牺牲的信念。她拒绝回到切尔诺伯格，而是选"
    ],
    "response":"根据检索到的文档，霜星是整合运动的干部，领导者名为“雪怪小队”的特殊术师小队。她是一位强大的冰霜系源石技艺使用者，重度感染者，真名为叶莲娜，是“爱国者”博卓卡斯提的养女。",
    "reference":"霜星是整合运动雪境小队队长。阿米娅通过感知情感，理解了霜星内心深处的痛苦与愤怒，并试图用罗德岛的理念感化她。霜星在濒死之际将希望托付给阿米娅。",
    "context_precision":0.95,
    "context_recall":0.3333333333,
    "faithfulness":1.0,
    "answer_relevancy":0.5754295553
  },
  {
    "user_input":"阿米娅有哪些别名？",
    "retrieved_contexts":[
      "# 阿米娅\n\n# 其他名称\n\n魔王;小小的魔王;异族的稚儿;异族的魔王;小兔子;温柔的孩子;娇小的卡特斯;新的魔王;我王;卡特斯女孩;文明的存续的继承者;巴别塔的领导者;阿米娅小姐;兔子小姐\n\n## 简要介绍\n\n阿米娅是罗德岛制药公司的公开领袖，一位充满理想与坚韧的卡特斯少女。她在一场车祸中失去双亲并感染矿石病，后被失忆前的博士救下，并与特蕾西娅、凯尔希共同组建巴别塔。特蕾西娅遇刺后，阿米娅继承了萨卡兹“魔王”的王冠与力量，肩负起终结感染者苦难、切断仇恨循环的使命。她拥有感知他人情感的独特源石技艺。尽管外表柔弱，阿米娅在博士和凯尔希的陪伴下，带领罗德岛穿越泰拉的动荡，直面萨卡兹的千年宿命与维多利亚的战火，展现出超越年龄的智慧、勇气与对和平的坚定追求，是罗德岛理念的核心象征。\n\n## 相关角色\n\n- 博士阿米娅最信任的伙伴，罗德岛的最高指挥官。博士是阿米娅的救命恩人、精神支柱和最重要的同伴。阿米娅将自己早年的野外生存技能归功于博士，并对他抱有无条件的信任与依赖，多次舍身保护他，甚至在极端危机中将罗德岛指挥权托付。博士的回归是阿米娅做出的“豪赌”，两人共同承担罗德岛的使命，并约定无论未来如何都将并肩作战，阿米娅更誓言若博士误入歧途，她将是唯一能阻止他的人。\n- 凯尔希罗德岛的资深医生与重要成员，阿米娅的导师和引路人。她在特蕾西娅遇刺后，成为阿米娅成长路上的关键指引者，密切关注阿米娅对“魔王”力量的适应与使用，并为其提供战略支持与医疗保障。阿米娅信任凯尔希的判断，但也体恤她的辛劳，有时选择独自承担压力。凯尔希视阿米娅为罗德岛的未来，并与她共同描绘感染者的希望。\n- 特蕾西娅前任“魔王”，巴别塔的领袖，阿米娅力量与意志的来源。她如慈母般关爱幼年阿米娅，并在遇刺前将“黑王冠”和“文明的存续”力量传承给阿米娅，希望她改写宿命。特蕾西娅的幻影与意志多次在阿米娅的梦境和精神深潜中显现，指引她理解萨卡兹的苦难，并最终在“慈悲灯塔”活动中完成力量的正式传承，让阿米娅明确了作为“魔王”的使命。\n- 煌罗德岛精英干员，阿米娅的亲密战友和朋友。阿米娅信任煌的战斗力，也关心她的情感状态，在她迷茫时给予支持和鼓励，并会以请吃咖喱等方式安抚。煌亲昵地称呼阿米娅为“小兔子”，对阿米娅忠诚且听从指挥。\n- 陈龙门近卫局警司，阿米娅的朋友与合作者。两人在切尔诺伯格与龙门危机中并肩作战，阿米娅理解陈的坚韧与内心的挣扎，并在危急时刻与其情感共鸣，掌握了陈的剑术。阿米娅对陈的态度从最初的“严格”到后来的信任与相互理解。\n- 塔露拉整合运动领袖，陈晖洁的姐姐。阿米娅在切尔诺诺格核心城与被科西切操控的塔露拉进行了决定性对决，通过感知与呼唤唤醒了塔露拉本身的意志，帮助她摆脱了科西切的诅咒。两人之间的纠葛远未结束，阿米娅预感她们终将重逢。\n- 梅菲斯特整合运动干部，手段残忍。阿米娅对其非人道行为深感厌恶和愤怒，直斥其恶毒，并拒绝赋予他任何“光荣”的死亡。阿米娅多次与他交锋，并誓言清理其“怨恨的毒”。\n- 霜星整合运动雪怪小队队长。阿米娅通过感知情感，理解了霜星内心深处的痛苦与愤怒，并试图用罗德岛的理念感化她。霜星在濒死之际将希望托付给阿米娅，阿米娅则将一种治疗霜冻的药物命名为“霜星”以作纪念。\n- 爱国者整合运动温迪戈战士。阿米娅在“苦难摇篮”中与爱国者对峙，感知到他两百多年的痛苦与悔恨，并试图为他带来“更好的结局”。爱国者在生命的最后识破了阿米娅“魔王”的身份，并将停止核心城的秘钥托付给她，感叹“我王......你往何处去？”。\n- W前巴别塔佣兵，后加入整合运动。她对阿米娅与博士抱有复杂情感，既是搅局者也是合作者。W曾嘲讽罗德岛干员的牺牲“毫无价值”，被阿米娅愤怒驳斥。在关键时刻，她协助罗德岛停止切尔诺伯格，并最终在特蕾西娅的引导下放下过去，成为“维什戴尔”。\n- **Logos**：罗德岛精英干员，女妖王庭之主。他忠实地追随特蕾西娅的理想，并坚定地保护阿米娅。在对抗血魔大君和萨卡兹众魂时，Logos与阿米娅并肩作战，其“丧钟”力量与阿米娅的“魔王”力量产生共鸣，是阿米娅信赖的战友。\n- 暴行罗德岛精英干员，阿米娅的亲密朋友与如同姐姐般的存在。她幼年时曾照顾阿米娅，对她充满牵挂。得知阿米娅成为罗德岛领袖后，暴行被其感召，决定加入罗德岛，誓言倾尽所有力量保护阿米娅。阿米娅也依赖她，并与她分享生活乐趣。\n- 华法琳罗德岛资深医生。她曾是阿米娅在罗德岛的“第一个病人”，密切关注阿米娅的身体和精神健康，并提醒她控制“魔王”力量的使用。她对阿米娅的成长抱有深切的期望，希望她能活着回来。\n- 迷迭香罗德岛精英干员，与阿米娅关系深厚。阿米娅能通过精神链接安抚迷迭香的负面情绪，并对她抱有极高的尊重与关心。迷迭香将阿米娅视为亲近的家人。\n- 米莎一个乌萨斯感染者少女，被整合运动利用。阿米娅在",
      "# 阿米娅\n\n# 详细介绍\n\n阿米娅是泰拉大地上，罗德岛制药公司的公开领袖，一位年轻的卡特斯少女，却肩负着改变世界命运的重担。她身患矿石病，并继承了萨卡兹“魔王”的王冠与力量，致力于为感染者和所有受压迫者寻找一条通往希望的道路。\n\n**失落的童年与重获新生**\n阿米娅的童年始于雷姆必拓。在一次突如其来的车祸中，她失去了双亲，自己也染上了矿石病。在绝望与荒芜中，年幼的她被当时失忆前的博士偶然救起。博士不仅将她带离险境，更向她承诺会治愈她的疾病，为她带来一个充满希望的未来。这段经历是阿米娅生命的“最初坐标”，奠定了她对博士无与伦比的信任与依赖，她曾对博士说：“博士在哪，我就在哪。”（出自活动剧情“巴别塔”\/“悠长的旅途”）。\n随后，博士带着阿米娅抵达了巴别塔。在那里，她遇到了巴别塔的领袖、萨卡兹“魔王”特蕾西娅，以及资深医生凯尔希。特蕾西娅对阿米娅展现出如同母亲般的关爱与温柔，陪伴她，为她讲故事，并让巴别塔成为了阿米娅的新家。凯尔希则开始为阿米娅的矿石病制定治疗方案。在这段时期，阿米娅敏感地察觉到博士因过度劳累而变得不开心，担忧是自己的病情让他感到低落。\n\n**“魔王”的传承与觉醒**\n巴别塔与军事委员会的内战期间，特蕾西娅为了保护阿米娅，在遇刺的最后时刻，将象征着“黑王冠”和“文明的存续”的力量传承给了阿米娅，希望她能改写萨卡兹的悲惨结局，带领巴别塔走向未来。特蕾西娅的意识也短暂寄宿在阿米娅体内，向凯尔希传达了最后的嘱托。这一刻，年幼的阿米娅被赋予了沉重的“魔王”宿命。\n继承力量初期，阿米娅的精神状态曾一度棘手，会出现呓语、非自发读取他人情绪以及对力量控制不稳的情况，手上的戒指也成为抑制这份强大力量的“枷锁”。凯尔希和华法琳等罗德岛的医生们为此付出了巨大努力。\n\n**唤醒博士与切尔诺伯格的战火**\n在特蕾西娅遇刺后，博士进入了长达三年的休眠。阿米娅与凯尔希接管巴别塔，将其改组为罗德岛制药公司。三年后，阿米娅亲自带领小队深入乌萨斯城市切尔诺伯格，唤醒了失忆的博士。面对博士记忆的缺失，阿米娅坚定地自我介绍，强调博士是她“最重要的同伴”，并毫不犹豫地将罗德岛的指挥权托付给他，展现了她对博士无条件的信任。\n切尔诺伯格被整合运动攻占，罗德岛在撤离过程中，阿米娅目睹了整合运动的暴行，也亲历了平民对感染者的恐惧。她向博士解释矿石病的残酷，以及罗德岛为感染者争取生机的使命。她坚定地表示罗德岛的宗旨是“希望各位，都能绽放笑容”，并希望罗德岛能成为感染者的“温暖的家”。\n在龙门贫民区，阿米娅为保护博士，首次爆发力量击倒了整合运动的“碎骨”。然而，这让她陷入深深的自责与痛苦，质疑自己作为感染者领袖，却不得不夺走其他感染者生命的矛盾。她向博士倾诉内心的挣扎，但最终重申了保护博士的决心。米莎的死，以及她最终选择站到整合运动一边，让阿米娅对仇恨的循环有了更深刻的理解与悲哀。在与碎骨的第二次对决后，阿米娅收下了他的面具，象征着背负这份痛苦继续前行。\n在与整合运动领袖塔露拉的最终对决中，阿米娅通过与陈晖洁的情感共鸣，解开一枚戒指的束缚，觉醒了“近卫”形态的力量——“云裂之剑-影霄”。她直面“不死的黑蛇”科西切对塔露拉的操控，揭露其谎言，最终成功唤醒了塔露拉本身的意志，帮助她摆脱了诅咒。战后，阿米娅因巨大压力和情绪释放而昏倒，凯尔希抽取博士的血液制造药物并为他注射，醒来后她流下了久违的眼泪，并命名了一种治疗霜冻的药物为“霜星”，以纪念那些牺牲的战士。她向博士重申，无论未来多艰难，罗德岛都会前行，如果博士有一天误入歧途，她将是唯一能阻止他的人。\n\n**维多利亚的战火与“魔王”之路的抉择**\n随着罗德岛前往维多利亚伦蒂尼姆，阿米娅的“魔王”身份和力量得到了更深层的展现与考验。她能感知到伦蒂尼姆中心盘桓的“更古老的......更强大的力量”，以及萨卡兹万年来的悲愤与仇恨。在与血魔大君的交锋中，她被萨卡兹众魂的集体记忆冲击，亲身感受了萨卡兹历史上的苦难与对凯尔希的复仇渴望，痛苦不堪，但她拒绝被仇恨吞噬，坚称“戒指不行，我可以。我不是器具。”（出自慈悲灯塔 \/ 应对饱和打击）\n在“惊霆无声”活动中，阿米娅梦见了萨卡兹掌控下维多利亚的悲惨未来，这让她对“魔王”的使命感到迷茫。她被“灰礼帽”确认为“魔王”，并被死魂灵质疑其作为“异族魔王”的资格。但阿米娅选择直面所有苦难，坚定地拒绝了死魂灵所代表的永恒仇恨之路，她的这种“能拒绝”仇恨的特质，被博士肯定为她作为“魔王”的独特与必要之处。\n在“破碎日冕”中，阿米娅在列车上意外亲眼见到了活着的、白发萨卡兹形态的特蕾西娅。这一幕给她带来了前所未有的震惊与悲哀，让她坚定了追寻真相的决心：“既然我来到了这里，那我就需要弄清楚真相。”（出自破碎日冕\/理想的倒影）\n最终，在“慈悲灯塔”活动中，阿米娅与博士、凯尔希、W等深入“阿喃那”内部形成的",
      "# 陨星\n\n# 其他名称\n\n陨星;钝镝;重矢\n\n## 简要介绍\n\n陨星，萨卡兹族感染者，来自饱受战火摧残的卡兹戴尔。她曾是“守林人”组织成员，后成为一名辗转各地的自由佣兵，代号多变，以参与萨卡兹相关战役为主。现作为罗德岛的狙击干员，使用重型弩炮提供卓越的范围杀伤。她外表冷峻，言语直接，内心却保有温情，尤其关注同族萨卡兹的命运。在罗德岛，她逐渐找到了安定，并对未来抱有复杂但包含希望的情感。\n\n## 相关角色\n\n-   守林人前“守林人”组织成员，曾与陨星并肩作战。陨星对其有复杂情感，认为故乡毁灭后守林人的时间停止了，且不愿提及叛军引向她故乡的事与自己无关，认为萨卡兹人的话不会被相信。\n-   阿米娅罗德岛的领导者。陨星对其非常信任和关心，将她视为需要保护的孩子，同时也从阿米娅那里学到了重要的道理。阿米娅的理念让陨星动摇了离开罗德岛的念头，并在她身上看到了萨卡兹未来的希望。\n-   **萨卡兹教师**：陨星年轻时遇到的萨卡兹老人，教导她认字和理解词语。他代表了萨卡兹民族的文化和对美好生活的向往，并将未完成的词典托付给陨星。\n-   杰西卡罗德岛干员，曾与陨星在切城废墟一同执行侦察任务。陨星认可她的成长，同时像对待孩子一样关心她的心理创伤。\n-   霜叶罗德岛干员，曾与陨星在切城废墟一同执行侦察任务。陨星对其十分关心，不惜受伤也要将其从险境中救出，并认为她有时过于逞强像个孩子。\n-   史尔特尔罗德岛干员，曾与陨星一同执行勘探任务。陨星发现她难以相处，但理解她寻找“归所”的困境，并尝试开导她。\n-   幽灵鲨罗德岛干员，曾与陨星一同执行过一次高难度任务。陨星对她的精神状态和战场表现感到不安和困惑。\n-   临光罗德岛干员，曾与陨星计划共同执行巡逻任务。两人有较为轻松的交流。\n-   杜宾罗德岛干员，与陨星、临光有日常交流，关心新干员培养。\n-   博士罗德岛的领导者，陨星的雇主。陨星对博士表示感谢和信赖，承诺会尽力保护博士，并第一次在一个组织久留并感到安定。\n\n## 详细介绍\n\n陨星，一名萨卡兹族感染者，其漫长且充满战火的生涯始于卡兹戴尔。她曾是“守林人”组织的一员，一个似乎因故乡毁灭而停止了前进的组织，而那段历史，陨星选择绝口不提，只留下一句“没人会相信一个萨卡兹人的话”，暗示着复杂与误解。脱离守林人后，她成为了自由佣兵，在泰拉大陆的各个角落辗转作战，代号多达十七个，包括早期的“钝镝”、“重矢”以及最终确定的“陨星”。这些代号背后，是无数次任务、无数场战役，其中大部分都与萨卡兹有关，她几乎没有停歇地为萨卡兹人的命运而战。\n\n她的佣兵生涯塑造了她冷峻、务实的性格。在年轻作为“钝镝”时，她已经学会在腥风血雨中清晰地计算自己的所得，毫不客气地维护自身利益。然而，战争也在她内心留下了深刻的创伤。在一次任务中，她遇到了一个萨卡兹教师，他试图教导她认字，并解释一个对她而言无法理解的词——“一个令人心生欢喜，悠闲宁静的夜晚”。在战火中成长的她，无法将夜晚与美好联系起来，她的每一次尝试联想都被痛苦的回忆打断：团长的严厉训练、同伴间的警惕、随时可能落下的炮火。即使是看到萤火虫的微光，她也曾误以为是战场死者的“鬼魂”。尽管如此，在教师的引导下，她内心深处仍有微弱的触动，像一只小虫振动翅膀，微弱但充满生机。最终，教师在营地遇袭后选择放弃，将一本未完成的萨卡兹语词典托付给她，希望她能在那一天理解并补全那个词条。这个词和这本词典成为了她心中未完成的功课，也是她对萨卡兹民族未来的某种寄托。\n\n多年来，她一直在为萨卡兹的地位和未来而努力，尽管常常感到无力和挣扎。萨卡兹人在主流社会中受到排挤是普遍事实，这也使得她习惯于戴上冰冷的面具，独善其身。然而，当她来到罗德岛，这个汇聚了各种种族和身份的地方，她的看法开始改变。她惊讶地看到许多萨卡兹人在此和睦相处，这在她过去的生活中是难以想象的。阿米娅对她说“我也想帮助萨卡兹人”这句话，深深地触动了她，让她动摇了继续漂泊、终将离开罗德岛为萨卡兹独立目标而战的想法。她开始愿意相信，这片大地上，还有人对未来抱有期待，罗德岛或许能为萨卡兹提供一个更好的容身之处。\n\n在罗德岛，陨星展现了她作为资深干员的专业能力和对同伴的深切关怀，尤其体现在对年轻干员的照顾上。在切尔诺伯格分城废墟的救援行动中，她作为侦察小队的领导者，带领杰西卡和霜叶执行任务，展现了冷静的判断力和战斗技巧，利用爆炸物制造掩护。面对整合运动和雪怪小队的威胁，她表现出对不利局势的厌恶，不愿像被逼入绝境的猎物一样躲藏。在阿米娅的救援队伍到来后，她对阿米娅的到来既感到高兴又担忧其陷入危险。当杰西卡因目睹梅菲斯特的残忍行径而受到心理创伤时，陨星努力安抚她。在霜叶为掩护大家而突进并被霜星重创时，陨星不顾自身受伤，毅然冲上前将霜叶救回，并流露出对霜叶和阿米娅这些“孩子”逞强行为的担",
      "# 沉痛转机\n\n# 剧情总结\n\n本次活动剧情《沉痛转机》聚焦于罗德岛干员暴行（Barrage）加入罗德岛之前的经历。故事伊始，暴行刚刚结束了在巴别塔（Babel）为期两年的合作任务，返回家乡雷姆必拓（Remu Biton）的矿区。她与一位名叫老约翰的老矿工交谈，表达了对结束巴别塔合作的迷茫，以及对任务期间认识的一位萨卡兹（Sarkaz）女孩（后文暗示为阿米娅）的牵挂。暴行曾与巴别塔合作负责将雷姆必拓开采出的“舰体和核心”运输并交付，但合作突然终止，她对此感到困惑，同时也对离开家乡、见到外部世界的经历感到触动。尽管心中牵挂着那位女孩，暴行还是回到了雷姆必拓，继续她作为安保人员的职责，保护矿工们的安全。老约翰鼓励她无论身处何地都要肩负起自己的使命和责任。\n\n两年后，暴行继续在雷姆必拓矿区工作。一场突如其来的灾难降临：27、28、29号矿井发生严重的活性源石粉尘爆炸。暴行立即投入到危险的救援工作中，她冒着生命危险进入坍塌、充满粉尘的矿井，成功救出了包括老约翰在内的多名伤员。\n\n在矿区外设置的临时救助站，暴行遇到了参与联合应急医疗小组的志愿者。她惊讶地发现，其中一些医疗人员来自一个她从未听说过的组织——罗德岛制药公司（Rhodes Island Pharmaceuticals）。罗德岛医疗干员使用了效果显著的应急药物，有效抑制了矿工们的源石感染扩散，这让暴行感到非常意外，因为雷姆必拓现有的医疗资源对此效果有限。\n\n在与一位罗德岛医疗干员交流时，暴行无意中听到了一个熟悉的名字——凯尔希（Kal'tsit）。这让她产生了联想。她进一步询问罗德岛的领袖是谁，当听到“阿米娅”（Amiya）这个名字时，暴行感到极度震惊和激动。她意识到，这个名字与她两年前在巴别塔任务期间认识并一直牵挂着的那位萨卡兹女孩是同一个人。尽管阿米娅年龄尚小，但罗德岛医疗干员对她的智慧和领导能力赞不绝口，并证实阿米娅确实提过一位在雷姆必拓的亲密好友。\n\n得知阿米娅的身份和下落后，暴行立刻做出了决定。十五天后，她来到救助站的感染者病房探望老约翰。老约翰已经确定感染矿石病，他为了家人的生计，决定病愈后离开雷姆必拓，前往哥伦比亚参与“大拓荒”。暴行向老约翰坦承了自己即将离开雷姆必拓的决定，她告诉他自己找到了必须保护的朋友（阿米娅），并且要去她身边。老约翰理解并支持暴行的选择，认为每个人都有自己的使命，暴行也应该去拯救更多的人、保护她在乎的人。\n\n在向老约翰和家人告别后，暴行正式接受了罗德岛的入职邀请。她与罗德岛医疗干员会合，接过招聘合同，并表示迫不及待地想见到阿米娅，与她分享过去两年的经历，也想听听阿米娅的故事。故事在暴行满怀期待踏上前往罗德岛旅程的时刻结束，标志着她人生新篇章的开始，以及与阿米娅的即将重逢。整个故事通过矿区生活的艰辛、突如其来的灾难、以及关键人物的出现，展现了暴行性格的转变和最终的抉择，为她作为罗德岛干员的身份提供了深刻的背景。\n\n## 剧情高光\n\n-   老约翰对暴行的叮嘱：\n    > “每个人，每个时代，都有着不得不肩负的使命和责任。”\n    > “我知道，你从小就不是个普通兔子。每个人都有自己的使命和责任。”\n    > “你的锤子救了我们的命，接下来的日子，你也会拯救更多的人。”\n    > “如果有必须要保护的人，那就离开吧。我也一样。”\n-   暴行得知阿米娅身份时的反应：\n    > 罗德岛医疗干员: 我们的首领，罗德岛组织现任领袖，她的名字是——“阿米娅”。\n    > 暴行: ......阿......米娅......\n-   暴行决定前往罗德岛与阿米娅重逢时的内心独白：\n    > 我找到了。\n    > 阿米娅，你变成什么样了呢？\n    > 已经成长为领袖了，真了不起。\n    > 等着我吧，阿米娅。不论发生了什么，现在肩负着什么样的使命。\n    > 我有好多想告诉你、想和你分享的故事。你会想听吗？\n    > 这两年里，你遇到的快乐的事情、难过的事情，我遇到的快乐的事情、难过的事情——\n    > 在见面以后，来尽情诉说吧。\n\n## 相关信息\n\n-   雷姆必拓的矿区开采的“货物”是“舰体和核心”，这些被送往巴别塔。\n-   巴别塔与雷姆必拓的合作在活动两年前突然结束，原因未知。\n-   故事发生的地点“钢铁萝卜城”是一个有趣的名称。\n-   雷姆必拓矿工的老约翰在感染矿石病后，打算前往哥伦比亚参加“大拓荒”，这暗示了哥伦比亚当时正在进行的大规模开发活动。\n-   罗德岛在处理矿石病感染方面展现出了远超当地水平的医疗能力，其应急药剂能有效抑制感染扩散。\n\n## 关键人物\n\n暴行; 老约翰; 阿米娅; 凯尔希; 罗德岛医疗干员\n\n## 角色剧情概括\n\n-   **-   暴行**: 本故事的主角。她从巴别塔合作任务归来，回到家乡雷",
      "# 阿米娅\n## 干员名: 阿米娅\n## 干员外文名: Amiya アーミヤ\n## 星级: 5\n## 职业: 术师\n## 分支: 中坚术师\n## 特性: 攻击造成法术伤害\n## 所属势力: 罗德岛\n## 隐藏势力: 无\n## 获得方式: 主线剧情 （首次通关主题曲2-10、3-8、4-9、6-17、7-18获取）\n## 上线时间: 2019年4月30日 10:00\n## 画师: 唯@W\n## 配音\n  中文: 陶典\n  日文: 黑泽朋世\n  韩文: 李智贤\n  英文: Emma Ballantine\n## 生命上限_攻击_防御_法术抗性\n  精英0_1级: 699 276 48 10\n  精英0_满级: 958 390 81 10\n  精英1_满级: 1198 514 110 15\n  精英2_满级: 1480 612 121 20\n  信赖加成上限: 200 70 0 0\n## 再部署: 70s\n## 部署费用: 18→20\n## 阻挡数: 1\n## 攻击速度: 1.6s\n## 攻击范围\n  精英0范围: ['XXX', 'TXX', 'XXX']\n  精英1_精英2范围: ['XXX.', 'TXXX', 'XXX.']\n## 技能\n  - 名称: 战术咏唱·γ型, 类型: 自动回复 手动触发, Level 7_初始_消耗_持续: 攻击速度+60 | 10 32 30, Rank Ⅲ_初始_消耗_持续: 攻击速度+90 | 15 30 30\n  - 名称: 精神爆发, 类型: 自动回复 自动触发, Level 7_初始_消耗_持续: 每次攻击变为攻击力45%的7连发，随机攻击范围内的目标 技能自动开启，持续时间结束后阿米娅晕眩10秒 | 0 100 25, Rank Ⅲ_初始_消耗_持续: 每次攻击变为攻击力60%的8连发，随机攻击范围内的目标 技能自动开启，持续时间结束后阿米娅晕眩10秒 | 0 100 25\n  - 名称: 奇美拉, 类型: 自动回复 手动触发, Level 7_初始_消耗_持续: 攻击力+160%，生命上限+75%，攻击范围扩大，伤害类型变为真实 技能结束后阿米娅强制退出战场 | 0 120 30, Rank Ⅲ_初始_消耗_持续: 攻击力+230%，生命上限+100%，攻击范围扩大，伤害类型变为真实 技能结束后阿米娅强制退出战场 | 0 120 30, 备注: ※强制退出战场视为撤回干员，返还部分部署费用\n## 天赋\n  - 名称: ？？？, ——: ？？？？？\n  - 名称: 情绪吸收, 精英2: 成功造成伤害后额外回复2（潜能6：+1）点技力，消灭敌人后额外获得8（潜能6：+2）点技力, 精英2 Y模组2级: 成功造成伤害后额外回复3（潜能6：+1）点技力，消灭敌人后额外获得8（潜能6：+2）点技力, 精英2 Y模组3级: 成功造成伤害后额外回复3（潜能6：+1）点技力，消灭敌人后额外获得10（潜能6：+2）点技力\n## 潜能提升\n  备注: 该干员无法使用通用信物来提升潜能。\n  潜能提升2: 生命上限+200\n  潜能提升3: 部署费用-1\n  潜能提升4: 攻击力+30\n  潜能提升5: 部署费用-1\n  潜能提升6: 天赋效果增强\n## 后勤技能\n  - 条件: 精英0, 技能: 合作协议, 房间: 控制中枢, 描述: 进驻控制中枢时，所有贸易站订单效率+7%（同种效果取最高）\n  - 条件: 精英2, 技能: 小提琴独奏, 房间: 宿舍, 描述: 进驻宿舍时，该宿舍内所有干员的心情每小时恢复+0.15（同种效果取最高）\n## 模组\n  DWDB-221E: {'阶段1': {'属性': '生命+100 攻击+30', '描述': '特性追加：普通攻击命中精英或领袖敌人时获得1点技力'}, '阶段2': {'属性': '生命+130 攻击+40', '描述': '天赋【情绪吸收】更新 成功造成伤害后额外回复3点技力，消灭敌人后额外获得8点技力'}, '阶段3': {'属性': '生命+150 攻击+50', '描述': '天赋【情绪吸收】更新 成功造成伤害后额外回复3点技力，消灭敌人后额外获得10点技力'}, '解锁任务': '由非助战阿米娅累计歼灭10个精英或领袖敌人 3星通关主题曲3-8；必须编入非助战中坚术师状态的阿米娅并上场，且使用中坚术师状态的阿米娅歼灭碎骨'}"
    ],
    "response":"根据文档1，阿米娅的别名包括：魔王、小小的魔王、异族的稚儿、异族的魔王、小兔子、温柔的孩子、娇小的卡特斯、新的魔王、我王、卡特斯女孩、文明的存续的继承者、巴别塔的领导者、阿米娅小姐、兔子小姐。",
    "reference":"阿米娅的别名包括：魔王、小小的魔王、异族的稚儿、异族的魔王、小兔子、温柔的孩子、娇小的卡特斯、新的魔王、我王、卡特斯女孩、文明的存续的继承者、巴别塔的领导者、阿米娅小姐、兔子小姐。",
    "context_precision":1.0,
    "context_recall":1.0,
    "faithfulness":1.0,
    "answer_relevancy":0.4686028729
  },
  {
    "user_input":"阿米娅和霜星之间发生了什么？",
    "retrieved_contexts":[
      "# 阿米娅\n\n# 详细介绍\n\n阿米娅是泰拉大地上，罗德岛制药公司的公开领袖，一位年轻的卡特斯少女，却肩负着改变世界命运的重担。她身患矿石病，并继承了萨卡兹“魔王”的王冠与力量，致力于为感染者和所有受压迫者寻找一条通往希望的道路。\n\n**失落的童年与重获新生**\n阿米娅的童年始于雷姆必拓。在一次突如其来的车祸中，她失去了双亲，自己也染上了矿石病。在绝望与荒芜中，年幼的她被当时失忆前的博士偶然救起。博士不仅将她带离险境，更向她承诺会治愈她的疾病，为她带来一个充满希望的未来。这段经历是阿米娅生命的“最初坐标”，奠定了她对博士无与伦比的信任与依赖，她曾对博士说：“博士在哪，我就在哪。”（出自活动剧情“巴别塔”\/“悠长的旅途”）。\n随后，博士带着阿米娅抵达了巴别塔。在那里，她遇到了巴别塔的领袖、萨卡兹“魔王”特蕾西娅，以及资深医生凯尔希。特蕾西娅对阿米娅展现出如同母亲般的关爱与温柔，陪伴她，为她讲故事，并让巴别塔成为了阿米娅的新家。凯尔希则开始为阿米娅的矿石病制定治疗方案。在这段时期，阿米娅敏感地察觉到博士因过度劳累而变得不开心，担忧是自己的病情让他感到低落。\n\n**“魔王”的传承与觉醒**\n巴别塔与军事委员会的内战期间，特蕾西娅为了保护阿米娅，在遇刺的最后时刻，将象征着“黑王冠”和“文明的存续”的力量传承给了阿米娅，希望她能改写萨卡兹的悲惨结局，带领巴别塔走向未来。特蕾西娅的意识也短暂寄宿在阿米娅体内，向凯尔希传达了最后的嘱托。这一刻，年幼的阿米娅被赋予了沉重的“魔王”宿命。\n继承力量初期，阿米娅的精神状态曾一度棘手，会出现呓语、非自发读取他人情绪以及对力量控制不稳的情况，手上的戒指也成为抑制这份强大力量的“枷锁”。凯尔希和华法琳等罗德岛的医生们为此付出了巨大努力。\n\n**唤醒博士与切尔诺伯格的战火**\n在特蕾西娅遇刺后，博士进入了长达三年的休眠。阿米娅与凯尔希接管巴别塔，将其改组为罗德岛制药公司。三年后，阿米娅亲自带领小队深入乌萨斯城市切尔诺伯格，唤醒了失忆的博士。面对博士记忆的缺失，阿米娅坚定地自我介绍，强调博士是她“最重要的同伴”，并毫不犹豫地将罗德岛的指挥权托付给他，展现了她对博士无条件的信任。\n切尔诺伯格被整合运动攻占，罗德岛在撤离过程中，阿米娅目睹了整合运动的暴行，也亲历了平民对感染者的恐惧。她向博士解释矿石病的残酷，以及罗德岛为感染者争取生机的使命。她坚定地表示罗德岛的宗旨是“希望各位，都能绽放笑容”，并希望罗德岛能成为感染者的“温暖的家”。\n在龙门贫民区，阿米娅为保护博士，首次爆发力量击倒了整合运动的“碎骨”。然而，这让她陷入深深的自责与痛苦，质疑自己作为感染者领袖，却不得不夺走其他感染者生命的矛盾。她向博士倾诉内心的挣扎，但最终重申了保护博士的决心。米莎的死，以及她最终选择站到整合运动一边，让阿米娅对仇恨的循环有了更深刻的理解与悲哀。在与碎骨的第二次对决后，阿米娅收下了他的面具，象征着背负这份痛苦继续前行。\n在与整合运动领袖塔露拉的最终对决中，阿米娅通过与陈晖洁的情感共鸣，解开一枚戒指的束缚，觉醒了“近卫”形态的力量——“云裂之剑-影霄”。她直面“不死的黑蛇”科西切对塔露拉的操控，揭露其谎言，最终成功唤醒了塔露拉本身的意志，帮助她摆脱了诅咒。战后，阿米娅因巨大压力和情绪释放而昏倒，凯尔希抽取博士的血液制造药物并为他注射，醒来后她流下了久违的眼泪，并命名了一种治疗霜冻的药物为“霜星”，以纪念那些牺牲的战士。她向博士重申，无论未来多艰难，罗德岛都会前行，如果博士有一天误入歧途，她将是唯一能阻止他的人。\n\n**维多利亚的战火与“魔王”之路的抉择**\n随着罗德岛前往维多利亚伦蒂尼姆，阿米娅的“魔王”身份和力量得到了更深层的展现与考验。她能感知到伦蒂尼姆中心盘桓的“更古老的......更强大的力量”，以及萨卡兹万年来的悲愤与仇恨。在与血魔大君的交锋中，她被萨卡兹众魂的集体记忆冲击，亲身感受了萨卡兹历史上的苦难与对凯尔希的复仇渴望，痛苦不堪，但她拒绝被仇恨吞噬，坚称“戒指不行，我可以。我不是器具。”（出自慈悲灯塔 \/ 应对饱和打击）\n在“惊霆无声”活动中，阿米娅梦见了萨卡兹掌控下维多利亚的悲惨未来，这让她对“魔王”的使命感到迷茫。她被“灰礼帽”确认为“魔王”，并被死魂灵质疑其作为“异族魔王”的资格。但阿米娅选择直面所有苦难，坚定地拒绝了死魂灵所代表的永恒仇恨之路，她的这种“能拒绝”仇恨的特质，被博士肯定为她作为“魔王”的独特与必要之处。\n在“破碎日冕”中，阿米娅在列车上意外亲眼见到了活着的、白发萨卡兹形态的特蕾西娅。这一幕给她带来了前所未有的震惊与悲哀，让她坚定了追寻真相的决心：“既然我来到了这里，那我就需要弄清楚真相。”（出自破碎日冕\/理想的倒影）\n最终，在“慈悲灯塔”活动中，阿米娅与博士、凯尔希、W等深入“阿喃那”内部形成的",
      "# 雪怪小队\n\n# 其他名称\n\n雪怪小队\n\n## 简要介绍\n\n雪怪小队是整合运动的一支重要武装力量，由核心成员霜星领导。这支小队的成员是博卓卡斯替（爱国者）在西北冻原的矿场废墟中拯救的感染者孤儿组成的，并在他的指导下长大和接受训练。他们成员之间情同手足，对霜星和爱国者忠心耿耿。在切尔诺伯格事件后期和龙门战役期间，雪怪小队表现出了强大的战斗力，同时也展现出对同伴和感染者同胞的深厚情感。最终，除了霜星之外的雪怪小队成员在龙门贫民区为了掩护同伴撤退而选择了牺牲。霜星随后也在与罗德岛会面后力竭而逝，雪怪小队的故事以悲剧落幕。\n\n## 相关角色\n\n-   霜星雪怪小队的领导者，由爱国者抚养和训练长大，是小队的精神核心和战力担当。她与博士在废墟中有过深入交流，最终在龙门与罗德岛诀别。\n-   **博卓卡斯替 (爱国者)**：雪怪小队的创立者和所有成员的养父、导师。小队成员对他怀有深厚的尊敬和爱戴。\n-   塔露拉整合运动的领袖。霜星对她后期的行为感到失望和不甘，认为她背叛了感染者的未来。\n-   煌罗德岛干员，与雪怪小队和霜星多次交锋，是最初接触到雪怪小队的罗德岛干员之一。\n-   博士罗德岛指挥者，在切尔诺伯格废墟下与霜星有过重要对话，并见证了霜星的最后时刻。\n-   阿米娅罗德岛领导者，与博士一同在龙门见证了霜星最后的选择和离世。\n-   梅菲斯特整合运动干部。精神受创后被幻影弩手带往与雪怪小队汇合，由雪怪小队成员掩护撤离。\n-   浮士德整合运动干部。为掩护梅菲斯特等人撤离而殿后，雪怪小队得知其生还希望渺茫后感到悲伤。\n-   **幻影弩手**：整合运动成员。在龙门与雪怪小队汇合，告知了梅菲斯特和浮士德的情况，并最终将霜星带离。\n-   **龙门近卫局**：龙门官方武装力量，在龙门贫民区追击撤退的整合运动，与雪怪小队成员发生激战。\n-   **黑色雨披部队**：一支身份神秘的部队，在龙门贫民区无差别攻击感染者，也参与了对雪怪小队成员的围剿。\n\n## 详细介绍\n\n雪怪小队，这支由感染者组成的整合运动武装力量，其悲壮的故事始于乌萨斯西北冻原的矿场废墟。他们的领袖霜星，原名叶莲娜，幼时在此地的矿场经历了家人的逝去以及乌萨斯士兵对感染者儿童的残酷屠杀。在这场浩劫中，她体内的源石技艺觉醒，爆发出强大的冰霜力量。幸存下来的感染者儿童，包括叶莲娜，被彼时乌萨斯游击队的领袖，温迪戈族的博卓卡斯替（爱国者）所救。爱国者收养了这些孩子，将他们训练成一支独特的战斗小队——雪怪小队。成员之间情同手足，互称“兄弟姐妹”，对霜星称“大姊”，对爱国者则尊称为“大爹”或“老爷子”，形成了紧密的家族式纽带。\n\n作为整合运动的重要力量，雪怪小队在切尔诺伯格事变中扮演了重要角色，并在事变后期和后续的龙门战役中追击撤离的罗德岛部队。他们在战场上展现出强大的个人能力和协同作战水平，尤其霜星的冰霜源石技艺，拥有极强的破坏力和范围控制能力，能够制造出连空气都会冻结的黑色冰晶，对接近她的人造成严重的冻伤，她自身的体温也因此常年处于极低温。\n\n在龙门追击战中，雪怪小队与罗德岛干员煌发生激烈交锋。战斗的余波导致地块坍塌，霜星与罗德岛的博士一同坠入地下废墟。在地下的短暂休战期间，雪怪小队的成员展现出了他们不为人知的一面：他们并非冷酷无情，也会开玩笑，谈论朴实的愿望（比如种地），对乌萨斯充满刻骨的仇恨，更重要的是，他们对霜星和爱国者有着深厚的感情和担忧。他们在废墟外不遗余力地挖掘，希望能尽快救出霜星。\n\n在地下废墟中，苏醒的霜星与博士进行了一次深刻的对话。她向博士讲述了自己的童年悲剧、被爱国者收养的经历，以及她对当前整合运动方向和塔露拉的失望。她质疑整合运动是否已沦为塔露拉实现个人目的的工具，牺牲了无数感染者的生命。她对罗德岛的立场感到迷茫，但从博士的眼神中看到了并非完全的冷酷。意识到自己生命将尽的她，与博士定下了一个生死攸关的“赌约”，既是对命运的挑战，也是对罗德岛能否真正改变大地的试探。最终，罗德岛先挖开了废墟，霜星遵守承诺，并未立刻动手，并赠药给罗德岛干员，希望双方“不再见面”。\n\n然而，龙门的战火仍在蔓延。在贫民区，一股身份神秘的黑色雨披部队开始无差别“清除”感染者。为了保护梅菲斯特等幸存的整合运动成员以及贫民区居民，同时应对追击而来的龙门近卫局和黑色雨披部队，雪怪小队（除已被带离的霜星外）的成员们做出了一个悲壮的决定：留下来殿后。他们明白这将是生命的最后一战，在喝下伏特加后，他们选择了慷慨赴死，用自己的生命为同伴和“大姊”、“大爹”争取时间。煌曾试图赶来支援，但未能及时阻止这场悲剧。雪怪小队的成员们全部战死，他们的牺牲是整合运动内部温情与忠诚的极致体现。\n\n得知雪怪小队牺牲后，被幻影弩手带离的霜星悲痛欲绝，但仍坚守着他们是为了感染者未来而牺牲的信念。她拒绝回到切尔诺伯格，而是选",
      "# 局部坏死\n\n# 剧情高光\n\n*   煌的初次登场，以一人之力拦下整合运动，并展现了强大的近战和元素技艺。原文引用（部分）：\n    煌：“我是来自罗德岛的精英干员，煌。我的作战目标是让各位失去战斗能力。”\n    煌：“立即投降的话，我有资格抓你们去罗德岛，然后丢去个对感染者还算宽容的地方。”\n    整合运动成员：“赤手空拳就挡下来了？！”\n    煌：“我的身上冒热气？猜错了。再猜猜看，是我身边的空气更热，还是你身边的空气更热？一起洗个萨米澡吧，我请。”\n*   浮士德面对梅菲斯特的疯狂，选择保护同胞并最终牺牲自己为他们殿后。原文引用（部分）：\n    梅菲斯特：“浮士德，走吧，我们......”\n    梅菲斯特：“浮士德？”\n    浮士德：“......你做了什么？”\n    浮士德：“浮士德，告诉我。我们该怎么办？”\n    浮士德：“......我们活下去。”\n    浮士德：“......带他一起走。别去切尔诺伯格。”\n    梅菲斯特：“萨沙！！萨沙！！！”\n    浮士德：“别了，伊诺。”\n*   霜星在废墟中与博士的对话，特别是她对乌萨斯矿场经历、对家人的回忆以及对塔露拉失望的坦诚。原文引用（部分）：\n    霜星：“这些，这头年老的野兽，一个字都没有向我提过。”\n    霜星：“那个怪物一样的顽固老头，有着一颗脆弱又多孔的心。”\n    霜星：“现在一切都变了。”\n    霜星：“如果这一切都是塔露拉的安排，那从最开始，她就欺骗了所有人。”\n    霜星：““如果我与她正面对抗，我能有几分胜算？””\n*   雪怪小队在霜星和博士被困后，选择与罗德岛合作挖掘，并在最后为保护霜星和剩余同胞而壮烈牺牲。原文引用（部分）：\n    雪怪1号先生：“那么雪怪1号先生......我们都有要救的人，对吗？”\n    阿米娅：“就让我们一起制服那些可能干扰到救援进程的整合运动吧。”\n    雪怪小队成员B：“我们给你们殿后。如果不给你们拖一段时间，你们很快就会被龙门追上。”\n    佩特洛娃：“敬大姊和大老爹。”\n    雪怪小队全体：“敬霜星和爱国者！”\n*   阿米娅在与霜星的最终战斗中，直面霜星内心愤怒，并坚定地重申罗德岛为所有人生存而战的理念。原文引用（部分）：\n    霜星：“那现在就读一读吧，读读我的愤怒，读读这被酸苦和沸腾在胸膛里闷烧十几年，却还没放弃跳动的心！”\n    阿米娅：“你恨过她吗，霜星小姐？”\n    霜星：“......我从没恨过她。”\n    阿米娅：“但我是没法对你生气的。”\n    阿米娅：“我懂了，霜星小姐。刚才涌进我大脑的，我已经明白是什么了。”\n    阿米娅：“我是没法隔绝从你那来的情感。”\n    阿米娅：“活人是不应该成为棋子的。人就是人。”\n*   陈在行动结束后与魏彦吾的对峙，揭露了龙门高层隐藏的秘密和她与塔露拉家族的复杂关系。原文引用（部分）：\n    陈：“你都做了什么？是不是你？”\n    陈：“你是这样的人，所以你不能看！”\n    陈：“是不是你杀了塔露拉的父亲？！”\n    陈：“可我记得很清楚......那天是个晴天。那天晚上，没有月亮，只有几颗星星。”\n    陈：“而你的背后......你的背后，站满了穿着黑色雨披的人。”\n    陈：“你真的在保护龙门吗？难道你不才是那个威胁着龙门生息的人吗？”\n*   凯尔希在龙门领导层会面时，突然出现并投下了重磅消息——切尔诺伯格向龙门撞来。原文引用（部分）：\n    凯尔希：“而现在，切尔诺伯格的一部分，准确来说，是它的核心城......正在接近龙门。”\n    凯尔希：“核心城正不断向各处发送认证码，龙门全城都已经收到了电波。”\n    凯尔希：“它宣称——‘这座城市是乌萨斯的领土。’”\n*   霜星临终前与博士的对话，决定加入罗德岛并安详逝去。原文引用（部分）：\n    霜星：“——去毁掉现在的塔露拉。中止她的疯狂，不要让整合运动再吞噬更多感染者了。”\n    霜星：“或者......我的一点点私心。去拯救她。不。去帮助她。和我们那无数的感染者同胞一起......那个真正的......走在泥泞土地上的......塔露拉......”\n    博士：“我认为你父亲是真的爱你的。”\n    霜星：“在这片大地上，仅凭一个人，是什么也做不到的。”\n    霜星：“但她绝对不是一个人。”\n    霜星：“现在开始，我在你身边。我在你们身边。”\n    霜星：“我......愿意加入罗德岛。”\n    霜星：“放手吧。兄弟姐妹们在等我。”\n    霜星：“......父亲......我真是个傻子。”\n    霜星：“原谅我吧。”\n\n## 相关信息\n\n*   活动开头的引言引用了埃里克勋爵与李尔兰·D教授的论文，",
      "# 急性衰竭\n\n# 剧情总结\n\n本次活动剧情名为“急性衰竭”，故事围绕罗德岛干员阿米娅近期表现出的疲惫与迷茫，以及切尔诺伯格一座被废弃的分城中发现的异常情况展开。\n\n剧情始于阿米娅完成任务回到罗德岛，显得非常疲惫。凯尔希医生对她的健康，特别是她所戴的戒指表示担忧，并暗示这与阿米娅的身体状况和力量有关。凯尔希告诫博士，要小心避免让阿米娅置身过于危险的环境，并让她适当休息。阿米娅向博士倾诉了她的迷茫和疲惫，无法理解为何总是看着可以被拯救的人们在她眼前消逝，感到肩负的责任沉重，但她也表示不会放弃。\n\n与此同时，凯尔希为罗德岛安排了新的紧急任务：探索一座位于龙门城外、疑似从切尔诺伯格事件中逃脱的废弃城区（代号“14号设施”）。任务目标是搜救幸存者、收集情报，并应对可能潜藏的整合运动。包括陨星、霜叶、杰西卡在内的多支罗德岛侦察小队被派往该区域。在出发前，黑钢干员芙兰卡、雷蛇以及企鹅物流的德克萨斯、能天使完成在罗德岛的任务，与阿米娅和博士告别，鼓励阿米娅休息。阿米娅决定先去龙门贫民区看看情况，尽管凯尔希和博士有顾虑，但阿米娅提及在龙门的干员红会协助，让博士稍微放心（尽管红并未在剧情中出现）。\n\n在废弃城区，陨星小队遭遇了整合运动成员，并发现这里的温度异常低。他们与凯尔希保持通讯，报告了整合运动的活动迹象。霜叶注意到废墟墙体在吸收热量，并联想到乌萨斯传说中的“雪怪小队”，一支以冰冷能力著称的感染者游击队。同时，杰西卡闻到一股烧焦的味道。\n\n在龙门贫民区，阿米娅遇到了一个活泼的感染者孩童，她帮助孩子抬起废品寻找留声机，孩子的乐观让她再次触动，但孩子的感染者身份也让她联想到那些遭受迫害、最终消逝的感染者同胞。她感到痛苦和无助，质疑自己能做什么，耳边响起剥夺感染者身份的冰冷话语。就在她陷入悲伤时，脑海中闪过温馨的回忆和另一个少女的声音，以及她答应过某个人的诺言，这让她重新坚定。随后她看到了陈长官，陈似乎与平时不同，眼神复杂，她独自与一个小女孩交流后匆匆离开，对阿米娅的态度也异常冷淡，让阿米娅感到困惑。\n\n回到罗德岛后，阿米娅与博士交流，她认为陈长官也许也有自己的想法和责任，她们之间的隔阂可能没有那么大。阿米娅再次表达了她的决心，即使道路艰难，她也会承担一切后果并继续前进，并希望博士陪伴。此时，凯尔希传来通讯，侦察小队情况紧急。\n\n在废弃城区深处，陨星小队再次遭遇整合运动，并确认这支队伍与低温异常有关。他们潜伏观察时，温度再次急剧下降，他们确定这就是传说中的“雪怪小队”在行动。他们发现低温的源头是埋在墙角的黑色源石。正当陨星小队紧张潜伏时，他们听到了梅菲斯特和W的对话，得知整合运动在等待“爱国者”，且似乎在进行某种“钓鱼”行动。梅菲斯特发现了陨星小队，轻松压制了他们的反击。就在危急时刻，霜叶感觉到“雪怪们”来了，急忙让陨星和杰西卡撤退，并通过通讯向阿米娅发出警告“不要来”，但通讯随后中断。\n\n罗德岛的其他侦察小队也报告了遭受袭击和干员冻伤的情况，通讯陆续中断。凯尔希和阿米娅意识到情况严重。阿米娅向在场的陈和星熊提出罗德岛与近卫局联合行动。陈最初拒绝，认为感染者身份的阿米娅不适合在贫民区行动，且近卫局有自己的决定。然而，面对不断恶化的情报（侦察小队遭遇重创、整合运动规模庞大），陈最终同意合作，但强调近卫局仍将以处理整合运动为优先任务，并会见机行事。凯尔希告知阿米娅，除了陨星小队外，其他侦察小队已被救援，但都有冻伤。陨星小队所在区域罗德岛难以深入，只能依靠阿米娅。阿米娅决心独自带领罗德岛小队前往营救陨星她们，陈和星熊也立即整备出发。\n\n罗德岛和近卫局抵达废弃城区入口。星熊对城区的异常感到不解。阿米娅确认了陨星小队的坐标在更深处。就在这时，陈似乎看到了什么，独自一人快速追了过去。罗德岛和近卫局被一个异常强大的整合运动成员和源石生物阻拦。击退敌人后，陈已经不见踪影。由于前方的区域是天灾残留的源石丛生区，对健康人有害，星熊决定带领近卫局守住外围入口，让阿米娅带领感染者干员为主的罗德岛小队深入，并拜托阿米娅把陈带回来。凯尔希此时报告所有已撤离的罗德岛干员都有严重冻伤，证实了“雪怪”的存在和危险性。凯尔希也表示她要去处理一些事情（暗示她将和红一起行动）。\n\n阿米娅的队伍深入废墟，找到了陨星小队留下的战斗痕迹，确认了她们的行动方向和状态（霜叶的冻结伤口技巧、陨星的爆炸痕迹）。凯尔希再次通讯，确认所有其他侦察小队已被救出，但陨星小队仍在失联区域，且所有获救干员都有冻伤，再次强调了“雪怪”的特殊性。阿米娅表示理解。当他们继续前进时，退路被整合运动切断，但阿米娅表示她们的目的不是逃跑，而是营救同伴。凯尔希此时联系红，准备在贫民区东入口会合，表示两人足够应对整合运动。\n\n阿米娅的队伍找到了追踪陈的痕迹，发现陈独自击败了大量整合运动成员。陈承认自己冲动，可能中了陷阱，并表示",
      "# 局部坏死\n\n# 角色剧情概括\n\n-   **博士 (Doctor)**: 作为玩家视角参与罗德岛在龙门的联合行动，主要跟随阿米娅和煌。与煌一同行动时，被煌保护并见证她的战斗风格和内心挣扎。与霜星一同被困废墟下，进行了活动中最核心的对话，了解了霜星悲惨的过去、复杂的情感以及对整合运动和塔露拉的真实看法。在霜星生命最后时刻陪伴她，见证了她的死亡和对罗德岛的最后承诺。活动结束时，抱着霜星的遗体，并与魏彦吾、陈、凯尔希等龙门高层和重要人物会面，了解了龙门内部的秘密和切尔诺伯格危机的降临。\n-   **阿米娅 (Amiya)**: 作为罗德岛的领袖，协调与龙门近卫局的联合行动。表现出对感染者的深切同情和对罗德岛理想的坚定维护。在贫民区行动中察觉异常，并决定解除与龙门的合作，因为魏彦吾的手段违背了罗德岛的原则。在与霜星的最终决战中，通过自身能力感受霜星的内心痛苦与愤怒，并以罗德岛为所有人而战的理念回应了霜星的质问，促使霜星最终接受自己的选择并安详逝去。\n-   **煌 (Skadi)**: 罗德岛精英干员，以强大而直接的作战风格闻名。在龙门行动中，作为主力开辟道路，保护博士。与灰喉的互动展现了她对感染者同胞的立场和对非感染者的偏见，但灰喉的行为改变了她的看法。与霜星在废墟中短暂交手，对其力量和痛苦印象深刻。在与黑雨披部队短暂冲突后，被对方提及父亲而感到愤怒。见证了雪怪小队的牺牲和霜星的死亡，深受触动， reafirma 她对感染者同胞的关注和对不公的对抗决心。\n-   **霜星 (FrostNova)**: 整合运动指挥官，雪怪小队领导者。在切尔诺伯格废墟与煌交战后与博士一同被困。通过与博士的对话，详细揭露了她悲惨的过往、与爱国者的父女情、以及对塔露拉和整合运动方向的失望。她是一个充满矛盾的角色，既冷酷强大，又对同胞充满爱与悲悯。在最终战中释放全部力量，被罗德岛小队击败。临终前，向博士和阿米娅表达了最后的愿望和对罗德岛的支持，最终安详离世。\n-   **浮士德 (Faust)**: 整合运动指挥官，梅菲斯特的搭档。对梅菲斯特滥用法术、伤害同胞的行为深感不安，暗中帮助其他整合运动成员逃离。在梅菲斯特失控后，选择将其制服并交给部下带离，自己则牺牲掩护部下撤退，利用源石技艺在与龙门部队和黑雨披部队的交战中殿后，生死不明（倾向于牺牲）。\n-   **梅菲斯特 (Mefisto)**: 整合运动指挥官。在龙门行动中因受挫而精神失控，滥用源石技艺将追随者转化为攻击一切的怪物。其疯狂行为加剧了整合运动的溃败，并导致许多整合运动成员死亡或变异。最终被浮士德制服，意识陷入混沌，被浮士德的部下带离。\n-   **陈 (Chen)**: 龙门近卫局特别督察组组长。与诗怀雅搭档指挥龙门围剿行动，展现出高效和对职责的坚持。对贫民区的异常和失踪的线人感到担忧，追查中发现了黑雨披部队的存在。在行动后期，策略性地将黑雨披部队引向雪怪小队，迫使其暴露。活动结束时，通过调查贫民区排水系统发现了黑雨披部队屠杀并清理现场的证据，并以此为引爆点，与魏彦吾激烈对峙，揭露了家族及龙门高层的秘密，表现出强烈的正义感和对龙门的失望。\n-   **诗怀雅 (Swire)**: 龙门近卫局总督察。与陈搭档作战，性格活泼，与陈互动时常有轻松幽默的对话。通过与林雨霞的电话沟通，确认了黑雨披部队的存在及其目的。在陈追查真相时试图阻止她，担心陈会因此陷入危险，展现出对陈的关心和对龙门复杂政治的无奈。\n-   **灰喉 (Greythroat)**: 罗德岛干员，非感染者。活动初期因对感染者的言论被煌误解，但其在保护感染者儿童、面对浮士德时的单纯、以及在最终战中对霜星体温骤降的准确判断和坚守立场，展现出她内心的善良和原则。她经历了对感染者痛苦的直观认知，最终决定留在罗德岛，改变了对感染者的看法。\n-   **九 (Nine)**: 前龙门近卫局成员，贫民区的感染者，曾是陈的线人。在贫民区隐藏时，与一名整合运动成员的对话反映了龙门感染者的困境和对未来的绝望。目睹了黑雨披部队的暴行和雪怪小队的牺牲后，她彻底对龙门失望，决定带着少量整合运动残部离开这座城市，象征着一部分龙门感染者的心碎和出走。\n-   **魏彦吾 (Wei Yenwu)**: 龙门行政长官，实际统治者。作为龙门保卫战的总设计师，其行动被阿米娅和陈认为是将各方（包括罗德岛和整合运动）作为棋子进行布局。活动结束时，阿米娅解除合约表达不满，陈则直接冲入其办公室，揭露了他与塔露拉家族的秘密及对贫民区的残酷手段。他是一个冷酷、务实、将一切掌握在手中的政治家，但其行为也埋下了新的矛盾。\n-   **林雨霞 (Lin Yúxia)**: 贫民区“鼠王”林舸瑞之女。她指挥着名为“黑色雨披”的秘密部队，以冷酷高效的手段在贫民区清剿感染者。在与诗怀雅的电话"
    ],
    "response":"在龙门战役期间，阿米娅与霜星发生了最终决战。阿米娅通过自身能力感受霜星内心的愤怒与痛苦，并以罗德岛为所有人而战的理念回应了霜星的质问。最终霜星被击败，临终前向博士和阿米娅表达了希望罗德岛停止塔露拉的疯狂、拯救感染者同胞的愿望，并安详离世。阿米娅和博士一同见证了霜星的死亡。",
    "reference":"阿米娅通过感知情感，理解了霜星内心深处的痛苦与愤怒，并试图用罗德岛的理念感化她。霜星在濒死之际将希望托付给阿米娅，阿米娅则将一种治疗霜冻的药物命名为霜星以作纪念。",
    "context_precision":0.3666666666,
    "context_recall":1.0,
    "faithfulness":1.0,
    "answer_relevancy":0.6017346748
  },
  {
    "user_input":"明日方舟一共有多少干员？",
    "retrieved_contexts":[
      "# 明日方舟剧情wiki 角色总表\n\n# 干员 (共计:379)\n\n| <br \/>    | <br \/>       | <br \/>     | <br \/>     | <br \/>    |\n| --------- | ------------ | ---------- | ---------- | --------- |\n| Ace       | Alty         | Aya        | D.D.D.     | Dijkstra  |\n| Guard     | Mantra       | Outcast    | Scout      | 阿布纳       |\n| 阿德颂长老     | 阿尔贝塔         | 阿尔贝托·萨卢佐   | 阿发         | 阿格尼尔      |\n| 阿克托斯·佩尔罗契 | 阿勒黛·坎伯兰      | 阿丽娜        | 阿洛伊泽·戈尔奇科娃 | 阿玛雅       |\n| 阿摩斯       | 阿涅塞          | 阿森         | 阿石         | 阿斯帕齐娅     |\n| 阿维图斯      | 阿祥           | 阿雅吉        | 阿雅妮        | 爱德森       |\n| 爱国者       | 埃克提尔尼尔       | 艾莉诺        | 艾琳·亨特      | 艾露猫       |\n| 艾伦戴尔      | 艾玛           | 埃芒加德       | 埃尼斯        | 艾丝塔拉      |\n| 安德烈       | 安东尼奥         | 安多恩        | 安纳斯塔西奥     | 安妮        |\n| 安妮塔       | 安托           | 昂斯特        | 奥比娜        | 奥克芬       |\n| 奥克里       | 奥卢斯          | 奥伦         | 奥罗拉        | 巴顿        |\n| 白垩        | 白垩的爷爷        | 白锦         | 柏生明        | 柏生义冈      |\n| 拜松的管家     | 宝宝           | 贝尔德        | 贝罗尼村长      | 贝纳尔多·贝洛内  |\n| 贝希曼       | 本尼           | 毕德曼        | 毕恩         | 变形者集群     |\n| 变形者王庭信使   | 别格勒          | 伯德         | 博士         | 布莱克       |\n| 布兰都斯      | 布兰特·赖纳       | 查尔斯·林奇     | 沉默的樵夫      | 陈锈清       |\n| 陈昭芊       | 船长阿方索        | 椿          | 大扳手        | 大鲍勃       |\n| 大帝        | 大副           | 大祭司        | 大审判官达里奥    | 大头        |\n| 大嘴莫布      | 黛安           | 黛柯绮·银币     | 丹布朗        | 道尔顿       |\n| 德尔菲娜      | 德鲁奇          | 德米特里       | 迪伦         | 狄洛夫伯爵     |\n| 蒂奇        | 蒂亚戈          | 迪亚兹·冈萨雷斯   | 凋零骑士       | 董阿伯       |\n| 冬灵老人      | 渡魂剑          | 杜玛         | 杜遥夜        | 盾卫        |\n| 朵拉        | 朵拉的父母        | 多利         | 厄尔苏拉       | 法布里齐奥·威尼斯 |\n| 发言人马克维茨   | 发言人恰尔内       | 梵里妮        | 方          | 方小石       |\n| 斐尔迪南      | 费莉亚・拉珀尔塔     | 芬奇·画布      | 拂哀菈        | 腐败骑士      |\n| 福尔图娜      | 弗格瓦尔德        | 弗莱蒙特       | 芙蕾达        | 浮士德       |\n| 甘比诺       | 高多汀公爵        | 高文         | 戈尔丁        | 格哈德·霍夫曼   |\n| 格蕾纳蒂的祖母   | 格蕾塔      ",
      "# 明日方舟剧情wiki 角色总表\n\n# 干员 (共计:379)\n\n| <br \/>    | <br \/>     | <br \/>         | <br \/>    | <br \/>   |\n| --------- | ---------- | -------------- | --------- | -------- |\n| 12F       | CONFESS-47 | Castle-3       | Friston-3 | Lancet-2 |\n| Mechanist | Misery     | Miss.Christine | Mon3tr    | PhonoR-0 |\n| Pith      | Raidian    | Sharp          | Stormeye  | THRM-EX  |\n| Touch     | U-Official | W              | 阿         | 阿兰娜      |\n| 阿罗玛       | 阿米娅        | 阿斯卡纶           | 阿消        | 艾拉       |\n| 埃拉托       | 艾丽妮        | 爱丽丝            | 艾丝黛尔      | 艾雅法拉     |\n| 安比尔       | 安德切尔       | 安洁莉娜           | 安赛尔       | 暗索       |\n| 安哲拉       | 奥达         | 奥斯塔            | 八幡海铃      | 摆渡人      |\n| 柏喙        | 白金         | 白面鸮            | 拜松        | 白铁       |\n| 白雪        | 斑点         | 薄绿             | 暴行        | 暴雨       |\n| 贝洛内       | 贝娜         | 鞭刃             | 冰酿        | 波卜       |\n| 波登可       | 布丁         | 布洛卡            | 裁度        | 苍苔       |\n| 缠丸        | 车尔尼        | 陈              | 骋风        | 澄闪       |\n| 赤冬        | 斥罪         | 仇白             | 初雪        | 刺玫       |\n| 伺夜        | 嵯峨         | 达格达            | 戴菲恩       | 但书       |\n| 导火索       | 德克萨斯       | 蒂比             | 地灵        | 电弧       |\n| 调香师       | 冬时         | 豆苗             | 杜宾        | 杜林       |\n| 渡桥        | 断崖         | 断罪者            | 铎铃        | 多萝西      |\n| 芳汀        | 菲莱         | 菲亚梅塔           | 芬         | 丰川祥子     |\n| 风笛        | 风丸         | 风絮             | 芙兰卡       | 芙蓉       |\n| 复奏        | 格拉尼        | 格劳克斯           | 歌蕾蒂娅      | 格雷伊      |\n| 古米        | 瑰盐         | 傀影             | 哈蒂娅       | 哈洛德      |\n| 海蒂        | 海沫         | 海霓             | 寒檀        | 号角       |\n| 赫德雷       | 褐果         | 赫拉格            | 赫默        | 和弦       |\n| 黑         | 黑键         | 黑角             | 衡沙        | 红        |\n| 吽         | 红豆         | 红隼             | 鸿雪        | 红云       |\n| 华法琳       | 槐琥         | 煌              | 灰毫        | 灰喉       |\n| 灰烬        | 霍尔海雅     ",
      "# 明日方舟剧情wiki 角色总表\n\n# 干员 (共计:379)\n\n| 郑清钺        | 茱安娜       |\n| 主教        | 助理机器人0429    | 逐魇骑士       | 祖拜尔        | 最后的骑士     |\n| 作家        | 左宣辽          | “疤眼”       | “桥夹”克里夫    | “小公爵”     |\n\n## 曾出现在版本一中的角色\n\n### 干员 (共计:36)\n\n| <br \/>      | <br \/>      | <br \/>      | <br \/>      | <br \/>      |\n| ----------- | ----------- | ----------- | ----------- | ----------- |\n| 百炼嘉维尔(v1)   | 承曦格雷伊(v1)   | 纯烬艾雅法拉(v1)  | 淬羽赫默(v1)    | 涤火杰西卡(v1)   |\n| 归溟幽灵鲨(v1)   | 寒芒克洛丝(v1)   | 荒芜拉普兰德(v1)  | 火龙S黑角(v1)   | 假日威龙陈(v1)   |\n| 缄默德克萨斯(v1)  | 莱欧斯(v1)     | 历阵锐枪芬(v1)   | 琳琅诗怀雅(v1)   | 麒麟R夜刀(v1)   |\n| 圣约送葬人(v1)   | 维娜·维多利亚(v1) | 维什戴尔(v1)    | 新约能天使(v1)   | 焰影苇草(v1)    |\n| 炎狱炎熔(v1)    | 耀骑士临光(v1)   | 引星棘刺(v1)    | 预备干员-辅助(v1) | 预备干员-后勤(v1) |\n| 预备干员-近卫(v1) | 预备干员-近战(v1) | 预备干员-狙击(v1) | 预备干员-术师(v1) | 预备干员-特种(v1) |\n| 预备干员-先锋(v1) | 预备干员-医疗(v1) | 预备干员-重装(v1) | 烛煌(v1)      | 濯尘芙蓉(v1)    |\n| 浊心斯卡蒂(v1)   | <br \/>      | <br \/>      | <br \/>      | <br \/>      |\n\n### 其他剧情角色 (共计:81)\n\n| <br \/>              | <br \/>                   | <br \/>                          | <br \/>            | <br \/>           |\n| ------------------- | ------------------------ | ------------------------------- | ----------------- | ---------------- |\n| AUS (群体)(v1)        | Logos(v1)                | Logs(v1)                        | Ms. Christine(v1) | 阿尔贝托(v1)         |\n| 阿尔图罗(v1)            | 阿克托斯(v1)                 | 阿勒黛(v1)                         | 艾尔启(v1)           | 艾莉诺 (Elinor)(v1) |\n| 埃琳娜·乌比卡(v1)         | 艾泽尔(v1)                  | 安麦尔(v1)                         | 奥伦·亚吉奥拉斯(v1)      | 疤眼(v1)           |\n| 保存者(v1)             | 博卓卡斯替(v1)                | 查尔斯·林奇 (Charles Lynch\/蒸汽骑士)(v1) | 大副ガルシア(v1)        | 大审判官(v1)         |\n| 黛安 (Diane Webb)(v1) | 凋零(v1)                   | 杜卡雷(v1)                         | 杜克凯斯特(v1)         | 杜克威灵顿(v1)        |\n| 杜克温德米尔(v1)          | 恩希欧迪斯·希瓦艾什(v1)           | 恩雅·希瓦艾什（圣女）(v1)                 | 发言人莫布(v1)         | 放逐王(v1)          |\n| 斐尔迪南·克鲁尼(v1)        | 弗里斯顿(v1)       ",
      "# 生意场\n\n# 剧情总结\n\n本次明日方舟活动剧情“生意场”围绕着干员可颂的一场小型商业危机展开。故事开始于可颂、能天使和空三位干员的日常对话，揭示了可颂的公司仓库因一次购物节大促销活动而爆满，急需清理积压的旧版美施保养油库存。这批保养油是今年年初的旧款，尽管仍在保质期内且品质不错，但由于美施公司产品更新换代极快（一年推出两个全新版本），以及新款保养油借助著名机修大师李锤锤的联名效应而异常火爆，导致旧款在市场上几乎无人问津，来找可颂的商家也纷纷大幅压价。可颂面临资金周转困难，急需卖掉旧货以购入新款，同时还要偿还向空借的款项。\n\n面对困境，可颂没有放弃。她注意到了车载广播中另一家香氛产品公司“鼻尖芬芳”也在进行清仓大甩卖，由此产生了合作的想法。可颂带着自己的旧版美施保养油样品，前往鼻尖芬芳公司拜访了负责人张先生。张先生同样面临仓库积压旧款香氛产品的烦恼，但对可颂的推销并不感兴趣，因为他认为过时的保养油和香氛捆绑销售不会有市场。\n\n可颂展现了她独到的商业策略。她指出美施保养油气味刺鼻，与鼻尖芬芳的香氛产品搭配使用正好可以改善用户体验。更重要的是，鼻尖芬芳拥有多种香型，这为简单的油+香氛组合带来了丰富的变化。可颂提出可以将包装设计成不写明香型，增加顾客购买时的趣味性和盲盒感。她进一步建议将鼻尖芬芳销量最好的玫瑰香型作为集齐其他香型组合后的赠品或抽奖奖品，巧妙地利用热门产品带动滞销品的销售。为了增加奖品的吸引力，可颂甚至愿意割爱，将自己珍藏已久的大帝签名海报作为一等奖。张先生听后茅塞顿开，对可颂的策略表示赞许，但双方在利润分成问题上未能立刻谈拢，张先生认为自家香氛产品应占大头。\n\n可颂离开鼻尖芬芳后，利用能天使作为临时搭档，上演了一出“好戏”。她在给张先生回电话时，假装有另一家急需大量保养油的机修店采购负责人找上门，并且出了理想的高价。通过虚构的对话和夸张的演技，可颂向张先生营造出旧版保养油并非完全滞销、且有其他买家竞争的假象。张先生信以为真，为了确保合作，主动提出提高可颂这边的利润分成。可颂顺利达成目标，为捆绑销售谈到了更有利的条件。\n\n捆绑销售方案大获成功。在能天使的帮助下，可颂的旧版保养油迅速售罄，只剩下两箱她决定留下自用。这次成功的生意不仅让她赚回了本金，还有盈余用于进购新货和还款。在清理完库存后，可颂和能天使出于好奇，对比研究了旧版和新款美施保养油的成分。结果发现，新款保养油与旧款相比，仅仅是额外添加了一种名为“玫瑰醚”的香味物质。原来，美施公司所谓的技术创新和全新体验，不过是在旧产品中加入了香精，这与可颂之前提出的保养油搭配香氛的思路不谋而合。可颂感到有些沮丧，觉得被美施公司摆了一道，但能天使则认为这恰恰证明了可颂商业眼光的准确性，她的策略甚至走在了大公司前面。\n\n一个月后，美施公司再次推出新款保养油，这次宣传的重点便是个性化定制服务和多种香型搭配，并明确提及与鼻尖芬芳的合作。尽管新款产品再次引发排队抢购热潮，但可颂并没有参与其中。她告诉能天使和空，她已经拒绝了美施提供的特惠购买渠道，并有了全新的销售计划。故事的结尾，可颂推着小车，售卖她亲手制作的脆骨肉丸，原来这就是她的新生意。她从这次经历中学习，不再依赖和囤积大公司的产品，而是开创了属于自己的、更灵活多样的业务，展现了其作为整合运动前干员（虽然剧情未提，但结合人设可知）和企鹅物流成员的独特商业才能和适应性。\n\n## 剧情高光\n\n*   **捆绑销售策略提出**：可颂向张先生提出将各自滞销的旧货捆绑销售：“捆绑销售你我的库存商品。”并阐述了利用香氛弥补保养油气味、通过多样香型增加趣味性的策略。\n*   **大帝海报作为奖品**：为了增加捆绑销售抽奖活动的吸引力，可颂忍痛拿出自己的珍藏：“是大帝先生的签名海报。...呜......没错，是我收藏了很久的宝贝。”\n*   **可颂的假电话谈判**：可颂利用虚构的电话，假装有其他买家高价求购，成功向张先生施压以争取更高的利润分成：“（虚按话筒）什么？！女士您真的要买全部吗？...哎呀，这样真的不好，我都答应和别人的商品捆绑销售了。哎呀，这不是出不出更高价的问题呀！”能天使对此评价：“（这家伙的演技也太纯熟了......）”\n*   **新款保养油的成分揭秘**：可颂和能天使发现美施新款保养油的“创新”仅仅在于添加了香精：“嘶，也没啥变化啊。什么嘛，配料都是一模一样的，广告里说的新成分呢？...玫瑰醚？...所以，所谓的新款保养油就只是多添加了一种香精吗？”\n*   **可颂的新生意亮相**：在一个月后，可颂展现了她已经开启了新的业务：“晚上好啊，诸位，结束了一天的工作，要不要来一份最新口味的脆骨肉丸？”\n\n## 相关信息\n\n*   美施（Meshi）公司产品更新速度极快，一年推出两个全新版本，导致半年前的产品就被视为“旧款”难以",
      "# 泰拉饭\n \n\n\n\n\n## 剧情总结\n故事开篇，莱欧斯小队（包括莱欧斯、玛露西尔、森西和齐尔查克）在试图营救被炎龙吞食的妹妹法琳时，意外被传送到一个陌生且广阔的新世界——泰拉。他们随身物品尽失，身无分文，只能重拾冒险旅途中通过食用魔物来维生的方式。\n\n刚抵达泰拉，他们就遭遇了成群的源石虫和被他们误认为恐怖兽人的大鲍勃。一番混乱和误会解除后，他们发现这里是大鲍勃的源石虫农场。大鲍勃向他们介绍了源石虫这种当地魔物及其食用方法，并教会了森西如何处理和烹饪源石虫。莱欧斯小队品尝了辣炒源石虫和源石虫啤酒等当地特色美食，并对源石虫作为食材产生了新的认识。大鲍勃得知他们的困境后，向他们推荐了罗德岛，一个据说能帮助他们回家的地方，并赠予他们一本记录了泰拉可食用魔物的《鲍勃的美食指南》。\n\n按照大鲍勃的指引，小队继续前进，途中进入萨米地区的一片黑森林。他们希望找到萨米部族中的雪祀（萨满）占卜回家的方法。玛露西尔误食了当地的有毒果子，产生了将队友视为炎龙的幻觉。在萨米人（阿达克利斯族群）的帮助下，他们得知只有神秘的大祭司能解毒。为了引出大祭司，森西决定制作一顿丰盛的饭菜。意外的是，森西选中的主菜——一只蓝色肥鸟——竟然就是大祭司本人，他正在汤锅里享受药浴。大祭司虽然被打扰，但还是让玛露西尔喝下汤解毒。解毒后的玛露西尔感到无比嫌弃。大祭司再次给出模糊的指引，让他们继续向北寻找罗德岛。\n\n为了寻找交通工具，小队来到一处废弃工厂，遇到了即将散伙的工人和厂主。工人希望能吃到传统的“黄金萝卜”，这需要一种名为“赤金源石虫”分泌的金色物质。莱欧斯小队决定帮忙寻找。在矿洞中，他们遭遇了酸液源石虫。玛露西尔用她的D32钢手电筒（由厂主赠送的当地魔法器具）施展闪光魔法，意外地让酸液源石虫的黏液变成了可食用的金色物质。森西利用这种材料和当地萝卜，为工人们制作了美味的黄金萝卜料理，满足了他们的愿望。厂主因此深受感动，同意免费载他们一程，帮助他们在雷姆必拓区域内移动。\n\n在萨米黑森林深处，他们继续向北探索，寻找独眼巨人。萨满学徒橡杯通过密文板（萨米的意志的载体）解读出指引：向北方寻找“隐者”，即独眼巨人。齐尔查克对此表示怀疑。他们遭遇了一只受到邪魔污染的角兽，在战斗中齐尔查克不慎坠崖。坠崖的齐尔查克被独眼巨人艾尔启所救，艾尔启能看到未来的厄运，并警告他有关邪魔的可怕。同时，莱欧斯、玛露西尔和森西遇到了罗德岛干员刻俄柏，她得知他们在找罗德岛后表示愿意帮忙（前提是喂饱她）。他们在刻俄柏的指引下找到了那只已死的邪魔角兽，并决定将其烤食，希望获得启示。齐尔查克赶到时，看到他的队友们吃下被污染的肉后，面部被虚空覆盖，言语变得断断续续，却执意向北边寻找一个“门”回家。惊慌的齐尔查克和刻俄柏一起追赶失控的队友。\n\n在追赶过程中，他们误入了一个奇特的绘画世界（婆山镇），由神秘女子黎和墨魉居住。在这个世界里，他们的记忆和目的逐渐模糊，开始适应并融入镇子的生活，每日与不断出现的墨魉战斗。莱欧斯对墨魉产生了浓厚的兴趣，通过观察和投喂水果，他发现墨魉会根据食用的水果种类排出不同的液体（果汁、果酱、果酒），且它们没有完整的生态系统，似乎是“假”的生物。黎向莱欧斯印证了这里是一个画中世界。画作的创作者夕出现，对画作的混乱感到不满，将小队从画中驱逐出去。\n\n小队被抛到泰拉的海岸边，靠近一座名为盐风城的城市。这座城市受到深海教会的影响，居民们变得麻木不仁，食不果腹。森西心生怜悯，希望能为他们做一顿像样的饭。一位自称教士的人出现，声称能指引他们找到食物。齐尔查克察觉到不对劲，但莱欧斯认为跟着他能了解这座城市的异常。他们被指引到一处溶洞，发现了巨大的死亡海嗣（类似克拉肯）和伴生的活体海嗣生物。在莱欧斯点燃“海草”引出生物后，他们猎取了一些海嗣。齐尔查克在洞口利用自己发现的一个宝箱怪陷阱制服了试图加害他们的教士（深海教会成员）。他们利用海嗣、海草以及在洞穴中发现的“应急理智顶液”（罗德岛出品的物品），在海滩上制作了各种海鲜料理，并尝试分享给盐风城的居民，然而居民们却因此受到了惊吓。\n\n继续旅程，他们遇到一群失控的无人机攻击，随后卷入了拓荒者与无人机、钳兽群之间的混战。罗德岛干员瑞恩恰好前来回访并寻找刻俄柏，试图平息事态。在共同对抗钳兽群后，误会解除，他们坐在一起分享烤钳兽肉。瑞恩解释了无人机失控的原因。为了解决无人机，玛露西尔利用钳兽肉和使魔制作了一个酷似莱欧斯的使魔，将其引向拓荒者的玉米地。无人机在追赶使魔时爆炸，将玉米地变成了爆米花。刻俄柏被爆米花吸引出现，并被瑞恩找到。拓荒者告诉小队罗德岛就在附近。\n\n终于，小队抵达了罗德岛这艘巨大的陆上舰船。他们遇到了泥岩，她听闻了大鲍勃关于他们的故事。正当他们准备进入时，他们被某种力量转移到罗德岛内部，并在奇异的环境中遇到了独眼巨人艾尔启，他再次发出关于未来危险"
    ],
    "response":"根据检索到的文档，明日方舟共有379名干员。",
    "reference":"明日方舟剧情wiki角色总表中列出干员共计379位。",
    "context_precision":1.0,
    "context_recall":1.0,
    "faithfulness":1.0,
    "answer_relevancy":0.4420372346
  },
  {
    "user_input":"特蕾西娅和阿米娅是什么关系？",
    "retrieved_contexts":[
      "# 同行人\n\n# 剧情总结\n\n本次“同行人”活动的剧情分为两个时间段：1072年秋的闪回和1094年秋的现在时。\n\n1072年的剧情是一段发生在卡兹戴尔的闪回。主角是萨卡兹刺客阿斯卡纶，她正在和她的老师——萨卡兹摄政王特雷西斯进行一场训练。这场训练同时也是一次实战演习，阿斯卡纶多次尝试刺杀特雷西斯，但都未能成功，尽管她巧妙地利用环境和时机接近了他，甚至用一把曾被特雷西斯斩断的断剑割断了他胸前的绑带。训练结束后，阿斯卡纶向特雷西斯提起了近期巴别塔内部发生的一系列针对成员的袭击事件，特别是有人蓄意在特蕾西娅殿下附近投放源石粉尘。阿斯卡纶怀疑这些事件并非意外，并且质问特雷西斯作为军事委员会的一员，是否无法保护特蕾西娅和巴别塔，或者更进一步，是在纵容这些行为。特雷西斯坚称自己知道什么对萨卡兹更好，并承诺如果有人对特蕾西娅动手，他会出手。但当阿斯卡纶进一步追问“如果其他人都架着你，逼你对她动手，你会出手吗？”时，特雷西斯陷入沉默。这场沉默让两人心中都得到了答案。阿斯卡纶意识到特雷西斯在忠诚与萨卡兹整体利益（或者说是军事委员会的路线）之间存在冲突，她决定这是她从特雷西斯这里学习的“最后一课”。从明天起，她将离开特雷西斯身边，亲自前往特蕾西娅殿下那里守护她，并承诺会带着特雷西斯“本应有的心意”一起守护。特雷西斯看着她离开，感叹她选择的只是某个人而非那个人脚下的道路，并预言她将难以承受失去同行人的痛苦。这段闪回揭示了阿斯卡纶、特雷西斯和特蕾西娅之间复杂的忠诚关系以及巴别塔内部在特蕾西娅遇刺前的暗流涌动。\n\n1094年的剧情发生在特蕾西娅遇刺后，卡兹戴尔北部的荒野。罗德岛的舰船正在通过这片区域，一群不再与罗德岛同行的萨卡兹前巴别塔成员在这里设下了埋伏，意图炸毁航道，截停罗德岛。阿斯卡纶独自追查到了他们。她找到了其中一个名叫细盐的萨卡兹，他是阿斯卡纶以前的学徒，负责看守并引爆炸药。细盐认出了阿斯卡纶，并显得有些无奈但并不意外。他坦承自己和这伙人是在特蕾西娅遇刺后，对罗德岛失去了信心，认为罗德岛（即原巴别塔）已经放弃了为特蕾西娅复仇和夺回卡兹戴尔的任务，甚至打算放弃“巴别塔”这个名字。他认为罗德岛船上的萨卡兹已经不再代表他们的利益，而他们的目标是夺回属于萨卡兹、属于卡兹戴尔的东西，并且明确表示他们的目标是阿米娅——他们口中的“新的魔王”。阿斯卡纶对细盐的行为表示失望，认为他选择了错误的道路，并且不应该知晓阿米娅的身份。细盐辩解说，特蕾西娅遇刺时他们正在执行其他任务，赶回来时能做的只剩下和阿斯卡纶一起清洗叛徒。他认为参与刺杀的巴别塔成员已经被他们清理干净，但那些不屑于罗德岛现状的人，包括他自己，选择离开了。他质问阿斯卡纶，到底谁才是叛徒，并认为作为离特蕾西娅最近的人，阿斯卡纶应该带领他们做这些事，而不是阻止他们。\n\n阿斯卡纶没有多余的言语，直接用袖刃刺穿了细盐的胸口。她确认了他们的目标是阿米娅，并强调这是特蕾西娅殿下自有安排的事情，不该被他们提及。细盐在生命的最后挣扎着表达自己的想法，他说自己当年追随巴别塔只是希望能让萨卡兹的日子过得更好，相信特蕾西娅指引的道路。但他认为特蕾西娅死后，阿斯卡纶和其他人一样迷失了方向，甚至“疯了”。阿斯卡纶追问还有多少人知道阿米娅的事情，细盐告诉她已经晚了，即使杀了他，也阻止不了这场行动。阿斯卡纶立刻意识到细盐只是诱饵，还有另一支队伍在执行同样的行动。她不再隐藏力量，使用她的源石技艺，一股薄幕般的烟雾从她体内逸出，扑灭了细盐身边的火堆，融入夜色。细盐在临死前感受到阿斯卡纶的手在颤抖，身体似乎在“坍塌”，并看到了她痛苦的表情，这是他从未见过的。\n\n阿斯卡纶成功地清理了所有参与这次行动的袭击者，共一百三十四人，并带回了他们的巴别塔袖标。行动结束后，她向凯尔希报告。凯尔希指出阿斯卡纶伤得很重，源石技艺几乎是自伤，情绪状态不稳。她接过染血的袖标，确认参与刺杀的叛徒和不该知晓阿米娅身份的人已被清除。凯尔希告知阿斯卡纶，特蕾西娅的尸体和刺杀事件与赦罪师有关，罗德岛不会放弃追查。关于特雷西斯，凯尔希表示罗德岛不再是萨卡兹流亡政府，不具备与军事委员会对抗的能力，特雷西斯将是少数人需要面对的问题或心结。至于博士，凯尔希认为特蕾西娅在最后关头保护了博士，目前将博士送往乌萨斯是最合适的做法，尽管阿斯卡纶对此仍有怀疑。最后，凯尔希向阿斯卡纶说明召回她的目的：罗德岛需要成立一个完全独立运作的机密组织，命名为“S.W.E.E.P.”（特别清除协议），负责阻止针对罗德岛的渗透、暗杀和破坏，以及执行隐秘行动。凯尔希邀请阿斯卡纶担任S.W.E.E.P.的主管。阿斯卡纶认为这是让她为未能守护特蕾西娅赎罪，但凯尔希否认了这一点，表示这只是因为阿斯卡纶是最佳人选，并且罗德岛不能重蹈巴别塔的覆辙。凯尔希让阿斯卡纶不必立刻回答，并请求她在回复前去见见阿米娅，暗示",
      "# 慈悲灯塔\n\n# 剧情总结\n\n“慈悲灯塔”活动剧情发生在整合运动和卡兹戴尔军事委员会在伦蒂尼姆的战争背景下。罗德岛、典范军、萨卡兹各王庭以及维多利亚各公爵势力等多方卷入其中，核心冲突围绕萨卡兹摄政王特雷西斯企图通过“阿喃那”（被认为是最初的源石）实现萨卡兹命运的计划。\n\n故事始于阿米娅与特蕾西娅的回忆对话，预示着特蕾西娅对巴别塔和罗德岛未来的期望。当前时间线中，典范军与罗德岛利用萨卡兹“生命脊椎”（一具能进行时空跳跃的巨兽骸骨）作为据点，计划突袭军事委员会位于碎片大厦的指挥部。然而，萨卡兹赦罪师首领奎萨图什塔利用血魔大君杜卡雷死亡后遗留的“提卡兹之血”和战场上的战争法阵，成功唤醒了与源石根源相关的“阿喃那”，导致红色阴云笼罩战场，“生命脊椎”失控坠落，落在伦蒂尼姆郊外的一处峡谷。\n\n萨卡兹军事委员会由曼弗雷德将军率领，他试图夺回或摧毁“生命脊椎”，以防止其落入敌手。罗德岛和典范军决定分头行动：推进之王、号角等典范军成员前往银石崖前线，计划与维多利亚公爵联军合作，激活“诸王之息”（维多利亚象征王权和能抑制天灾的圣剑）来抑制“阿喃那”造成的地形和环境巨变；阿米娅、博士、凯尔希、Logos则组成小队，深入战场腹地，寻找并摧毁“提卡兹之血”和奎萨图什塔的祭坛，以从根源上阻止“阿喃那”的完全降临。W、赫德雷、伊内丝、阿斯卡纶等人留守“生命脊椎”，牵制曼弗雷德的部队。\n\n前往阻止“阿喃那”的小队在战场上遭遇萨卡兹的“灵幛”和由变形者集群模仿的死者。阿米娅的“魔王”力量与源石环境共鸣，Logos作为女妖族长展现出强大的咒术能力。他们还遇到受血魔影响的普通萨卡兹（玛瑞拉等人），阿米娅展现出仁慈和包容，收留了他们。Logos通过杜卡雷遗留的线索定位到赦罪师祭坛的位置。\n\n留守的W在寻找失踪佣兵时，意外闯入赦罪师的古老遗迹，遇到喀利喀，并从其口中得知特蕾西娅被“复活”以及赦罪师与“阿喃那”的关联。曼弗雷德的部队逼近“生命脊椎”，赫德雷和伊内丝设法拖延。阿斯卡纶试图刺杀曼弗雷德，二人双双在时空乱流中消失。曼弗雷德找到了赫德雷，并对其痛下杀手，赫德雷重伤。\n\n推进之王带领典范军抵达前线，见证了维多利亚联军在源石影响下损失惨重。开斯特公爵和高多汀公爵先后与典范军接触，试图拉拢。深池首领爱布拉娜带领部队加入战斗，攻击食腐者祭坛，展现德拉克王庭的强大。威灵顿公爵驾驶旗舰“加斯特里尔”号与食腐者之王孽茨雷交战，双方势均力敌。开斯特旗舰“荣光”号被“阿喃那”引发的源石浪潮摧毁。推进之王决定冒死将“诸王之息”送往“荣光”号上仅存的剑座，在蒸汽骑士查尔斯和“灰礼帽”的协助下，她成功激活国剑，暂时抑制了战场上的源石风暴，极大地提升了维多利亚联军的士气，并使得联军能够展开反攻。\n\n前往阻止“阿喃那”的小队来到祭坛，遭遇萨卢斯和由萨卡兹血脉融合而成的奇美拉。闪灵和玛嘉烈赶到并加入战斗，揭露了赦罪师利用萨卡兹血脉进行残忍实验的事实。使徒小队与赦罪师首领奎萨图什塔对决，夜莺为保护闪灵和玛嘉烈，不惜灵魂受损，帮助她们击退奎萨图什塔，但奎萨图什塔被喀利喀救走。萨卢斯则在祭坛中心牺牲自己，将“提卡兹之血”彻底“沸腾”，导致“阿喃那”完全降临于碎片大厦顶端。\n\nLogos独自留下，对抗众魂和食腐者之王孽茨雷，以咒术（包括特雷西斯的剑术）重创孽茨雷，自己也坠崖，但被女妖王庭的秘密装置救下。他用咒术回应众魂，暂时抑制了他们的意志。\n\n“生命脊椎”在阿米娅等人靠近“阿喃那”时重新启动，W和伊内丝设法驾驶它。阿米娅通过通讯（尽管断断续续）指引“生命脊椎”前来会合。在飞空艇即将撞上“阿喃那”时，W和博士等人决定跳帮阻止飞空艇。登舰后，他们被死魂灵的力量打散。W和博士一组，遭遇模仿当年刺杀特蕾西娅刺客的“幽灵”，博士利用飞空艇自身的结晶化配合W的炸弹突破封锁，找到了死魂灵的核心。阿米娅独自击败过去的巴别塔“幽灵”后赶到，凯尔希也脱困会合。阿米娅与死魂灵对决，看到了其作为卡兹戴尔护卫和魂灵熔炉一部分的悲伤一生。W成功拆下死魂灵核心，飞空艇失去动力，死魂灵却获得解放，全力攻击。\n\n关键时刻，特蕾西娅出现，救下死魂灵，并将其带入源石的内化宇宙。飞空艇撞上“阿喃那”，博士和阿米娅被卷入源石内部。\n\n在源石内化宇宙中，博士在罗德岛舰船上醒来，舰船因博士而存在。博士见到了普瑞赛斯，了解到源石、内化宇宙和自己过去的关联，并拒绝留在源石根据其意愿构建的美好幻象中。博士与凯尔希重聚，看到罗德岛已逝\/离去的成员（Ace、霜星、塔露拉等）在幻象中美好地生活。阿米娅在幻象中获得特蕾西娅意志的指引，并找到博士和凯尔希。Logos和W（维什戴尔）也在源石中出现。\n\n众人决定前往源石内化宇宙中的巨塔（象征巴别塔），推测特蕾西娅就在塔顶。Logos留下对抗萨卡兹众魂，罗德岛舰船在博士意念下航行。众人攀登巨塔，在塔顶见到被救",
      "# 阿米娅\n\n# 详细介绍\n\n阿米娅是泰拉大地上，罗德岛制药公司的公开领袖，一位年轻的卡特斯少女，却肩负着改变世界命运的重担。她身患矿石病，并继承了萨卡兹“魔王”的王冠与力量，致力于为感染者和所有受压迫者寻找一条通往希望的道路。\n\n**失落的童年与重获新生**\n阿米娅的童年始于雷姆必拓。在一次突如其来的车祸中，她失去了双亲，自己也染上了矿石病。在绝望与荒芜中，年幼的她被当时失忆前的博士偶然救起。博士不仅将她带离险境，更向她承诺会治愈她的疾病，为她带来一个充满希望的未来。这段经历是阿米娅生命的“最初坐标”，奠定了她对博士无与伦比的信任与依赖，她曾对博士说：“博士在哪，我就在哪。”（出自活动剧情“巴别塔”\/“悠长的旅途”）。\n随后，博士带着阿米娅抵达了巴别塔。在那里，她遇到了巴别塔的领袖、萨卡兹“魔王”特蕾西娅，以及资深医生凯尔希。特蕾西娅对阿米娅展现出如同母亲般的关爱与温柔，陪伴她，为她讲故事，并让巴别塔成为了阿米娅的新家。凯尔希则开始为阿米娅的矿石病制定治疗方案。在这段时期，阿米娅敏感地察觉到博士因过度劳累而变得不开心，担忧是自己的病情让他感到低落。\n\n**“魔王”的传承与觉醒**\n巴别塔与军事委员会的内战期间，特蕾西娅为了保护阿米娅，在遇刺的最后时刻，将象征着“黑王冠”和“文明的存续”的力量传承给了阿米娅，希望她能改写萨卡兹的悲惨结局，带领巴别塔走向未来。特蕾西娅的意识也短暂寄宿在阿米娅体内，向凯尔希传达了最后的嘱托。这一刻，年幼的阿米娅被赋予了沉重的“魔王”宿命。\n继承力量初期，阿米娅的精神状态曾一度棘手，会出现呓语、非自发读取他人情绪以及对力量控制不稳的情况，手上的戒指也成为抑制这份强大力量的“枷锁”。凯尔希和华法琳等罗德岛的医生们为此付出了巨大努力。\n\n**唤醒博士与切尔诺伯格的战火**\n在特蕾西娅遇刺后，博士进入了长达三年的休眠。阿米娅与凯尔希接管巴别塔，将其改组为罗德岛制药公司。三年后，阿米娅亲自带领小队深入乌萨斯城市切尔诺伯格，唤醒了失忆的博士。面对博士记忆的缺失，阿米娅坚定地自我介绍，强调博士是她“最重要的同伴”，并毫不犹豫地将罗德岛的指挥权托付给他，展现了她对博士无条件的信任。\n切尔诺伯格被整合运动攻占，罗德岛在撤离过程中，阿米娅目睹了整合运动的暴行，也亲历了平民对感染者的恐惧。她向博士解释矿石病的残酷，以及罗德岛为感染者争取生机的使命。她坚定地表示罗德岛的宗旨是“希望各位，都能绽放笑容”，并希望罗德岛能成为感染者的“温暖的家”。\n在龙门贫民区，阿米娅为保护博士，首次爆发力量击倒了整合运动的“碎骨”。然而，这让她陷入深深的自责与痛苦，质疑自己作为感染者领袖，却不得不夺走其他感染者生命的矛盾。她向博士倾诉内心的挣扎，但最终重申了保护博士的决心。米莎的死，以及她最终选择站到整合运动一边，让阿米娅对仇恨的循环有了更深刻的理解与悲哀。在与碎骨的第二次对决后，阿米娅收下了他的面具，象征着背负这份痛苦继续前行。\n在与整合运动领袖塔露拉的最终对决中，阿米娅通过与陈晖洁的情感共鸣，解开一枚戒指的束缚，觉醒了“近卫”形态的力量——“云裂之剑-影霄”。她直面“不死的黑蛇”科西切对塔露拉的操控，揭露其谎言，最终成功唤醒了塔露拉本身的意志，帮助她摆脱了诅咒。战后，阿米娅因巨大压力和情绪释放而昏倒，凯尔希抽取博士的血液制造药物并为他注射，醒来后她流下了久违的眼泪，并命名了一种治疗霜冻的药物为“霜星”，以纪念那些牺牲的战士。她向博士重申，无论未来多艰难，罗德岛都会前行，如果博士有一天误入歧途，她将是唯一能阻止他的人。\n\n**维多利亚的战火与“魔王”之路的抉择**\n随着罗德岛前往维多利亚伦蒂尼姆，阿米娅的“魔王”身份和力量得到了更深层的展现与考验。她能感知到伦蒂尼姆中心盘桓的“更古老的......更强大的力量”，以及萨卡兹万年来的悲愤与仇恨。在与血魔大君的交锋中，她被萨卡兹众魂的集体记忆冲击，亲身感受了萨卡兹历史上的苦难与对凯尔希的复仇渴望，痛苦不堪，但她拒绝被仇恨吞噬，坚称“戒指不行，我可以。我不是器具。”（出自慈悲灯塔 \/ 应对饱和打击）\n在“惊霆无声”活动中，阿米娅梦见了萨卡兹掌控下维多利亚的悲惨未来，这让她对“魔王”的使命感到迷茫。她被“灰礼帽”确认为“魔王”，并被死魂灵质疑其作为“异族魔王”的资格。但阿米娅选择直面所有苦难，坚定地拒绝了死魂灵所代表的永恒仇恨之路，她的这种“能拒绝”仇恨的特质，被博士肯定为她作为“魔王”的独特与必要之处。\n在“破碎日冕”中，阿米娅在列车上意外亲眼见到了活着的、白发萨卡兹形态的特蕾西娅。这一幕给她带来了前所未有的震惊与悲哀，让她坚定了追寻真相的决心：“既然我来到了这里，那我就需要弄清楚真相。”（出自破碎日冕\/理想的倒影）\n最终，在“慈悲灯塔”活动中，阿米娅与博士、凯尔希、W等深入“阿喃那”内部形成的",
      "# 特蕾西娅\n\n# 详细介绍\n\n特蕾西娅，卡兹戴尔的“魔王”，巴别塔组织的创立者和最高领袖，一位致力于为萨卡兹和泰拉所有生灵寻找和平与希望的领袖。她的一生与牺牲，深刻塑造了罗德岛的现在与未来。\n\n**巴别塔的创立与早期理想 (约1030年-1086年)**\n特蕾西娅约1030年与兄长特雷西斯共同创立了卡兹戴尔“军事委员会”。然而，她的理想远不止于此，她怀揣着建立一个名为“巴别塔”的超脱种族与国家边界的组织，旨在解决萨卡兹的匮乏与疾病，并最终让泰拉所有种族站在一起。她向包括女妖菈玛莲、食腐者孽茨雷和血魔杜卡雷在内的各王庭主宰阐述了这一愿景，赢得了部分支持。\n在这一时期，特蕾西娅展现了极大的仁慈与远见。她与凯尔希合作运作巴别塔，救助感染者“好运”，对萨科塔信使充满好奇。她亲自招募了可露希尔担任巴别塔的总工程师，看中她“突破传统枷锁”的才能。她也对赫德雷、伊内丝、W等雇佣兵产生了深远影响，W更是被她的真诚与悲悯所触动。她将从雷姆必拓深处挖掘出的舰船命名为“罗德岛”，希望能将其打造成一个温暖的家园。\n约1068年，特蕾西娅与特雷西斯并肩带领萨卡兹人民穿过天灾，进入移动城市。她通过温柔的教导，试图引导被特雷西斯收养的阿斯卡纶理解非暴力的解决之道。然而，巴别塔在卡兹戴尔城内的建设也遭遇排斥与不信任，导致部分老师离开。特蕾西娅对那些选择追随特雷西斯、前往伦蒂尼姆的萨卡兹佣兵，虽然悲伤却仍送出祝福，坚信萨卡兹“仍共用同一心脏，同一血脉”，终将再次合流。她曾对部下马尔科的背叛感到悲伤，并感慨萨卡兹“道路还很遥远”，但也体现出她对和平的渴望与对信任的珍视。她还资助患有矿石病母亲的孤儿瑞卡，赢得了Scout的忠诚。在巴别塔时期，她作为“议长”也曾接收Mantra的报告，强调巴别塔的使命是“聆听与分辨”世间无处不在的“呼救的喊声”，并希望成员将巴别塔当作自己的家。\n\n**唤醒博士与希望的火种 (约1090年)**\n约1090年，在罗德岛舰上，特蕾西娅与凯尔希合作唤醒了沉睡已久的博士。她向刚苏醒的博士展示泰拉大地上生命和文明的多元与活力，以及萨卡兹人民在苦难中寻求希望的精神。她向博士提出了解决矿石病、天灾和泰拉起源等问题的期盼，并展示了她对源石研究的“希望”——一朵由源石转化而成的纯白花朵，象征着源石治愈而非毁灭的可能性。她感知到博士热爱这片大地，超越了单一的个体或族群。在博士深入研究并尝试用自身做实验时，特蕾西娅通过“文明的存续”感知到了博士记忆中源石“同化大地”的恐怖未来，以及博士内心深处的痛苦、犹豫与恐惧。她也由此意识到博士的身份非同寻常，并与凯尔希讨论了“扭转结果”的可能性。她也曾预言般地告诫博士，怀揣希望是残酷之事，若继续如此，他将“失去一切，孑然一身，一无所有”。\n\n**最终的牺牲与传承 (约1093年末-1094年初)**\n约1093年末至1094年初，萨卡兹内战进入白热化阶段。特蕾西娅与特雷西斯在理念上的分歧达到顶点。博士在此期间，为了完成自己更古老的“源石计划”使命，并避免更彻底的宇宙毁灭，选择了“背叛”特蕾西娅，与特雷西斯秘密会面，提出“摧毁巴别塔”的计划。这一计划旨在通过牺牲巴别塔，迫使特蕾西娅加入特雷西斯的源石腐化大地计划，从而避免源石失控带来的更彻底的宇宙毁灭。\n在巴别塔夺取卡兹戴尔的战役接近尾声时，本舰防御被解除，特雷西斯派出的刺客长驱直入。特蕾西娅为了保护阿米娅，将她隔绝在黑色泡泡中，独自面对刺客的围攻。她认出了每一位刺客，记住他们的英勇与牺牲，即便他们是来杀死自己的。在生命的最后时刻，身负重伤的特蕾西娅将“文明的存续”（黑王冠）赋予了阿米娅，希望她能“改写结局”。她与赶来的博士进行了最后一次对话，理解博士的“背叛”是基于更宏大的使命，但也看到了博士的“真心与纯洁”。最终，特蕾西娅选择抹除了博士的记忆，在博士的记忆深处与被称为“预言家”的博士的过去意识告别，并留下“去找到你自己吧”的赠言。她希望博士能以“最本来的面目”在大地上重新生活，找到属于自己的答案。\n特蕾西娅的意识最终寄存在王冠中，通过阿米娅向赶到的凯尔希阐述了她最后的理想：“魔王不是枷锁，不是统御，也不是无可匹敌的力量。魔王是钥匙，是......‘文明的存续’。”她将阻止特雷西斯、守护阿米娅和巴别塔的未来托付给了凯尔希。\n\n**“魔王”程序与持续影响 (特蕾西娅死后至今)**\n特蕾西娅逝世后，她留在“文明的存续”中的一段程序以“魔王”的形象显现，成为罗德岛阿米娅力量“魔王王冠”的源头和精神指引。这段程序因阿米娅的情感而显现，拥有保护阿米娅的力量，能够阅览“文明的存续”中存储的一切信息。她陪伴在阿米娅身边，给予她精神慰藉与指引，帮助阿米娅理解别离与未来，并肯定阿米娅作为“未来”的重要性。\n她也与凯尔希有多次隐晦的对话，凯尔希向她寻求帮助，并共同设计了思维稳定度检测仪",
      "# 你与时间同长\n\n# 剧情总结\n\n《你与时间同长》的剧情通过一场深刻而富有象征意义的梦境，细腻地描绘了阿米娅在面对失去、悲伤和责任时的内心挣扎与成长。整个故事以阿米娅的梦境开篇，似乎是由某种罗德岛的技术设备（“与节点[DWDB-221E]建立交叉验证连接”等初始信息暗示）所诱导或记录的。这场梦境是阿米娅处理内心深处情感，尤其是关于重要人物逝去的哀悼过程的具象化。\n\n梦境的开端，阿米娅在一个初夏的原野上醒来，身边是一个“孩子”（象征着她纯真、渴望被唤醒的内心或她过去的某个形象）。这个孩子提醒阿米娅，她“弄丢了”重要的同伴，并催促她去寻找，指引她前往一座巨大的山。阿米娅的困惑和急切，揭示了她内心深处对失去的感知以及寻找答案的强烈愿望。与此同时，一个“影子”默默地跟随着阿米娅，她知晓阿米娅的痛苦，但出于某种“约定”，她不会主动现身，只能远远地观察。这“影子”的角色，从一开始就预示着一位对阿米娅而言至关重要、且与其有着深厚情感羁绊的人物。\n\n阿米娅抵达山顶，却一无所获。她发现自己口袋里有一封来自“他们”的信，但信纸被水浸泡得模糊不清。此时，一只“云兽”（其分析式的对话和对阿米娅“机能紊乱”的判断，强烈暗示其为凯尔希的梦境化身）出现。云兽以一种冷静而理性的方式指出阿米娅“渗水”的脸庞并非正常布人所为，并建议她去寻找“魔术师”来“修好”自己，以便阅读信件。阿米娅将自己的泪水误解为“损坏”而非情感流露，这反映了她作为罗德岛领袖，长期以来压抑个人情感，将悲伤视为“故障”的倾向。云兽的建议，虽然看似机械，实则是将阿米娅导向一个处理情感的关键环节。\n\n在云兽的指引下，阿米娅跃下悬崖，在空中寻找“魔术师”。她最终在星云之间找到了这位“魔术师”（其温暖、理解的态度和后续互动，明确了其为特蕾西娅的梦境化身）。阿米娅焦急地请求魔术师“修好”自己，止住脸上的“渗水”，好让她能看清信件。然而，魔术师温柔地纠正了阿米娅的认知，告诉她“你没有坏，你只是在流泪”，并强调流泪是每个人都可以拥有的正常情感，心若干枯便无法容纳重要的人。这番话语直抵阿米娅内心深处，是对她长期以来压抑情感的直接回应和宽慰。魔术师随后运用“火烧云”的力量烘干了信件。在魔术师施法过程中，阿米娅注意到魔术师脸上也有“亮晶晶”的东西，恍然大悟：魔术师也和她一样，在为“他们”流泪。这种共情瞬间击溃了阿米娅内心的防线，她深感愧疚，认为自己只顾着倾诉自己的苦恼，却忽略了魔术师同样沉重的悲伤。\n\n巨大的愧疚感将阿米娅包裹在一个“气泡”中，使她与魔术师渐行渐远。这个“气泡”象征着阿米娅在面对自我情感和他人痛苦交织时，所产生的自我封闭和隔离。当气泡飘向沙漠时，“影子”再次出现，她与魔术师在遥远的天空中交换了一个理解的眼神，显示她们之间存在某种心照不宣的联系和约定。阿米娅被气泡带到了无垠的沙漠，气泡破裂后，她读到了信件——上面没有指明去向，只有“许多嘱托，许多告别”。这意味着她所寻找的“他们”已经离去，她的任务不再是找到他们，而是接受他们的离去，并承担起他们留下的责任与期望。\n\n在炙热而漫无边际的沙漠中，阿米娅独自跋涉，精疲力尽，却固执地拒绝停下。她感到自己不能陷在悲伤中，必须“靠自己走出去”，因为“还有很多人需要我”。沙漠的景象和阿米娅的挣扎，象征着她背负着罗德岛未来的重担，以及在个人悲痛与集体责任之间无休止的煎熬。她认为自己不能脆弱，不能依赖，必须坚强。而“影子”一直在远处观察着阿米娅，看到她近乎崩溃却仍不放弃的毅力，终于决定打破“约定”。\n\n“影子”在阿米娅前方制造了一片“绿洲”。阿米娅最初将其视为幻景，试图避开，但绿洲却像有生命般“跑”到她面前，迫使她面对。这一超现实的互动，是“影子”打破沉默、主动干预的标志。阿米娅终于第一次回头，呼唤道：“是您吗？”“影子”随之显现，是阿米娅记忆中那带着恬然笑容的“特蕾西娅小姐”。\n\n这一刻，情感的闸门彻底打开。阿米娅扑进特蕾西娅的怀抱，泪流满面地倾诉多年来的痛苦、无助、未能阻止悲剧的自责，以及在重重责任下，即便自己痛苦也无法允许自己依赖他人的矛盾。她认为自己“不该依偎在影子的膝头”，因为她已长大，是大家的依靠。特蕾西娅则以无比温柔的姿态回应，轻拍着阿米娅，告诉她：“不是什么事情都能够挽回。‘肩负’……也意味着接受无可挽回之事。”她理解阿米娅的伤心和想要做些什么的心情，但更心疼阿米娅所承受的一切。特蕾西娅坚定地告诉阿米娅，她“永远不会伤害我。永远不必向我道歉”，并强调“我知道你在长大，这没关系，这很好。我一直都在的。”这番话语，是特蕾西娅对阿米娅最深沉的爱与支持，不仅解开了阿米娅的愧疚与自责，也让她意识到，成长并不意味着必须独自承受所有，而是在承担责任的同时，也能接受被爱与被支持。\n\n特蕾西娅在阿米娅额头留下一个吻后隐去，黄沙消散，只留下青碧的湖水和湿润的风。阿米娅"
    ],
    "response":"根据文档3和文档4的描述，特蕾西娅对阿米娅展现出如同母亲般的关爱与温柔，陪伴她、为她讲故事，并让巴别塔成为阿米娅的新家。在遇刺的最后时刻，特蕾西娅将象征着“黑王冠”和“文明的存续”的力量传承给了阿米娅，希望她能改写萨卡兹的悲惨结局。因此，她们的关系是类似母亲与女儿般的深厚情感纽带，同时特蕾西娅也是阿米娅力量与使命的传承者。",
    "reference":"特蕾西娅是前任魔王，巴别塔的领袖，阿米娅力量与意志的来源。她如慈母般关爱幼年阿米娅，并在遇刺前将黑王冠和文明的存续力量传承给阿米娅，希望她改写宿命。",
    "context_precision":0.6791666666,
    "context_recall":1.0,
    "faithfulness":1.0,
    "answer_relevancy":0.4702373504
  },
  {
    "user_input":"陈和阿米娅的关系如何？",
    "retrieved_contexts":[
      "# 阿米娅\n\n# 其他名称\n\n魔王;小小的魔王;异族的稚儿;异族的魔王;小兔子;温柔的孩子;娇小的卡特斯;新的魔王;我王;卡特斯女孩;文明的存续的继承者;巴别塔的领导者;阿米娅小姐;兔子小姐\n\n## 简要介绍\n\n阿米娅是罗德岛制药公司的公开领袖，一位充满理想与坚韧的卡特斯少女。她在一场车祸中失去双亲并感染矿石病，后被失忆前的博士救下，并与特蕾西娅、凯尔希共同组建巴别塔。特蕾西娅遇刺后，阿米娅继承了萨卡兹“魔王”的王冠与力量，肩负起终结感染者苦难、切断仇恨循环的使命。她拥有感知他人情感的独特源石技艺。尽管外表柔弱，阿米娅在博士和凯尔希的陪伴下，带领罗德岛穿越泰拉的动荡，直面萨卡兹的千年宿命与维多利亚的战火，展现出超越年龄的智慧、勇气与对和平的坚定追求，是罗德岛理念的核心象征。\n\n## 相关角色\n\n- 博士阿米娅最信任的伙伴，罗德岛的最高指挥官。博士是阿米娅的救命恩人、精神支柱和最重要的同伴。阿米娅将自己早年的野外生存技能归功于博士，并对他抱有无条件的信任与依赖，多次舍身保护他，甚至在极端危机中将罗德岛指挥权托付。博士的回归是阿米娅做出的“豪赌”，两人共同承担罗德岛的使命，并约定无论未来如何都将并肩作战，阿米娅更誓言若博士误入歧途，她将是唯一能阻止他的人。\n- 凯尔希罗德岛的资深医生与重要成员，阿米娅的导师和引路人。她在特蕾西娅遇刺后，成为阿米娅成长路上的关键指引者，密切关注阿米娅对“魔王”力量的适应与使用，并为其提供战略支持与医疗保障。阿米娅信任凯尔希的判断，但也体恤她的辛劳，有时选择独自承担压力。凯尔希视阿米娅为罗德岛的未来，并与她共同描绘感染者的希望。\n- 特蕾西娅前任“魔王”，巴别塔的领袖，阿米娅力量与意志的来源。她如慈母般关爱幼年阿米娅，并在遇刺前将“黑王冠”和“文明的存续”力量传承给阿米娅，希望她改写宿命。特蕾西娅的幻影与意志多次在阿米娅的梦境和精神深潜中显现，指引她理解萨卡兹的苦难，并最终在“慈悲灯塔”活动中完成力量的正式传承，让阿米娅明确了作为“魔王”的使命。\n- 煌罗德岛精英干员，阿米娅的亲密战友和朋友。阿米娅信任煌的战斗力，也关心她的情感状态，在她迷茫时给予支持和鼓励，并会以请吃咖喱等方式安抚。煌亲昵地称呼阿米娅为“小兔子”，对阿米娅忠诚且听从指挥。\n- 陈龙门近卫局警司，阿米娅的朋友与合作者。两人在切尔诺伯格与龙门危机中并肩作战，阿米娅理解陈的坚韧与内心的挣扎，并在危急时刻与其情感共鸣，掌握了陈的剑术。阿米娅对陈的态度从最初的“严格”到后来的信任与相互理解。\n- 塔露拉整合运动领袖，陈晖洁的姐姐。阿米娅在切尔诺诺格核心城与被科西切操控的塔露拉进行了决定性对决，通过感知与呼唤唤醒了塔露拉本身的意志，帮助她摆脱了科西切的诅咒。两人之间的纠葛远未结束，阿米娅预感她们终将重逢。\n- 梅菲斯特整合运动干部，手段残忍。阿米娅对其非人道行为深感厌恶和愤怒，直斥其恶毒，并拒绝赋予他任何“光荣”的死亡。阿米娅多次与他交锋，并誓言清理其“怨恨的毒”。\n- 霜星整合运动雪怪小队队长。阿米娅通过感知情感，理解了霜星内心深处的痛苦与愤怒，并试图用罗德岛的理念感化她。霜星在濒死之际将希望托付给阿米娅，阿米娅则将一种治疗霜冻的药物命名为“霜星”以作纪念。\n- 爱国者整合运动温迪戈战士。阿米娅在“苦难摇篮”中与爱国者对峙，感知到他两百多年的痛苦与悔恨，并试图为他带来“更好的结局”。爱国者在生命的最后识破了阿米娅“魔王”的身份，并将停止核心城的秘钥托付给她，感叹“我王......你往何处去？”。\n- W前巴别塔佣兵，后加入整合运动。她对阿米娅与博士抱有复杂情感，既是搅局者也是合作者。W曾嘲讽罗德岛干员的牺牲“毫无价值”，被阿米娅愤怒驳斥。在关键时刻，她协助罗德岛停止切尔诺伯格，并最终在特蕾西娅的引导下放下过去，成为“维什戴尔”。\n- **Logos**：罗德岛精英干员，女妖王庭之主。他忠实地追随特蕾西娅的理想，并坚定地保护阿米娅。在对抗血魔大君和萨卡兹众魂时，Logos与阿米娅并肩作战，其“丧钟”力量与阿米娅的“魔王”力量产生共鸣，是阿米娅信赖的战友。\n- 暴行罗德岛精英干员，阿米娅的亲密朋友与如同姐姐般的存在。她幼年时曾照顾阿米娅，对她充满牵挂。得知阿米娅成为罗德岛领袖后，暴行被其感召，决定加入罗德岛，誓言倾尽所有力量保护阿米娅。阿米娅也依赖她，并与她分享生活乐趣。\n- 华法琳罗德岛资深医生。她曾是阿米娅在罗德岛的“第一个病人”，密切关注阿米娅的身体和精神健康，并提醒她控制“魔王”力量的使用。她对阿米娅的成长抱有深切的期望，希望她能活着回来。\n- 迷迭香罗德岛精英干员，与阿米娅关系深厚。阿米娅能通过精神链接安抚迷迭香的负面情绪，并对她抱有极高的尊重与关心。迷迭香将阿米娅视为亲近的家人。\n- 米莎一个乌萨斯感染者少女，被整合运动利用。阿米娅在",
      "# 二次呼吸\n\n# 剧情总结\n\n本次活动剧情紧密承接主线第三章，主要围绕罗德岛与龙门近卫局联合追捕被整合运动劫走的感染者少女米莎展开。故事始于罗德岛与近卫局在龙门会合。近卫局长官陈向阿米娅透露，米莎的父亲曾是切尔诺伯格的要人，米莎可能掌握着切尔诺伯格的重要资料，这正是整合运动劫持她的原因。为了阻止整合运动利用米莎，罗德岛与近卫局达成合作，由近卫局主攻，罗德岛负责搜索和突袭。\n\n追捕过程中，近卫局遭遇整合运动埋伏并被冲散，米莎被整合运动干部W劫走。陈和阿米娅分析了整合运动的撤退路线，发现他们留下了殿后部队。近卫局试图通过审讯被俘的整合运动成员获取情报，但未果。特别督察组的星熊赶来支援，她提到自己被一个“心不在焉”的整合运动成员拖住了。罗德岛决定由企鹅物流的能天使和德克萨斯作为先遣侦察，她们成功追踪到了整合运动的临时据点。\n\n同时，米莎在整合运动的据点中与她失散多年的弟弟——现已改名“碎骨”的感染者重逢。碎骨对切尔诺伯格和普通人的仇恨深重，向米莎讲述了感染者在乌萨斯遭受的苦难，试图说服米莎加入整合运动。米莎对碎骨的剧变感到陌生和悲伤，不认同整合运动的暴力行为，但也对感染者的困境表示理解和同情。碎骨试图教米莎使用感染者力量和武器。\n\n企鹅物流二人组在整合运动据点外制造混乱，吸引了大部分敌人注意力，为罗德岛和近卫局的后续行动创造条件。罗德岛大部队在阿米娅的指挥下赶到战场。芙兰卡和雷蛇的黑钢小队负责先锋侦察，发现整合运动利用废弃矿场地形设下埋伏。尽管埋伏被看破，但碎骨利用这个机会对藏在后方的博士发动了突袭。星熊及时用盾牌挡住了第一击，而阿米娅在关键时刻爆发了强大的力量，击溃了碎骨，但他并未立即死亡。\n\n碎骨的倒下让周围的整合运动成员震惊，他们不顾危险，折返回来试图抢回碎骨的尸体。W利用爆炸物和闪光弹干扰近卫局和罗德岛，并成功将一个移动电话交给了阿米娅后撤离。电话中传来了米莎的声音，她听着整合运动成员因碎骨受伤而痛苦绝望的声音，回忆起弟弟当年被带走的情景和切尔诺伯格对感染者的残酷。米莎在痛苦和愧疚中做出了决定，她认为感染者与普通人之间的互相报复是切尔诺伯格当年对感染者的残酷造成的恶果，并表示自己作为一个感染者，选择站在感染者这边，与罗德岛告别。\n\n米莎的决定让阿米娅深受打击和困惑。陈及时制止了阿米娅的动摇，强调了任务目标和作为执法者的立场，命令部队继续行动。罗德岛与近卫局重新部署，由陈、星熊、芙兰卡、雷蛇组成一支小队与罗德岛另一支小队（由阿米娅和企鹅物流带领）分头突袭整合运动的矿场据点。芙兰卡和雷蛇展现了专业的战斗和侦察能力，与星熊配合攻破了敌方防线。然而，当他们进入据点内部搜索米莎时，却只发现了整合运动的残兵和——本应死去的碎骨。\n\n碎骨不知为何重新站了起来，虽然状态不佳，但他重新出现极大地振奋了整合运动残兵的士气。碎骨选择留下来断后，让其他整合运动成员撤离，表现出了对同伴的保护。阿米娅见到碎骨复活，再次感到震惊和无法理解。在最后的战斗中，碎骨与罗德岛和近卫局浴血奋战。阿米娅试图与碎骨交流，但碎骨只认出了她并提到了“命运”。陈打断了阿米娅，强调了这是作为执法者必须结束的局面。最终，碎骨在战斗中再次倒下。\n\n战斗结束后，陈与阿米娅进行了一段对话。陈以务实的角度看待整合运动的死亡，认为这是他们自己选择的结果，没有人有资格去阻止或责怪，但同时她也指出阿米娅留下碎骨面具的行为是有意义的。她告诉阿米娅，罗德岛的选择是仁慈，而近卫局的选择是执法，两者不同，但都需要承担后果。阿米娅对整合运动成员，特别是碎骨和米莎的命运感到痛苦和迷茫，质疑罗德岛所做是否正确，以及是否能打破仇恨的循环。陈肯定了阿米娅试图改变现状的努力，但提醒她仁慈需要付出代价，并让她做出自己的选择并承担结果。最后，W在一旁观察着一切，认为尽管发生了意外，但接下来的事情仍然值得期待。罗德岛和近卫局各自带着复杂的心情结束了这次行动。\n\n## 剧情高光\n\n- 陈向阿米娅解释米莎的重要性：\n陈：“我们调查了米莎相关的情报，有一条情报指出，她的父亲是切尔诺伯格的要人之一。”\n陈：“谁都不会知道有多少—— 除了米莎本人。”\n- 碎骨与米莎重逢，碎骨充满仇恨的控诉：\n碎骨：“毁灭切尔诺伯格——？作为复仇，太轻了，太轻了......”\n碎骨：“我们被人恐惧，被人愚弄，被人侮辱，被人迫害—— 只因我们是感染者。”\n- 碎骨试图说服米莎接受感染者力量：\n碎骨：“想象一下...... 来，握住这颗源石。”\n碎骨：“你一定可以的。我在你身上感到了和我相同的东西。”\n- W引导碎骨对博士进行战术打击：\nW：“就是兔子身边那个，带着兜帽的家伙。”\nW：“只要杀掉他，喀！ 罗德岛的大脑就坏死了。”\n- 星熊为博士挡下碎骨的突袭：\n星熊：“博士！！快趴下！！！ 这群人......真是不择手段！”\n星熊：“这面‘般若’",
      "# 陈\n\n# 其他名称\n\n陈晖洁;老陈;扑街龙;陈警司;假日威龙陈;赤刃明霄陈;陈陈\n\n## 简要介绍\n\n陈，本名陈晖洁，前龙门高级警司、近卫局特别督察组组长。她出身于大炎权贵陈氏家族，毕业于维多利亚皇家近卫学校，不仅是战术素养卓越的指挥官，更是手持名剑“赤霄”的顶尖剑士。在龙门保卫战与切尔诺伯格事件中，她经历了与舅舅魏彦吾的决裂以及与亲姐姐塔露拉的宿命对决。离开龙门后，陈以罗德岛干员及游侠的身份游历泰拉大地，通过在多索雷斯、维多利亚及百灶的亲身见证，她逐渐从一个死板的程序正义维护者成长为一名通达、务实且坚定的公义践行者。\n\n## 相关角色\n\n-   魏彦吾陈的舅舅。他教导了陈赤霄剑法，但也因其复杂的政客手腕和对贫民区感染者的冷酷清理，导致陈与其决裂。\n-   塔露拉陈同母异父的亲姐姐。两人幼年因科西切的阴谋分离，后在切尔诺伯格核心城展开决战。陈始终将其视为自己的责任。\n-   星熊陈在近卫局时期最信任的搭档与挚友，曾多次救陈于死地。陈称其为唯一能物理说服自己的盾牌。\n-   诗怀雅竞争对手与损友。两人见面便会爆发“龙门粗口”对骂，但在关键时刻始终互为后盾，共同守护龙门。\n-   阿米娅罗德岛领袖及挚友。阿米娅在战场上的坚持和理想深刻影响了陈，两人曾合力施展出赤霄剑意的“云裂之剑”。\n-   风笛近卫学校时期的校友。两人在维多利亚荒野结伴同行，风笛亲昵地称呼她为“陈陈”，是陈过去单纯时光的见证者。\n-   **林雨霞**：青梅竹马。两人在多索雷斯及玉门多次并肩作战，关系在互相拆台与默契配合之间维持着微妙平衡。\n-   九前上司与好友。九的感染与离去促使陈对龙门秩序产生怀疑，后两人在伦蒂尼姆作为不同立场的救助者重逢。\n\n## 详细介绍\n\n陈的生平轨迹是其对“公义”二字理解不断升华的过程。早年的陈晖洁在魏彦吾的严苛教导下成长，幼年时目睹姐姐塔露拉被掳走成为了她心中永恒的阴影。为了证明自己并寻找真相，她以全科目A的优异成绩从维多利亚皇家近卫学校毕业，并迅速加入龙门近卫局。早期的陈是一个典型的“工作狂”，她严谨、死板、甚至有些冷酷，试图通过绝对的程序正义来维持龙门的秩序。在一场爆炸中，她为了救人意外感染矿石病，却在魏彦吾的安排下隐瞒身份，这一隐患也为日后的决裂埋下了伏笔。\n\n在“切尔诺伯格-龙门”危机期间，陈面临了多重考验。她见证了线人阿发的牺牲，也识破了魏彦吾利用“黑蓑”特殊部队清理贫民窟感染者的阴暗行径。对陈而言，魏彦吾为了“大义”而牺牲个体的做法是不可原谅的。最终，在核心城撞击龙门的危急关头，陈公开了自己感染者的身份，辞去警司职务，以个人名义孤身登城挑战塔露拉。在阿米娅的协助下，她击败了被“黑蛇”操控的姐姐，并决定带其寻找真正的审判。\n\n离开龙门公职后，陈的足迹遍布泰拉。在多索雷斯度假期间，她被迫放下赤霄，改用水铳战斗。这次经历对她意义非凡：她学会了不再纠结于单一的手段，而是利用市长权限、实绩奖金等更务实的方法去驱动腐朽的执法机器，完成了从“理想主义者”到“实干家”的转变。随后，她与风笛在维多利亚的荒野中穿行，见证了底层感染者的挣扎与深池组织的崛起。\n\n回到大炎后，在百灶与玉门的危机中，陈彻底清算了家族往事。她揭开了陈家曾被政治扭曲的历史，并在与魏彦吾的对决中施展出超越以往的“天喟之剑”，以一种温和而有力的姿态阻止了兵戈。如今的陈，依然游历在长路之上。她不再是被血脉、职权或名剑束缚的“龙”，而是一名专注、清醒的观察者。她将“公平对待所有人”视为终身的工作，正如她在档案中所言，她从未离开龙门，只是在为这片大地寻找一个未来理应比此刻更好的答案。\n\n## 剧情高光\n\n1. **对线人的最后肯定**：在线人阿发临终前，陈给予了他作为龙门公民的尊严。\n> “阿发，你一直是、也永远是个龙门人。” (出自：活动剧情\/靶向药物)\n\n2. **决绝的别离之夜**：在魏彦吾面前公开感染者身份，并从百米高楼纵身跃下，彻底斩断旧日身份。\n> “我已经没必要再瞒下去了。……今天起，我们恩怨两消。” (出自：活动剧情\/苦难摇篮)\n\n3. **多索雷斯的逆袭**：在遭遇背叛与爆炸后，陈与林雨霞共骑自行车，以惊人的战术配合夺回冠军。\n> 陈与林雨霞共骑一辆自行车在巷道中飞驰，最终在林雨霞制造的“水上跳板”配合下，以一种近乎犯规的方式夺回第一。(出自：活动总结\/多索雷斯假日)\n\n4. **天喟之剑定乾坤**：在百灶危机中，陈以“天喟”之剑引发金黄风沙干扰系统，成功平息兵戈。\n> “那些即将被翻涌的风沙掩埋的记忆忽然变得鲜明……整座饱经风霜的城市都如同忽然被回忆攫住的老者一般……缓缓停下了脚步。” (出自：活动剧情\/辞岁行)\n\n5. **对幼年真龙的教诲**：在历史虚境中，陈对未来的掌权者播下了改变不公现状的种子。\n> “你应该记得的是，把一份非常大的权力，压到一",
      "# 阿米娅\n\n# 详细介绍\n\n阿米娅是泰拉大地上，罗德岛制药公司的公开领袖，一位年轻的卡特斯少女，却肩负着改变世界命运的重担。她身患矿石病，并继承了萨卡兹“魔王”的王冠与力量，致力于为感染者和所有受压迫者寻找一条通往希望的道路。\n\n**失落的童年与重获新生**\n阿米娅的童年始于雷姆必拓。在一次突如其来的车祸中，她失去了双亲，自己也染上了矿石病。在绝望与荒芜中，年幼的她被当时失忆前的博士偶然救起。博士不仅将她带离险境，更向她承诺会治愈她的疾病，为她带来一个充满希望的未来。这段经历是阿米娅生命的“最初坐标”，奠定了她对博士无与伦比的信任与依赖，她曾对博士说：“博士在哪，我就在哪。”（出自活动剧情“巴别塔”\/“悠长的旅途”）。\n随后，博士带着阿米娅抵达了巴别塔。在那里，她遇到了巴别塔的领袖、萨卡兹“魔王”特蕾西娅，以及资深医生凯尔希。特蕾西娅对阿米娅展现出如同母亲般的关爱与温柔，陪伴她，为她讲故事，并让巴别塔成为了阿米娅的新家。凯尔希则开始为阿米娅的矿石病制定治疗方案。在这段时期，阿米娅敏感地察觉到博士因过度劳累而变得不开心，担忧是自己的病情让他感到低落。\n\n**“魔王”的传承与觉醒**\n巴别塔与军事委员会的内战期间，特蕾西娅为了保护阿米娅，在遇刺的最后时刻，将象征着“黑王冠”和“文明的存续”的力量传承给了阿米娅，希望她能改写萨卡兹的悲惨结局，带领巴别塔走向未来。特蕾西娅的意识也短暂寄宿在阿米娅体内，向凯尔希传达了最后的嘱托。这一刻，年幼的阿米娅被赋予了沉重的“魔王”宿命。\n继承力量初期，阿米娅的精神状态曾一度棘手，会出现呓语、非自发读取他人情绪以及对力量控制不稳的情况，手上的戒指也成为抑制这份强大力量的“枷锁”。凯尔希和华法琳等罗德岛的医生们为此付出了巨大努力。\n\n**唤醒博士与切尔诺伯格的战火**\n在特蕾西娅遇刺后，博士进入了长达三年的休眠。阿米娅与凯尔希接管巴别塔，将其改组为罗德岛制药公司。三年后，阿米娅亲自带领小队深入乌萨斯城市切尔诺伯格，唤醒了失忆的博士。面对博士记忆的缺失，阿米娅坚定地自我介绍，强调博士是她“最重要的同伴”，并毫不犹豫地将罗德岛的指挥权托付给他，展现了她对博士无条件的信任。\n切尔诺伯格被整合运动攻占，罗德岛在撤离过程中，阿米娅目睹了整合运动的暴行，也亲历了平民对感染者的恐惧。她向博士解释矿石病的残酷，以及罗德岛为感染者争取生机的使命。她坚定地表示罗德岛的宗旨是“希望各位，都能绽放笑容”，并希望罗德岛能成为感染者的“温暖的家”。\n在龙门贫民区，阿米娅为保护博士，首次爆发力量击倒了整合运动的“碎骨”。然而，这让她陷入深深的自责与痛苦，质疑自己作为感染者领袖，却不得不夺走其他感染者生命的矛盾。她向博士倾诉内心的挣扎，但最终重申了保护博士的决心。米莎的死，以及她最终选择站到整合运动一边，让阿米娅对仇恨的循环有了更深刻的理解与悲哀。在与碎骨的第二次对决后，阿米娅收下了他的面具，象征着背负这份痛苦继续前行。\n在与整合运动领袖塔露拉的最终对决中，阿米娅通过与陈晖洁的情感共鸣，解开一枚戒指的束缚，觉醒了“近卫”形态的力量——“云裂之剑-影霄”。她直面“不死的黑蛇”科西切对塔露拉的操控，揭露其谎言，最终成功唤醒了塔露拉本身的意志，帮助她摆脱了诅咒。战后，阿米娅因巨大压力和情绪释放而昏倒，凯尔希抽取博士的血液制造药物并为他注射，醒来后她流下了久违的眼泪，并命名了一种治疗霜冻的药物为“霜星”，以纪念那些牺牲的战士。她向博士重申，无论未来多艰难，罗德岛都会前行，如果博士有一天误入歧途，她将是唯一能阻止他的人。\n\n**维多利亚的战火与“魔王”之路的抉择**\n随着罗德岛前往维多利亚伦蒂尼姆，阿米娅的“魔王”身份和力量得到了更深层的展现与考验。她能感知到伦蒂尼姆中心盘桓的“更古老的......更强大的力量”，以及萨卡兹万年来的悲愤与仇恨。在与血魔大君的交锋中，她被萨卡兹众魂的集体记忆冲击，亲身感受了萨卡兹历史上的苦难与对凯尔希的复仇渴望，痛苦不堪，但她拒绝被仇恨吞噬，坚称“戒指不行，我可以。我不是器具。”（出自慈悲灯塔 \/ 应对饱和打击）\n在“惊霆无声”活动中，阿米娅梦见了萨卡兹掌控下维多利亚的悲惨未来，这让她对“魔王”的使命感到迷茫。她被“灰礼帽”确认为“魔王”，并被死魂灵质疑其作为“异族魔王”的资格。但阿米娅选择直面所有苦难，坚定地拒绝了死魂灵所代表的永恒仇恨之路，她的这种“能拒绝”仇恨的特质，被博士肯定为她作为“魔王”的独特与必要之处。\n在“破碎日冕”中，阿米娅在列车上意外亲眼见到了活着的、白发萨卡兹形态的特蕾西娅。这一幕给她带来了前所未有的震惊与悲哀，让她坚定了追寻真相的决心：“既然我来到了这里，那我就需要弄清楚真相。”（出自破碎日冕\/理想的倒影）\n最终，在“慈悲灯塔”活动中，阿米娅与博士、凯尔希、W等深入“阿喃那”内部形成的",
      "# 急性衰竭\n\n# 剧情总结\n\n本次活动剧情名为“急性衰竭”，故事围绕罗德岛干员阿米娅近期表现出的疲惫与迷茫，以及切尔诺伯格一座被废弃的分城中发现的异常情况展开。\n\n剧情始于阿米娅完成任务回到罗德岛，显得非常疲惫。凯尔希医生对她的健康，特别是她所戴的戒指表示担忧，并暗示这与阿米娅的身体状况和力量有关。凯尔希告诫博士，要小心避免让阿米娅置身过于危险的环境，并让她适当休息。阿米娅向博士倾诉了她的迷茫和疲惫，无法理解为何总是看着可以被拯救的人们在她眼前消逝，感到肩负的责任沉重，但她也表示不会放弃。\n\n与此同时，凯尔希为罗德岛安排了新的紧急任务：探索一座位于龙门城外、疑似从切尔诺伯格事件中逃脱的废弃城区（代号“14号设施”）。任务目标是搜救幸存者、收集情报，并应对可能潜藏的整合运动。包括陨星、霜叶、杰西卡在内的多支罗德岛侦察小队被派往该区域。在出发前，黑钢干员芙兰卡、雷蛇以及企鹅物流的德克萨斯、能天使完成在罗德岛的任务，与阿米娅和博士告别，鼓励阿米娅休息。阿米娅决定先去龙门贫民区看看情况，尽管凯尔希和博士有顾虑，但阿米娅提及在龙门的干员红会协助，让博士稍微放心（尽管红并未在剧情中出现）。\n\n在废弃城区，陨星小队遭遇了整合运动成员，并发现这里的温度异常低。他们与凯尔希保持通讯，报告了整合运动的活动迹象。霜叶注意到废墟墙体在吸收热量，并联想到乌萨斯传说中的“雪怪小队”，一支以冰冷能力著称的感染者游击队。同时，杰西卡闻到一股烧焦的味道。\n\n在龙门贫民区，阿米娅遇到了一个活泼的感染者孩童，她帮助孩子抬起废品寻找留声机，孩子的乐观让她再次触动，但孩子的感染者身份也让她联想到那些遭受迫害、最终消逝的感染者同胞。她感到痛苦和无助，质疑自己能做什么，耳边响起剥夺感染者身份的冰冷话语。就在她陷入悲伤时，脑海中闪过温馨的回忆和另一个少女的声音，以及她答应过某个人的诺言，这让她重新坚定。随后她看到了陈长官，陈似乎与平时不同，眼神复杂，她独自与一个小女孩交流后匆匆离开，对阿米娅的态度也异常冷淡，让阿米娅感到困惑。\n\n回到罗德岛后，阿米娅与博士交流，她认为陈长官也许也有自己的想法和责任，她们之间的隔阂可能没有那么大。阿米娅再次表达了她的决心，即使道路艰难，她也会承担一切后果并继续前进，并希望博士陪伴。此时，凯尔希传来通讯，侦察小队情况紧急。\n\n在废弃城区深处，陨星小队再次遭遇整合运动，并确认这支队伍与低温异常有关。他们潜伏观察时，温度再次急剧下降，他们确定这就是传说中的“雪怪小队”在行动。他们发现低温的源头是埋在墙角的黑色源石。正当陨星小队紧张潜伏时，他们听到了梅菲斯特和W的对话，得知整合运动在等待“爱国者”，且似乎在进行某种“钓鱼”行动。梅菲斯特发现了陨星小队，轻松压制了他们的反击。就在危急时刻，霜叶感觉到“雪怪们”来了，急忙让陨星和杰西卡撤退，并通过通讯向阿米娅发出警告“不要来”，但通讯随后中断。\n\n罗德岛的其他侦察小队也报告了遭受袭击和干员冻伤的情况，通讯陆续中断。凯尔希和阿米娅意识到情况严重。阿米娅向在场的陈和星熊提出罗德岛与近卫局联合行动。陈最初拒绝，认为感染者身份的阿米娅不适合在贫民区行动，且近卫局有自己的决定。然而，面对不断恶化的情报（侦察小队遭遇重创、整合运动规模庞大），陈最终同意合作，但强调近卫局仍将以处理整合运动为优先任务，并会见机行事。凯尔希告知阿米娅，除了陨星小队外，其他侦察小队已被救援，但都有冻伤。陨星小队所在区域罗德岛难以深入，只能依靠阿米娅。阿米娅决心独自带领罗德岛小队前往营救陨星她们，陈和星熊也立即整备出发。\n\n罗德岛和近卫局抵达废弃城区入口。星熊对城区的异常感到不解。阿米娅确认了陨星小队的坐标在更深处。就在这时，陈似乎看到了什么，独自一人快速追了过去。罗德岛和近卫局被一个异常强大的整合运动成员和源石生物阻拦。击退敌人后，陈已经不见踪影。由于前方的区域是天灾残留的源石丛生区，对健康人有害，星熊决定带领近卫局守住外围入口，让阿米娅带领感染者干员为主的罗德岛小队深入，并拜托阿米娅把陈带回来。凯尔希此时报告所有已撤离的罗德岛干员都有严重冻伤，证实了“雪怪”的存在和危险性。凯尔希也表示她要去处理一些事情（暗示她将和红一起行动）。\n\n阿米娅的队伍深入废墟，找到了陨星小队留下的战斗痕迹，确认了她们的行动方向和状态（霜叶的冻结伤口技巧、陨星的爆炸痕迹）。凯尔希再次通讯，确认所有其他侦察小队已被救出，但陨星小队仍在失联区域，且所有获救干员都有冻伤，再次强调了“雪怪”的特殊性。阿米娅表示理解。当他们继续前进时，退路被整合运动切断，但阿米娅表示她们的目的不是逃跑，而是营救同伴。凯尔希此时联系红，准备在贫民区东入口会合，表示两人足够应对整合运动。\n\n阿米娅的队伍找到了追踪陈的痕迹，发现陈独自击败了大量整合运动成员。陈承认自己冲动，可能中了陷阱，并表示"
    ],
    "response":"根据文档信息，陈和阿米娅是朋友、合作者与挚友。两人在切尔诺伯格与龙门危机中并肩作战，相互影响：阿米娅理解陈的坚韧与挣扎，并在危急时刻与其情感共鸣，掌握了陈的剑术；陈则认为阿米娅在战场上的坚持和理想深刻影响了自己，两人曾合力施展赤霄剑意。阿米娅对陈的态度从最初的“严格”发展为信任与相互理解。",
    "reference":"陈是龙门近卫局警司，阿米娅的朋友与合作者。两人在切尔诺伯格与龙门危机中并肩作战，阿米娅理解陈的坚韧与内心的挣扎，并在危急时刻与其情感共鸣，掌握了陈的剑术。",
    "context_precision":1.0,
    "context_recall":1.0,
    "faithfulness":1.0,
    "answer_relevancy":0.7028600005
  },
  {
    "user_input":"237-1号展柜文物是什么敌人？",
    "retrieved_contexts":[
      "# 237-1号展柜文物\n## 名称: 237-1号展柜文物\n## 敌人索引: GS5\n## 种类: —\n## 地位级别: 普通\n## 攻击类型: 近战 物理\n## 行动方式: 地面\n## 描述: 一种神奇的宝石构装体。它在博物馆供人参观的日子里，被认为是汲取井水的工具，而如今它背负着一块宝石走啊走。\n## 能力: ·在首个无结晶的地块上放下结晶，放下之后移动速度大幅提升\n## 出场关卡: AS-2 馆中特别行动AS-5 文物也上班AS-7 谁是宠物？AS-8 黄沙尽头AS-9 向过去告别AS-MO-1 愿我们寻得安详AS-TR-1 护卫队演练萨尔贡 大巴扎\n## 级别数据\n  - 级别: 0, 属性: {'最大生命值': 2800, '攻击力': 150, '防御力': 50, '法术抗性': 10, '移动速度': 1.0, '攻击间隔': 2.0, '元素抗性': 0, '元素损伤': 0}, 异常抗性: 沉默, 天赋&能力: 首次进入不包含结晶的地块时，在该地块中心召唤1个污染的结晶，随后移动速度+100%, 技能: []",
      "# 237-2号展柜文物\n## 名称: 237-2号展柜文物\n## 敌人索引: GS6\n## 种类: —\n## 地位级别: 普通\n## 攻击类型: 近战 物理\n## 行动方式: 地面\n## 描述: 一种神奇的宝石构装体。它在博物馆供人参观的日子里，被认为是建房搭梁的工具，而如今它拖拽着一块宝石跑啊跑。\n## 能力: ·在首个无结晶的地块上放下结晶，放下之后移动速度大幅提升\n## 出场关卡: AS-EX-2 被吹碎的镜子AS-EX-5 不幸的士兵AS-EX-8 无冕之王与朝圣者AS-MO-1 愿我们寻得安详AS-S-3 笔尖凝聚着愿景萨尔贡 大巴扎\n## 级别数据\n  - 级别: 0, 属性: {'最大生命值': 3500, '攻击力': 250, '防御力': 50, '法术抗性': 10, '移动速度': 1.0, '攻击间隔': 2.0, '元素抗性': 0, '元素损伤': 0}, 异常抗性: 沉默, 天赋&能力: 首次进入不包含结晶的地块时，在该地块中心召唤1个污染的结晶，随后移动速度+100%, 技能: []",
      "# 阿斯帕齐娅\n\n# 其他名称\n\n阿斯帕齐娅\n\n## 简要介绍\n\n阿斯帕齐娅是一位来自米诺斯赫里亚的历史学者和游客。她对米诺斯悠久的历史和文化怀有深厚的热情和敬意。在萨尔贡城市米纳特哈玛仪的旅行中，她对当地博物馆对米诺斯文物的展示方式感到不满，并决心追回遗失的家族金杯。她在城市遭遇危机的过程中，展现了原则性、学识以及意料之外的勇气，并与萨尔贡沙盗娜仁图亚产生了复杂而深刻的交集。她的旅途不仅关乎历史文物的寻回，更是一场关于文化、原则与人性的探索。\n\n## 相关角色\n\n-   娜仁图亚阿斯帕齐娅在米纳特哈玛仪救下的沙盗，两人在追逐金杯和应对城市危机的过程中产生了复杂的交集。她们的行事方式和价值观截然不同，却在冲突和理解中建立了一种独特的情谊。娜仁图亚最终将博物馆的金杯赠予阿斯帕齐娅。\n-   **阿娜特**：米纳特哈玛仪博物馆的代理馆长。阿斯帕齐娅在城市危机中协助阿娜特稳定博物馆局势，并利用自己的历史知识帮助她通过了构造体的考验。\n-   梅捷缇克缇米纳特哈玛仪博物馆的副馆长。阿斯帕齐娅与梅捷缇克缇和阿娜特一同应对博物馆的危机。\n-   佩佩帕夏之女。娜仁图亚曾计划利用宝石绑架佩佩，阿斯帕齐娅得知后对此表示反对。危机解决后，阿斯帕齐娅在博物馆区域再次见到与娜仁图亚一同脱险的佩佩。\n-   **无名将领（祖拜尔）**：引发米纳特哈玛仪城市危机的幕后人物。他的行动导致大量构造体出现和城市地面流沙化，阿斯帕齐娅因此被卷入危机。\n\n## 详细介绍\n\n阿斯帕齐娅来自遥远的米诺斯赫里亚，是一位专注于历史研究的学者。她对于自己的米诺斯身份以及故乡悠久灿烂的文化感到无比自豪，并将其视为自己生命中最重要的部分。在她看来，历史并非仅仅是泛黄的古卷或冰冷的文物，而是流淌着先辈荣耀与智慧的活水，是塑造个体身份和民族精神的基石。她将研究历史视为一种使命，是为了寻找被遗忘的过去，更是为了对抗那些试图用强权抹杀或歪曲历史的傲慢。\n\n带着这份对历史的执着与敬意，阿斯帕齐娅以游客身份来到了萨尔贡的城市米纳特哈玛仪。她此行的重要目的之一是拜访这座城市的博物馆，因为她听说这里收藏了一些与米诺斯文明相关的文物。然而，博物馆的展陈方式令她深感失望和愤慨。在她看来，萨尔贡人对米诺斯历史的呈现充满了偏见与不尊重，尤其是她家族中一对极具意义的金杯之一，竟然被随意地摆放在展柜中。这对金杯不仅承载着她家族的历史与记忆，更曾因遗失给她的家族带来深重的苦难。看到家族珍宝受此“轻慢”，阿斯帕齐娅当即决定要将其带回米诺斯。\n\n就在阿斯帕齐娅准备行动之际，城市突然发生了由“无名将领”祖拜尔引发的巨大危机。博物馆内的构造体被激活，城市地面开始出现流沙，地下水道也被侵蚀。面对突如其来的混乱，阿斯帕齐娅并未只顾自己的目标，而是展现出了一个米诺斯人应有的担当——她冷静地引导游客疏散，确保大家的安全，甚至为了帮助他人而暂时放弃了带走金杯的计划。在这次混乱中，她偶然救下了从高楼坠落的萨尔贡沙盗娜仁图亚，两人的命运轨迹从此交织。\n\n娜仁图亚的出现，为阿斯帕齐娅的旅程带来了新的变数。尽管两人的背景、价值观和行事风格南辕北辙——阿斯帕齐娅信奉原则、荣誉与公正，而娜仁图亚则更倾向于实用主义和非传统手段——她们却在相互碰撞与了解中逐渐建立了一种复杂的关系。娜仁图亚试图雇佣或利用阿斯帕齐娅，而阿斯帕齐娅则在一定程度上“效劳”对方，但始终坚守自己的道德底线。\n\n通过娜仁图亚，阿斯帕齐娅得知了即将举行的丰获集会，并在宣传册上惊喜地发现，另一只与博物馆中那只金杯成对的家族金杯，竟然将作为比赛的第三名奖品。她视此为命运的指引，决心参与比赛，赢回这只金杯，让两只金杯得以重聚。她以自己多年来在米诺斯各项体育竞赛中获得的十枚银牌作为参赛宝物，这些银牌在她看来代表着米诺斯传统文化和她个人的荣誉与努力。尽管娜仁图亚建议她可以采取一些“非常规”手段确保胜利，阿斯帕齐娅断然拒绝，强调自己只会光明磊落地竞争，绝不让家族蒙羞。最终，她凭借自己的实力和荣誉，赢得了第三名的奖品，但按照集会规则，奖品和参赛宝物都需要献祭给河流。她获得了第二名的奖品（一颗宝石），而本应属于她的金杯（因其他选手的退赛，顺延给了第四名）则被献祭。\n\n虽然金杯被献祭，但阿斯帕齐娅并未气馁。她在赛后找到了赢得金杯的那位收藏家，凭借自己深厚的米诺斯历史知识以及对金杯非凡意义的深刻阐述，成功说服对方将金杯转让给了她。这一刻，她不仅赢回了家族的珍宝，更证明了历史与文化的力量。\n\n然而，好不容易找回一只金杯的阿斯帕齐娅，却意外地偷听到了娜仁图亚及其手下的对话，得知娜仁图亚计划利用她赢得的宝石去绑架帕夏之女佩佩。这一发现让阿斯帕齐娅震惊不已。她立刻与娜仁图亚对质，明确表示自己无法认同这种行为，并试图以一种“无愧于良心”的方式帮助娜仁图亚解决困境，例如提供经济上的援助。这次对话深入揭",
      "# 太阳甩在身后\n \n\n\n\n\n## 剧情总结\n本次活动故事发生在萨尔贡的“辉煌之城”米纳特哈玛仪，围绕即将到来的“漫灌节”及其相关的历史与传统展开。故事核心是帕夏之女、年轻的史学家佩佩，她为了竞争家族世代传承的沙尔-阿加德史官职位，前来博物馆寻求帮助。史官职位意味着有机会进入传说中的黄金之城，记录萨尔贡的伟大历史，但这通常需要超越佩佩哥哥的资历和父亲的认可。佩佩偶然发现了一处古代遗迹的线索，指向传说中沙阿路加萨尔古斯留下的宝库，并找到了一颗蕴含线索的宝石。她相信要找到宝库并证明自己的能力，需要借用博物馆的“镇馆之宝”——一具来自沙阿时代的无名将领遗体（后证实是祖拜尔）。\n\n博物馆代理馆长阿娜特是佩佩在学院时的朋友，性格认真，为首次负责的漫灌节特别展览感到非常紧张。副馆长梅捷缇克缇是另一位朋友，看似闲散，实则精明能干，负责商业运营和文物修复，她给了佩佩博物馆的通行证，让佩佩得以夜晚偷偷进入博物馆研究。佩佩在展馆中将自己的宝石放入祖拜尔空荡的胸腔，但没有立刻看到期待中的效果，便匆匆离开。\n\n与此同时，城中还活跃着其他人物：沙盗娜仁图亚，她因欠下巨额债务，带着手下阿雅吉和阿雅妮计划绑架佩佩获取赎金；来自米诺斯的学者阿斯帕齐娅，她来到米纳特哈玛仪是为了寻找被掠夺并流失到这里的米诺斯文物，尤其是一对金杯。阿斯帕齐娅对博物馆的傲慢和不尊重其他文明历史的态度感到不满，但也努力寻找线索。\n\n漫灌节特别展览开幕式上，阿娜特紧张地进行演讲。然而，佩佩放入宝石的祖拜尔突然复活，引起巨大恐慌。游客四散奔逃，阿娜特惊吓昏倒。佩佩趁乱将祖拜尔和阿娜特转移到馆长办公室。娜仁图亚原本计划趁乱绑架佩佩，却被觉醒的祖拜尔意外地从窗户扔了出去。梅捷缇克缇则在疏散游客时，遇到了博物馆中其他Animating的宝石构装体，以及拉恕尔的宠物——兽主米奥，米奥似乎与这些异常现象有关。阿斯帕齐娅在迷路的游客指引下，意外发现“东北部分支”展厅（实为米诺斯文物展区），对文物的陈列混乱和介绍缺失感到痛心，决心要将它们带回米诺斯，但在博物馆紧急闭馆时未能如愿。\n\n在馆长办公室，祖拜尔在佩佩放入阿娜特提供的另一颗宝石后，开始用略显生涩的语言交流。他透露自己是沙阿的御前护卫军官祖拜尔，被沙阿赋予不朽躯体守护宝库，并等待梦魇哈兰杜汗的后裔（因沙阿与哈兰杜汗的约定）。他的记忆和宝库位置信息被分割在五颗宝石中。佩佩急于找到其他宝石，祖拜尔表示宝石间有引力，他能感知附近宝石的位置。佩佩和祖拜尔趁夜偷偷离开博物馆，来到大巴扎寻找。祖拜尔对现代世界的景象感到好奇，但无法感知到附近的宝石。他们发现了丰获集会的宣传单，其中二等奖奖品正是一颗带有沙阿印记的宝石。\n\n故事进入漫灌节的丰获集会。佩佩计划用家族传家宝——一只黄金拖鞋争取二等奖。她利用史官家族的影响力，巧妙地与裁判们周旋，确保自己的得分刚好落在第二名。娜仁图亚从昏迷中醒来，被阿斯帕齐娅救助。她对阿斯帕齐娅感到钦佩，试图招揽她为手下。阿斯帕齐娅在集会手册上看到三等奖是另一只米诺斯金杯（与她家族遗失的成对），决心赢得它。娜仁图亚帮助阿斯帕齐娅影响裁判，让她获得高分。最终，佩佩以微弱劣势暂列第二，阿斯帕齐娅暂列第三。然而，获得第一名的拉沙德意外打碎了自己的展品并弃权，导致佩佩获得第一，阿斯帕齐娅获得第二。比赛规定前三名展品要沉入河中祭祀，佩佩和阿斯帕齐娅各自的珍宝都沉入了河底。\n\n集会结束后，阿斯帕齐娅对娜仁图亚说，她现在不需要金杯了，因为得到认可就够了，并想把她获得的第二名奖品（宝石）扔进河里。娜仁图亚阻止了她，并借走了宝石，决定用它作为诱饵再次绑架佩佩。佩佩收到了匿名信，约她去取宝石，阿娜特劝她不要冒险。娜仁图亚的手下阿雅吉和阿雅妮守在约定的房间外。拉恕尔的宠物米奥避开陷阱，偷走了娜仁图亚放在桌上的宝石，并将它带到了梅捷缇克缇那里。梅捷缇克缇意外得到了这颗宝石，她向佩佩和阿娜特提出条件：她交出宝石，但佩佩必须支持她将祖拜尔作为会活动的展品展出，以吸引游客，为博物馆赢得投资和关注。佩佩为了获得宝石同意了。\n\n祖拜尔作为“会动的展品”再次被展出，吸引了大量猎奇的游客，场面混乱不堪。游客们对祖拜尔的无礼和不敬触怒了祖拜尔，他与佩佩争执，认为自己不是展品，有自己的意志。失望和愤怒之下，祖拜尔独自离开了博物馆。佩佩因未能获得所需的宝石线索，且被无数前来“献宝”的富人烦扰，感到沮丧。她与阿娜特交流，阿娜特意外透露佩佩的弟弟已提前两个月进入黄金之城担任史官。佩佩意识到弟弟此举是为了阻止自己步入那个无法离开的牢笼，两人的竞争实则是以另一种方式关心彼此。佩佩也坦承自己并非完全渴望史官的光荣，而是不想让弟弟孤身一人承担这份职责，这让她对自己的执念产生动摇。\n\n失魂落魄的娜仁图亚来到河边，与祖拜尔相遇。他们交流了彼此的困境和对过去的看法，娜仁图亚被祖拜尔的“死而复生”",
      "# 市井盗贼\n## 名称: 市井盗贼\n## 敌人索引: GS1\n## 种类: —\n## 地位级别: 普通\n## 攻击类型: 近战 物理\n## 行动方式: 地面\n## 描述: 常见于萨尔贡城镇的盗贼。他们往往拥有着最基础的装备，只在必要的时候发动攻击。\n## 能力: ·位于结晶上时，移动速度大幅提升\n## 出场关卡: AS-1 节前热身AS-2 馆中特别行动AS-3 相约大巴扎AS-4 家传金拖鞋AS-5 文物也上班AS-6 过往云烟AS-7 谁是宠物？AS-8 黄沙尽头AS-9 向过去告别AS-MO-1 愿我们寻得安详AS-TR-1 护卫队演练IG-12 大巴扎巡礼IG-EX-12 大巴扎巡礼VEC-01 此面朝上萨尔贡 大巴扎\n## 级别数据\n  - 级别: 0, 属性: {'最大生命值': 4000, '攻击力': 320, '防御力': 100, '法术抗性': 10, '移动速度': 1.0, '攻击间隔': 2.0, '元素抗性': 0, '元素损伤': 0}, 天赋&能力: 位于结晶所在地块时，移动速度+90%, 技能: []"
    ],
    "response":"237-1号展柜文物是名为“237-1号展柜文物”的敌人，敌人索引为GS5，地位级别为普通，攻击类型为近战物理，行动方式为地面。其能力是在首个无结晶的地块上放下结晶，之后移动速度大幅提升。",
    "reference":"237-1号展柜文物种别是普通级别敌人，攻击类型为近战物理，行动方式为地面。它是一种奇妙的宝石构装体，曾在博物馆供人参观。",
    "context_precision":0.9999999999,
    "context_recall":1.0,
    "faithfulness":1.0,
    "answer_relevancy":0.8721617668
  }
]